keyword,title,listing_url,item_number,sku,price,currency,min_order_quantity,max_order_quantity,description,seller_name,seller_profile_url,seller_rating,seller_total_reviews,seller_business_name,seller_country,seller_address,scraped_at,last_updated
hair dryer,Virgin BrazilianHairSeamless Human RemyHairClip in Extensions,https://shangkaihair.en.made-in-china.com/product/qycJSOmCGbVF/China-Virgin-Brazilian-Hair-Seamless-Human-Remy-Hair-Clip-in-Extensions.html,qycJSOmCGbVF,qycJSOmCGbVF,58.0,USD,1,,"Virgin BrazilianHairSeamless Human RemyHairClip in ExtensionsUS$ 58-128/ Piece1 Piece(MOQ)Juancheng Shangkai Hair Products FactoryJuancheng Shangkai Hair Products FactoryDiamond MemberAudited SupplierSecured TradingShandong, ChinaManufacturer/Factory & Trading CompanyEnjoy trading protection from Made-in-China.comView larger video & image5(5.0)""Helpful Service""Helpful Service",Juancheng Shangkai Hair Products,https://shangkaihair.en.made-in-china.com,5.0,5.0,Factory & Trading Company,"Shandong, China","2nd Human Hair Industry,Juancheng, Heze",2025-08-12T13:59:28.224199,
hair dryer,Top Quality Hot Selling Unprocessed 100% Human Virgin Remy Silk Straight Indian Seamless Clip inHairExtensions,https://shangkaihair.en.made-in-china.com/product/INWmvsQOkMkh/China-Top-Quality-Hot-Selling-Unprocessed-100-Human-Virgin-Remy-Silk-Straight-Indian-Seamless-Clip-in-Hair-Extensions.html,INWmvsQOkMkh,INWmvsQOkMkh,28.0,USD,1,,"Top Quality Hot Selling Unprocessed 100% Human Virgin Remy Silk Straight Indian Seamless Clip inHairExtensionsUS$ 28-88/ Piece1 Piece(MOQ)Juancheng Shangkai Hair Products FactoryJuancheng Shangkai Hair Products FactoryDiamond MemberAudited SupplierSecured TradingShandong, ChinaManufacturer/Factory & Trading CompanyEnjoy trading protection from Made-in-China.comView larger video & image5(5.0)""Great Customer Service""Great Customer Service",Juancheng Shangkai Hair Products,https://shangkaihair.en.made-in-china.com,5.0,5.0,Factory & Trading Company,"Shandong, China","2nd Human Hair Industry,Juancheng, Heze",2025-08-12T13:59:29.248332,
hair dryer,Automatic Pasta Macaroni Machine Making Line Screw Fried Snack Pellets Food Machinery / Snack Pellet Processing Line / Pasta Macaroni Making Machine,https://sunward.en.made-in-china.com/product/uKqJgUeYqVrQ/China-Automatic-Pasta-Macaroni-Machine-Making-Line-Screw-Fried-Snack-Pellets-Food-Machinery-Snack-Pellet-Processing-Line-Pasta-Macaroni-Making-Machine.html,uKqJgUeYqVrQ,uKqJgUeYqVrQ,35000.0,USD,1,,"Automatic Pasta Macaroni Machine Making Line Screw Fried Snack Pellets Food Machinery / Snack Pellet Processing Line / Pasta Macaroni Making MachineUS$ 35000/ Piece1 Piece(MOQ)Jinan Sunward Machinery Co., Ltd.Jinan Sunward Machinery Co., Ltd.Diamond MemberAudited SupplierSecured TradingShandong, ChinaManufacturer/Factory & Trading CompanyEnjoy trading protection from Made-in-China.comView larger video & image","Jinan Sunward Machinery Co., Ltd.",https://sunward.en.made-in-china.com,,,Jinan Sunward Machinery Co.,"Shandong, China","2504 Room, Shanxin Mansion, Huaiyin District",2025-08-12T13:59:34.244281,
hair dryer,"High Quality Macaroni Machine, Pasta Making Machine, Macaroni Production Line Large Scale Commercial Pasta Extruder Machine Production Line",https://sunward.en.made-in-china.com/product/NCtxGcVKAyhL/China-High-Quality-Macaroni-Machine-Pasta-Making-Machine-Macaroni-Production-Line-Large-Scale-Commercial-Pasta-Extruder-Machine-Production-Line.html,NCtxGcVKAyhL,NCtxGcVKAyhL,32000.0,USD,1,,"High Quality Macaroni Machine, Pasta Making Machine, Macaroni Production Line Large Scale Commercial Pasta Extruder Machine Production LineUS$ 32000-35000/ Set1 Set(MOQ)Jinan Sunward Machinery Co., Ltd.Jinan Sunward Machinery Co., Ltd.Diamond MemberAudited SupplierSecured TradingShandong, ChinaManufacturer/Factory & Trading CompanyEnjoy trading protection from Made-in-China.comView larger video & image","Jinan Sunward Machinery Co., Ltd.",https://sunward.en.made-in-china.com,,,Jinan Sunward Machinery Co.,"Shandong, China","2504 Room, Shanxin Mansion, Huaiyin District",2025-08-12T13:59:35.863522,
hair dryer,Italian Pasta Making Machine Macaroni Making Machine,https://sunward.en.made-in-china.com/product/usaQAKkdLjhC/China-Italian-Pasta-Making-Machine-Macaroni-Making-Machine.html,usaQAKkdLjhC,usaQAKkdLjhC,35000.0,USD,1,,"Italian Pasta Making Machine Macaroni Making MachineUS$ 35000/ Piece1 Piece(MOQ)Jinan Sunward Machinery Co., Ltd.Jinan Sunward Machinery Co., Ltd.Diamond MemberAudited SupplierSecured TradingShandong, ChinaManufacturer/Factory & Trading CompanyEnjoy trading protection from Made-in-China.comView larger video & image","Jinan Sunward Machinery Co., Ltd.",https://sunward.en.made-in-china.com,,,Jinan Sunward Machinery Co.,"Shandong, China","2504 Room, Shanxin Mansion, Huaiyin District",2025-08-12T13:59:37.317243,
hair dryer,Easy Operate Pasta Macaroni Food Making Machinery,https://sunward.en.made-in-china.com/product/IsAnTRhVbCWK/China-Easy-Operate-Pasta-Macaroni-Food-Making-Machinery.html,IsAnTRhVbCWK,IsAnTRhVbCWK,35000.0,USD,1,,"Easy Operate Pasta Macaroni Food Making MachineryUS$ 35000/ Piece1 Piece(MOQ)Jinan Sunward Machinery Co., Ltd.Jinan Sunward Machinery Co., Ltd.Diamond MemberAudited SupplierSecured TradingShandong, ChinaManufacturer/Factory & Trading CompanyEnjoy trading protection from Made-in-China.comView larger video & image","Jinan Sunward Machinery Co., Ltd.",https://sunward.en.made-in-china.com,,,Jinan Sunward Machinery Co.,"Shandong, China","2504 Room, Shanxin Mansion, Huaiyin District",2025-08-12T13:59:38.814091,
hair dryer,New Design Industrial Extruder Italy Pasta Macaroni Making Machine 100 Kg/H,https://sunward.en.made-in-china.com/product/rNTJfLVvCshj/China-New-Design-Industrial-Extruder-Italy-Pasta-Macaroni-Making-Machine-100-Kg-H.html,rNTJfLVvCshj,rNTJfLVvCshj,35000.0,USD,1,,"New Design Industrial Extruder Italy Pasta Macaroni Making Machine 100 Kg/HUS$ 35000/ Piece1 Piece(MOQ)Jinan Sunward Machinery Co., Ltd.Jinan Sunward Machinery Co., Ltd.Diamond MemberAudited SupplierSecured TradingShandong, ChinaManufacturer/Factory & Trading CompanyEnjoy trading protection from Made-in-China.comView larger video & image","Jinan Sunward Machinery Co., Ltd.",https://sunward.en.made-in-china.com,,,Jinan Sunward Machinery Co.,"Shandong, China","2504 Room, Shanxin Mansion, Huaiyin District",2025-08-12T13:59:40.315118,
hair dryer,Italian Pasta Production Line Industrial Pasta Making Machine,https://sunward.en.made-in-china.com/product/gXMxPebuYkpT/China-Italian-Pasta-Production-Line-Industrial-Pasta-Making-Machine.html,gXMxPebuYkpT,gXMxPebuYkpT,35000.0,USD,1,,"Italian Pasta Production Line Industrial Pasta Making MachineUS$ 35000/ Piece1 Piece(MOQ)Jinan Sunward Machinery Co., Ltd.Jinan Sunward Machinery Co., Ltd.Diamond MemberAudited SupplierSecured TradingShandong, ChinaManufacturer/Factory & Trading CompanyEnjoy trading protection from Made-in-China.comView larger video & image","Jinan Sunward Machinery Co., Ltd.",https://sunward.en.made-in-china.com,,,Jinan Sunward Machinery Co.,"Shandong, China","2504 Room, Shanxin Mansion, Huaiyin District",2025-08-12T13:59:41.453253,
hair dryer,Industrial Macaroni Pasta Slanty Snack Pellet Chips Making Machine Production Line Big Capacity Macaroni Making Machine with Factory Quality,https://sunward.en.made-in-china.com/product/dOZAbKeucqpF/China-Industrial-Macaroni-Pasta-Slanty-Snack-Pellet-Chips-Making-Machine-Production-Line-Big-Capacity-Macaroni-Making-Machine-with-Factory-Quality.html,dOZAbKeucqpF,dOZAbKeucqpF,35000.0,USD,1,,"Industrial Macaroni Pasta Slanty Snack Pellet Chips Making Machine Production Line Big Capacity Macaroni Making Machine with Factory QualityUS$ 35000/ Piece1 Piece(MOQ)Jinan Sunward Machinery Co., Ltd.Jinan Sunward Machinery Co., Ltd.Diamond MemberAudited SupplierSecured TradingShandong, ChinaManufacturer/Factory & Trading CompanyEnjoy trading protection from Made-in-China.comView larger video & image","Jinan Sunward Machinery Co., Ltd.",https://sunward.en.made-in-china.com,,,Jinan Sunward Machinery Co.,"Shandong, China","2504 Room, Shanxin Mansion, Huaiyin District",2025-08-12T13:59:42.900643,
hair dryer,Styling Chairs SalonHairSalon Furniture Barber,https://honglibeauty.en.made-in-china.com/product/MdRaFlpAhzkL/China-Styling-Chairs-Salon-Hair-Salon-Furniture-Barber.html,MdRaFlpAhzkL,MdRaFlpAhzkL,258.0,USD,10,,"Styling Chairs SalonHairSalon Furniture BarberUS$ 258-360/ Piece10 Pieces(MOQ)Wenling Hongli Barber & Beauty Co., Ltd.Wenling Hongli Barber & Beauty Co., Ltd.Zhejiang, China","Wenling Hongli Barber & Beauty Co., Ltd.",,,,,,,2025-08-12T13:59:42.906164,
hair dryer,PortableHairWashing Sink and Chair Discount Barber Chairs,https://honglibeauty.en.made-in-china.com/product/GdaATkcOsfWm/China-Portable-Hair-Washing-Sink-and-Chair-Discount-Barber-Chairs.html,GdaATkcOsfWm,GdaATkcOsfWm,264.0,USD,10,,"PortableHairWashing Sink and Chair Discount Barber ChairsUS$ 264-370/ Piece10 Pieces(MOQ)Wenling Hongli Barber & Beauty Co., Ltd.Wenling Hongli Barber & Beauty Co., Ltd.Zhejiang, China","Wenling Hongli Barber & Beauty Co., Ltd.",,,,,,,2025-08-12T13:59:42.910164,
hair dryer,Beauty Parlour Furniture Price Low Makeup Salon Furniture,https://honglibeauty.en.made-in-china.com/product/VZAfGcKDgtWi/China-Beauty-Parlour-Furniture-Price-Low-Makeup-Salon-Furniture.html,VZAfGcKDgtWi,VZAfGcKDgtWi,293.0,USD,10,,"Beauty Parlour Furniture Price Low Makeup Salon FurnitureUS$ 293-415/ Piece10 Pieces(MOQ)Wenling Hongli Barber & Beauty Co., Ltd.Wenling Hongli Barber & Beauty Co., Ltd.Zhejiang, China","Wenling Hongli Barber & Beauty Co., Ltd.",,,,,,,2025-08-12T13:59:42.914684,
hair dryer,Reclining Salon Shampoo Chair Salon Classic Barber Chair,https://honglibeauty.en.made-in-china.com/product/EFpGRDHMOahV/China-Reclining-Salon-Shampoo-Chair-Salon-Classic-Barber-Chair.html,EFpGRDHMOahV,EFpGRDHMOahV,258.0,USD,10,,"Reclining Salon Shampoo Chair Salon Classic Barber ChairUS$ 258-360/ Piece10 Pieces(MOQ)Wenling Hongli Barber & Beauty Co., Ltd.Wenling Hongli Barber & Beauty Co., Ltd.Zhejiang, China","Wenling Hongli Barber & Beauty Co., Ltd.",,,,,,,2025-08-12T13:59:42.919681,
hair dryer,Used Salon Styling Chairs for Sale Vintage Hairdressing Chair,https://honglibeauty.en.made-in-china.com/product/lFgTsocvMfWd/China-Used-Salon-Styling-Chairs-for-Sale-Vintage-Hairdressing-Chair.html,lFgTsocvMfWd,lFgTsocvMfWd,258.0,USD,10,,"Used Salon Styling Chairs for Sale Vintage Hairdressing ChairUS$ 258-360/ Piece10 Pieces(MOQ)Wenling Hongli Barber & Beauty Co., Ltd.Wenling Hongli Barber & Beauty Co., Ltd.Zhejiang, China","Wenling Hongli Barber & Beauty Co., Ltd.",,,,,,,2025-08-12T13:59:42.923193,
hair dryer,150% Density Mixed Colors Straight HighlightP4/27 Lace Front HumanHairWig,https://elegant-hair.en.made-in-china.com/product/HatUMKXTIEYz/China-150-Density-Mixed-Colors-Straight-Highlight-P4-27-Lace-Front-Human-Hair-Wig.html,HatUMKXTIEYz,HatUMKXTIEYz,63.0,USD,1,,"150% Density Mixed Colors Straight HighlightP4/27 Lace Front HumanHairWigUS$ 63-186/ Piece1 Piece(MOQ)Xuchang Elegant Hair Products Co., Ltd.Xuchang Elegant Hair Products Co., Ltd.Diamond MemberAudited SupplierSecured TradingHenan, ChinaManufacturer/FactoryEnjoy trading protection from Made-in-China.comView larger video & image","Xuchang Elegant Hair Products Co., Ltd.",https://elegant-hair.en.made-in-china.com,,,Changge Elegant Hair Products Co.,"Henan, China","Xuchang, Henan, China",2025-08-12T13:59:47.542100,
hair dryer,"T4/27/P4, 22"" 120g, 7PCS 16 Clips HumanHairClip inHairExtensions, Caramel Blonde Clips inHairExtensions Remy HumanHairExtensions for Women",https://rebeccahairfactory.en.made-in-china.com/product/CwUAvlOdyHfM/China-T4-27-P4-22-120g-7PCS-16-Clips-Human-Hair-Clip-in-Hair-Extensions-Caramel-Blonde-Clips-in-Hair-Extensions-Remy-Human-Hair-Extensions-for-Women.html,CwUAvlOdyHfM,CwUAvlOdyHfM,99.6,USD,1,,"T4/27/P4, 22"" 120g, 7PCS 16 Clips HumanHairClip inHairExtensions, Caramel Blonde Clips inHairExtensions Remy HumanHairExtensions for WomenUS$ 99.6-109.6/ Piece1 Piece(MOQ)Henan Rebecca Hair Products Co.,LtdHenan Rebecca Hair Products Co.,LtdDiamond MemberAudited SupplierSecured TradingHenan, ChinaManufacturer/Factory & Trading CompanyISO45001:2018Enjoy trading protection from Made-in-China.comView larger video & image5(4.9)""Fast Delivery""Fast Delivery","Henan Rebecca Hair Products Co.,Ltd",https://rebeccahairfactory.en.made-in-china.com,4.9,4.0,Henan Rebecca Hair Products Co.,"Henan, China","No. 666, Rebecca Road, Xuchang",2025-08-12T13:59:48.548600,
hair dryer,"(T4/27/P4) 18 Inch 7PCS 16 Clips Real HumanHair, 100% HumanHair, 120g Natural Soft Straight Double Weft Clip in Extensions for Women",https://rebeccahairfactory.en.made-in-china.com/product/vwofukcdllAb/China-T4-27-P4-18-Inch-7PCS-16-Clips-Real-Human-Hair-100-Human-Hair-120g-Natural-Soft-Straight-Double-Weft-Clip-in-Extensions-for-Women.html,vwofukcdllAb,vwofukcdllAb,66.0,USD,1,,"(T4/27/P4) 18 Inch 7PCS 16 Clips Real HumanHair, 100% HumanHair, 120g Natural Soft Straight Double Weft Clip in Extensions for WomenUS$ 66-72.6/ Piece1 Piece(MOQ)Henan Rebecca Hair Products Co.,LtdHenan Rebecca Hair Products Co.,LtdDiamond MemberAudited SupplierSecured TradingHenan, ChinaManufacturer/Factory & Trading CompanyISO45001:2018Enjoy trading protection from Made-in-China.comView larger video & image5(4.9)""Fast Delivery""Fast Delivery","Henan Rebecca Hair Products Co.,Ltd",https://rebeccahairfactory.en.made-in-china.com,4.9,4.0,Henan Rebecca Hair Products Co.,"Henan, China","No. 666, Rebecca Road, Xuchang",2025-08-12T13:59:49.534477,
hair dryer,P4/27 Highlight Ombre Straight HumanHair13X4 13X6 Transparent Lace Front Wig,https://eleganthair.en.made-in-china.com/product/cKvEWmoTOxrq/China-P4-27-Highlight-Ombre-Straight-Human-Hair-13X4-13X6-Transparent-Lace-Front-Wig.html,cKvEWmoTOxrq,cKvEWmoTOxrq,45.6,USD,1,,"P4/27 Highlight Ombre Straight HumanHair13X4 13X6 Transparent Lace Front WigUS$ 45.6-189.8/ Piece1 Piece(MOQ)Changge Elegant Hair Products Co., Ltd.Changge Elegant Hair Products Co., Ltd.Diamond MemberAudited SupplierSecured TradingHenan, ChinaEnjoy trading protection from Made-in-China.comView larger video & image5(5.0)""Fast Dispatch""Fast Dispatch","Changge Elegant Hair Products Co., Ltd.",https://eleganthair.en.made-in-china.com,5.0,5.0,Changge Elegant Hair Products Co.,"Henan, China","Industrial Zone of Changge, Xuchang, Henan",2025-08-12T13:59:51.719457,
hair dryer,Wholesale Vietnamese HumanHairHighlightP4/27 Bone Straight 13X4 Lace Front Wig,https://elegant-hair.en.made-in-china.com/product/mQOYxDeCJwRE/China-Wholesale-Vietnamese-Human-Hair-Highlight-P4-27-Bone-Straight-13X4-Lace-Front-Wig.html,mQOYxDeCJwRE,mQOYxDeCJwRE,49.5,USD,1,,"Wholesale Vietnamese HumanHairHighlightP4/27 Bone Straight 13X4 Lace Front WigUS$ 49.5-213.8/ Piece1 Piece(MOQ)Xuchang Elegant Hair Products Co., Ltd.Xuchang Elegant Hair Products Co., Ltd.Diamond MemberAudited SupplierSecured TradingHenan, ChinaManufacturer/FactoryEnjoy trading protection from Made-in-China.comView larger video & image","Xuchang Elegant Hair Products Co., Ltd.",https://elegant-hair.en.made-in-china.com,,,Changge Elegant Hair Products Co.,"Henan, China","Xuchang, Henan, China",2025-08-12T13:59:52.853178,
hair dryer,Brazilian HumanHairHighlightP4/27 Body Wave Curly Swiss Lace Frontal Wigs,https://elegant-hair.en.made-in-china.com/product/ImCRfySvLdpK/China-Brazilian-Human-Hair-Highlight-P4-27-Body-Wave-Curly-Swiss-Lace-Frontal-Wigs.html,ImCRfySvLdpK,ImCRfySvLdpK,52.35,USD,1,,"Brazilian HumanHairHighlightP4/27 Body Wave Curly Swiss Lace Frontal WigsUS$ 52.35-186.43/ Piece1 Piece(MOQ)Xuchang Elegant Hair Products Co., Ltd.Xuchang Elegant Hair Products Co., Ltd.Diamond MemberAudited SupplierSecured TradingHenan, ChinaManufacturer/FactoryEnjoy trading protection from Made-in-China.comView larger video & image","Xuchang Elegant Hair Products Co., Ltd.",https://elegant-hair.en.made-in-china.com,,,Changge Elegant Hair Products Co.,"Henan, China","Xuchang, Henan, China",2025-08-12T13:59:54.078852,
hair dryer,"(T4/27/P4) 20 Inch 7PCS 120g 16 Clips inHairExtensions, Chocolate Brown to Caramel Blonde RemyHairExtensions Clip inHairExtensions HumanHair",https://rebeccahairfactory.en.made-in-china.com/product/ZOoGwfMDrHtl/China-T4-27-P4-20-Inch-7PCS-120g-16-Clips-in-Hair-Extensions-Chocolate-Brown-to-Caramel-Blonde-Remy-Hair-Extensions-Clip-in-Hair-Extensions-Human-Hair.html,ZOoGwfMDrHtl,ZOoGwfMDrHtl,84.7,USD,1,,"(T4/27/P4) 20 Inch 7PCS 120g 16 Clips inHairExtensions, Chocolate Brown to Caramel Blonde RemyHairExtensions Clip inHairExtensions HumanHairUS$ 84.7-93.2/ Piece1 Piece(MOQ)Henan Rebecca Hair Products Co.,LtdHenan Rebecca Hair Products Co.,LtdDiamond MemberAudited SupplierSecured TradingHenan, ChinaManufacturer/Factory & Trading CompanyISO45001:2018Enjoy trading protection from Made-in-China.comView larger video & image5(4.9)""Fast Dispatch""Fast Dispatch","Henan Rebecca Hair Products Co.,Ltd",https://rebeccahairfactory.en.made-in-china.com,4.9,4.0,Henan Rebecca Hair Products Co.,"Henan, China","No. 666, Rebecca Road, Xuchang",2025-08-12T13:59:55.122915,
hair dryer,Factory Price Brazilian Remy HumanHairP4/27 Highlight Transparent Lace Front Wig,https://elegant-hair.en.made-in-china.com/product/BtJUGXlvTnRE/China-Factory-Price-Brazilian-Remy-Human-Hair-P4-27-Highlight-Transparent-Lace-Front-Wig.html,BtJUGXlvTnRE,BtJUGXlvTnRE,40.0,USD,1,,"Factory Price Brazilian Remy HumanHairP4/27 Highlight Transparent Lace Front WigUS$ 40-186/ Piece1 Piece(MOQ)Xuchang Elegant Hair Products Co., Ltd.Xuchang Elegant Hair Products Co., Ltd.Diamond MemberAudited SupplierSecured TradingHenan, ChinaManufacturer/FactoryEnjoy trading protection from Made-in-China.comView larger video & image","Xuchang Elegant Hair Products Co., Ltd.",https://elegant-hair.en.made-in-china.com,,,Changge Elegant Hair Products Co.,"Henan, China","Xuchang, Henan, China",2025-08-12T13:59:56.364632,
hair dryer,Brazilian HumanHairHighlightP4/27 Bone Straight Swiss Lace Frontal Wigs,https://elegant-hair.en.made-in-china.com/product/QJFUdDkuEZYO/China-Brazilian-Human-Hair-Highlight-P4-27-Bone-Straight-Swiss-Lace-Frontal-Wigs.html,QJFUdDkuEZYO,QJFUdDkuEZYO,48.3,USD,1,,"Brazilian HumanHairHighlightP4/27 Bone Straight Swiss Lace Frontal WigsUS$ 48.3-183.5/ Piece1 Piece(MOQ)Xuchang Elegant Hair Products Co., Ltd.Xuchang Elegant Hair Products Co., Ltd.Diamond MemberAudited SupplierSecured TradingHenan, ChinaManufacturer/FactoryEnjoy trading protection from Made-in-China.comView larger video & image","Xuchang Elegant Hair Products Co., Ltd.",https://elegant-hair.en.made-in-china.com,,,Changge Elegant Hair Products Co.,"Henan, China","Xuchang, Henan, China",2025-08-12T13:59:58.341944,
hair dryer,Wholesale VietnameseHairBody Wave Highlight BrownP4/27 Transparent Lace Front Wig,https://elegant-hair.en.made-in-china.com/product/BnNRhpqECwrK/China-Wholesale-Vietnamese-Hair-Body-Wave-Highlight-Brown-P4-27-Transparent-Lace-Front-Wig.html,BnNRhpqECwrK,BnNRhpqECwrK,56.0,USD,1,,"Wholesale VietnameseHairBody Wave Highlight BrownP4/27 Transparent Lace Front WigUS$ 56-206/ Piece1 Piece(MOQ)Xuchang Elegant Hair Products Co., Ltd.Xuchang Elegant Hair Products Co., Ltd.Diamond MemberAudited SupplierSecured TradingHenan, ChinaManufacturer/FactoryEnjoy trading protection from Made-in-China.comView larger video & image","Xuchang Elegant Hair Products Co., Ltd.",https://elegant-hair.en.made-in-china.com,,,Changge Elegant Hair Products Co.,"Henan, China","Xuchang, Henan, China",2025-08-12T13:59:59.516783,
hair dryer,Body Wave 100% HumanHair4/27 Cuticle Aligned Virgin Lace Frontal Wig,https://eleganthair.en.made-in-china.com/product/PKYJAbxymQUt/China-Body-Wave-100-Human-Hair-4-27-Cuticle-Aligned-Virgin-Lace-Frontal-Wig.html,PKYJAbxymQUt,PKYJAbxymQUt,39.0,USD,1,,"Body Wave 100% HumanHair4/27 Cuticle Aligned Virgin Lace Frontal WigUS$ 39/ Piece1 Piece(MOQ)Changge Elegant Hair Products Co., Ltd.Changge Elegant Hair Products Co., Ltd.Diamond MemberAudited SupplierSecured TradingHenan, ChinaEnjoy trading protection from Made-in-China.comView larger video & image5(5.0)""On-time Delivery""On-time Delivery","Changge Elegant Hair Products Co., Ltd.",https://eleganthair.en.made-in-china.com,5.0,5.0,Changge Elegant Hair Products Co.,"Henan, China","Industrial Zone of Changge, Xuchang, Henan",2025-08-12T14:00:00.815579,
hair dryer,Wholesale VietnameseHairNatural Straight Highlight BrownP4/27 Transparent Lace Front Wig,https://elegant-hair.en.made-in-china.com/product/xJFRTCkEYdpo/China-Wholesale-Vietnamese-Hair-Natural-Straight-Highlight-Brown-P4-27-Transparent-Lace-Front-Wig.html,xJFRTCkEYdpo,xJFRTCkEYdpo,36.0,USD,1,,"Wholesale VietnameseHairNatural Straight Highlight BrownP4/27 Transparent Lace Front WigUS$ 36/ Piece1 Piece(MOQ)Xuchang Elegant Hair Products Co., Ltd.Xuchang Elegant Hair Products Co., Ltd.Diamond MemberAudited SupplierSecured TradingHenan, ChinaManufacturer/FactoryEnjoy trading protection from Made-in-China.comView larger video & image","Xuchang Elegant Hair Products Co., Ltd.",https://elegant-hair.en.made-in-china.com,,,Changge Elegant Hair Products Co.,"Henan, China","Xuchang, Henan, China",2025-08-12T14:00:02.225889,
hair dryer,Wholesale Vietnamese HumanHairHighlightP4/27 Deep Wave 13X4 Lace Front Wig,https://elegant-hair.en.made-in-china.com/product/QnyrRbgUgZpd/China-Wholesale-Vietnamese-Human-Hair-Highlight-P4-27-Deep-Wave-13X4-Lace-Front-Wig.html,QnyrRbgUgZpd,QnyrRbgUgZpd,56.0,USD,1,,"Wholesale Vietnamese HumanHairHighlightP4/27 Deep Wave 13X4 Lace Front WigUS$ 56-221/ Piece1 Piece(MOQ)Xuchang Elegant Hair Products Co., Ltd.Xuchang Elegant Hair Products Co., Ltd.Diamond MemberAudited SupplierSecured TradingHenan, ChinaManufacturer/FactoryEnjoy trading protection from Made-in-China.comView larger video & image","Xuchang Elegant Hair Products Co., Ltd.",https://elegant-hair.en.made-in-china.com,,,Changge Elegant Hair Products Co.,"Henan, China","Xuchang, Henan, China",2025-08-12T14:00:03.374910,
hair dryer,WholesalesP4/27 Bone Straight HumanHair13*6 HD Transparent Lace Front Wig,https://elegant-hair.en.made-in-china.com/product/nJyRfeDbhOpX/China-Wholesales-P4-27-Bone-Straight-Human-Hair-13-6-HD-Transparent-Lace-Front-Wig.html,nJyRfeDbhOpX,nJyRfeDbhOpX,54.3,USD,1,,"WholesalesP4/27 Bone Straight HumanHair13*6 HD Transparent Lace Front WigUS$ 54.3-185.2/ Piece1 Piece(MOQ)Xuchang Elegant Hair Products Co., Ltd.Xuchang Elegant Hair Products Co., Ltd.Diamond MemberAudited SupplierSecured TradingHenan, ChinaManufacturer/FactoryEnjoy trading protection from Made-in-China.comView larger video & image","Xuchang Elegant Hair Products Co., Ltd.",https://elegant-hair.en.made-in-china.com,,,Changge Elegant Hair Products Co.,"Henan, China","Xuchang, Henan, China",2025-08-12T14:00:04.804221,
hair dryer,Wholesale VietnameseHairBody Wave HighlightP4/27 Transparent Lace Front Wig,https://elegant-hair.en.made-in-china.com/product/gmdYlUechFRP/China-Wholesale-Vietnamese-Hair-Body-Wave-Highlight-P4-27-Transparent-Lace-Front-Wig.html,gmdYlUechFRP,gmdYlUechFRP,56.5,USD,1,,"Wholesale VietnameseHairBody Wave HighlightP4/27 Transparent Lace Front WigUS$ 56.5-213.8/ Piece1 Piece(MOQ)Xuchang Elegant Hair Products Co., Ltd.Xuchang Elegant Hair Products Co., Ltd.Diamond MemberAudited SupplierSecured TradingHenan, ChinaManufacturer/FactoryEnjoy trading protection from Made-in-China.comView larger video & image","Xuchang Elegant Hair Products Co., Ltd.",https://elegant-hair.en.made-in-china.com,,,Changge Elegant Hair Products Co.,"Henan, China","Xuchang, Henan, China",2025-08-12T14:00:05.828876,
hair dryer,Wholesale Indian HumanHairHighlightP4/27 Body Wave 13X4 Lace Front Wigs,https://elegant-hair.en.made-in-china.com/product/znOUsxcAhdYe/China-Wholesale-Indian-Human-Hair-Highlight-P4-27-Body-Wave-13X4-Lace-Front-Wigs.html,znOUsxcAhdYe,znOUsxcAhdYe,56.5,USD,1,,"Wholesale Indian HumanHairHighlightP4/27 Body Wave 13X4 Lace Front WigsUS$ 56.5-206.8/ Piece1 Piece(MOQ)Xuchang Elegant Hair Products Co., Ltd.Xuchang Elegant Hair Products Co., Ltd.Diamond MemberAudited SupplierSecured TradingHenan, ChinaManufacturer/FactoryEnjoy trading protection from Made-in-China.comView larger video & image","Xuchang Elegant Hair Products Co., Ltd.",https://elegant-hair.en.made-in-china.com,,,Changge Elegant Hair Products Co.,"Henan, China","Xuchang, Henan, China",2025-08-12T14:00:07.089857,
hair dryer,Brazilian HumanHairHighlightP4/27 Deep Wave Curly Swiss Lace Frontal Wigs,https://elegant-hair.en.made-in-china.com/product/sxyRrqzTbdUW/China-Brazilian-Human-Hair-Highlight-P4-27-Deep-Wave-Curly-Swiss-Lace-Frontal-Wigs.html,sxyRrqzTbdUW,sxyRrqzTbdUW,49.0,USD,1,,"Brazilian HumanHairHighlightP4/27 Deep Wave Curly Swiss Lace Frontal WigsUS$ 49-182/ Piece1 Piece(MOQ)Xuchang Elegant Hair Products Co., Ltd.Xuchang Elegant Hair Products Co., Ltd.Diamond MemberAudited SupplierSecured TradingHenan, ChinaManufacturer/FactoryEnjoy trading protection from Made-in-China.comView larger video & image","Xuchang Elegant Hair Products Co., Ltd.",https://elegant-hair.en.made-in-china.com,,,Changge Elegant Hair Products Co.,"Henan, China","Xuchang, Henan, China",2025-08-12T14:00:08.376635,
hair dryer,Wholesale Vietnamese HumanHairHighlightP4/27 Body Wave 13X4 Lace Front Wig,https://elegant-hair.en.made-in-china.com/product/CEjrpRMPbZYI/China-Wholesale-Vietnamese-Human-Hair-Highlight-P4-27-Body-Wave-13X4-Lace-Front-Wig.html,CEjrpRMPbZYI,CEjrpRMPbZYI,56.0,USD,1,,"Wholesale Vietnamese HumanHairHighlightP4/27 Body Wave 13X4 Lace Front WigUS$ 56-209/ Piece1 Piece(MOQ)Xuchang Elegant Hair Products Co., Ltd.Xuchang Elegant Hair Products Co., Ltd.Diamond MemberAudited SupplierSecured TradingHenan, ChinaManufacturer/FactoryEnjoy trading protection from Made-in-China.comView larger video & image","Xuchang Elegant Hair Products Co., Ltd.",https://elegant-hair.en.made-in-china.com,,,Changge Elegant Hair Products Co.,"Henan, China","Xuchang, Henan, China",2025-08-12T14:00:09.664314,
