keyword,title,listing_url,item_number,sku,price,currency,min_order_quantity,max_order_quantity,description,seller_name,seller_profile_url,seller_rating,seller_total_reviews,seller_business_name,seller_country,seller_address,scraped_at,last_updated
hair dryer,ABS Materials Wall-Mounted HotelHairDryer,https://wontry.en.made-in-china.com/product/djWQeBGUZTkh/China-ABS-Materials-Wall-Mounted-Hotel-Hair-Dryer.html,djWQeBGUZTkh,djWQeBGUZTkh,11.0,USD,500,,"ABS Materials Wall-Mounted HotelHairDryerUS$ 11-13/ Piece500 Pieces(MOQ)Wenzhou Won-Try Electric Appliance Co., Ltd.Wenzhou Won-Try Electric Appliance Co., Ltd.Gold MemberAudited SupplierZhejiang, ChinaManufacturer/FactoryView larger video & image","Wenzhou Won-Try Electric Appliance Co., Ltd.",https://wontry.en.made-in-china.com,,,Try Electric Appliance Co.,"Zhejiang, China","6#Ze Chuan Road, Getian Industrial Zone, Zeya Ouhai",2025-08-12T13:58:05.932671,
hair dryer,Travel Portable ACHairDryerFoldable High Speed Constant TemperatureHairDryer,https://fiyele.en.made-in-china.com/product/uTyYifeGXjkN/China-Travel-Portable-AC-Hair-Dryer-Foldable-High-Speed-Constant-Temperature-Hair-Dryer.html,uTyYifeGXjkN,uTyYifeGXjkN,7.13,USD,2000,,"Travel Portable ACHairDryerFoldable High Speed Constant TemperatureHairDryerUS$ 7.13-7.44/ Piece2000 Pieces(MOQ)Yueqing Fiy Electric Co., Ltd.Yueqing Fiy Electric Co., Ltd.Diamond MemberAudited SupplierZhejiang, ChinaManufacturer/Factory & Trading CompanyView larger video & image5(5.0)""Fast Dispatch""Fast Dispatch","Yueqing Fiy Electric Co., Ltd.",https://fiyele.en.made-in-china.com,5.0,5.0,"Post Sourcing Request
















                                    Yueqing Fiy Electric Co.","Zhejiang, China","Building 2, Xianyangchen Industrial Zone, Hongqiao",2025-08-12T13:58:07.986821,
hair dryer,Plasma AiHairDryerhigh PerformanceHairStraightener Constant Temperature Blowing Does Not Perm The Scalp HouseholdHairDryerProfessional Handheld Blow Dry,https://baiyisen.en.made-in-china.com/product/sRBYwtnKZmkN/China-Plasma-Ai-Hair-Dryerhigh-Performance-Hair-Straightener-Constant-Temperature-Blowing-Does-Not-Perm-The-Scalp-Household-Hair-Dryer-Professional-Handheld-Blow-Dry.html,sRBYwtnKZmkN,sRBYwtnKZmkN,30.0,USD,2000,,"Plasma AiHairDryerhigh PerformanceHairStraightener Constant Temperature Blowing Does Not Perm The Scalp HouseholdHairDryerProfessional Handheld Blow DryUS$ 30-39/ Piece2000 Pieces(MOQ)Shenzhen Baiyisen Health Technology Co., Ltd.Shenzhen Baiyisen Health Technology Co., Ltd.Diamond MemberAudited SupplierGuangdong, ChinaView larger video & image","Shenzhen Baiyisen Health Technology Co., Ltd.",https://baiyisen.en.made-in-china.com,,,Leading Global,"Guangdong, China","Shenzhen, Guangdong, China",2025-08-12T13:58:09.669537,
hair dryer,"Negative Ionic BlowDryerwith 110, 000 RpmHairDryer",https://mktslkt-a.en.made-in-china.com/product/sGqRTHVunCkK/China-Negative-Ionic-Blow-Dryer-with-110-000-Rpm-Hair-Dryer.html,sGqRTHVunCkK,sGqRTHVunCkK,6.0,USD,1000,,"Negative Ionic BlowDryerwith 110, 000 RpmHairDryerUS$ 6-6.7/ Piece1000 Pieces(MOQ)Market Union Co., Ltd.Market Union Co., Ltd.Diamond MemberAudited SupplierZhejiang, ChinaTrading CompanyView larger video & image5(5.0)""Fast Delivery""Fast Delivery","Market Union Co., Ltd.",https://mktslkt-a.en.made-in-china.com,5.0,5.0,MU Group,"Zhejiang, China","12F, Building B10 (East Village), No. 2560",2025-08-12T13:58:11.258630,
hair dryer,High Quality Hot Selling Quick Drying 113000rpm Negative Ion ProfessionalHairDryer,https://dglizbella.en.made-in-china.com/product/aATrhPHDTLkU/China-High-Quality-Hot-Selling-Quick-Drying-113000rpm-Negative-Ion-Professional-Hair-Dryer.html,aATrhPHDTLkU,aATrhPHDTLkU,38.0,USD,1,,"High Quality Hot Selling Quick Drying 113000rpm Negative Ion ProfessionalHairDryerUS$ 38-42/ Piece1 Piece(MOQ)Dongguan Zhimi Electrical Technology Co., Ltd.Dongguan Zhimi Electrical Technology Co., Ltd.Diamond MemberAudited SupplierGuangdong, ChinaManufacturer/Factory & Trading CompanyView larger video & image5(5.0)""Good Quality""Good Quality","Dongguan Zhimi Electrical Technology Co., Ltd.",https://dglizbella.en.made-in-china.com,5.0,5.0,"Post a Sourcing Request Now 











Product Group","Guangdong, China","Room 501, Building 6, No.168 Fuli East Road",2025-08-12T13:58:12.944199,
hair dryer,Bidisco Custom Private Label Ionic Negative Ion AnionHairDryersHigh Quality Professional BlowHairDryer,https://bidisco.en.made-in-china.com/product/DatrAHOoITWQ/China-Bidisco-Custom-Private-Label-Ionic-Negative-Ion-Anion-Hair-Dryers-High-Quality-Professional-Blow-Hair-Dryer.html,DatrAHOoITWQ,DatrAHOoITWQ,11.96,USD,500,,"Bidisco Custom Private Label Ionic Negative Ion AnionHairDryersHigh Quality Professional BlowHairDryerUS$ 11.96-12.32/ Piece500 Pieces(MOQ)Dongguan Bidisco Electric CO., LTDDongguan Bidisco Electric CO., LTDDiamond MemberAudited SupplierGuangdong, ChinaManufacturer/Factory & Trading CompanyView larger video & image5(5.0)""Fast Delivery""Fast Delivery","Dongguan Bidisco Electric CO., LTD",https://bidisco.en.made-in-china.com,5.0,5.0,Dongguan Bidisco Electric Co.,"Guangdong, China","NO.297 JIANGNAN ROAD, QISHI TOWN, DONGGUAN CITY",2025-08-12T13:58:14.445655,
hair dryer,Salon-Grade Performance Magnetic Nozzle Attachments Intelligent Heat ControlHairDryer,https://cy-electronic.en.made-in-china.com/product/NJeUlqkokZpO/China-Salon-Grade-Performance-Magnetic-Nozzle-Attachments-Intelligent-Heat-Control-Hair-Dryer.html,NJeUlqkokZpO,NJeUlqkokZpO,36.0,USD,1,,"Salon-Grade Performance Magnetic Nozzle Attachments Intelligent Heat ControlHairDryerUS$ 36-42/ Piece1 Piece(MOQ)Chaozhou Chengying Technology Co., LtdChaozhou Chengying Technology Co., LtdDiamond MemberAudited SupplierGuangdong, ChinaView larger video & image5(4.6)""Fast Delivery""Fast Delivery","Chaozhou Chengying Technology Co., Ltd",https://cy-electronic.en.made-in-china.com,4.6,4.0,Chaozhou Chengying Technology Co.,"Guangdong, China","No. 17, Building C, Chaoshan Commercial Plaza",2025-08-12T13:58:16.079954,
hair dryer,China Manufacturers Professional Salon 2000W Negative Ionic BLDCHairDryerBrushless High Speed FoldableHairBlowDryer,https://huipuhairdryer.en.made-in-china.com/product/VtPrCQzoYlkh/China-China-Manufacturers-Professional-Salon-2000W-Negative-Ionic-BLDC-Hair-Dryer-Brushless-High-Speed-Foldable-Hair-Blow-Dryer.html,VtPrCQzoYlkh,VtPrCQzoYlkh,36.0,USD,500,,"China Manufacturers Professional Salon 2000W Negative Ionic BLDCHairDryerBrushless High Speed FoldableHairBlowDryerUS$ 36-37.5/ pieces500 pieces(MOQ)Wenzhou Huipu Electrical Appliance Co., Ltd.Wenzhou Huipu Electrical Appliance Co., Ltd.Diamond MemberAudited SupplierZhejiang, ChinaView larger video & image5(5.0)""On-time Delivery""On-time Delivery","Wenzhou Huipu Electrical Appliance Co., Ltd.",https://huipuhairdryer.en.made-in-china.com,5.0,5.0,Wenzhou Huipu Electric Co.,"Zhejiang, China","Wenzhou, Zhejiang, China",2025-08-12T13:58:17.738340,
hair dryer,High Speed 110000rpm BrushlessHairDryerFast Hairdryer 20 Million Negative IonicHairDryerhair BlowDryerHigh Speed IonicHairDryerfor Professional Salon,https://baiyisen.en.made-in-china.com/product/hnBRxQLHVdUu/China-High-Speed-110000rpm-Brushless-Hair-Dryer-Fast-Hairdryer-20-Million-Negative-Ionic-Hair-Dryerhair-Blow-Dryer-High-Speed-Ionic-Hair-Dryer-for-Professional-Salon.html,hnBRxQLHVdUu,hnBRxQLHVdUu,31.0,USD,500,,"CE certifiedvalid since 2024-10-24(contact issuer for current status)High Speed 110000rpm BrushlessHairDryerFast Hairdryer 20 Million Negative IonicHairDryerhair BlowDryerHigh Speed IonicHairDryerfor Professional SalonUS$ 31-39/ Piece500 Pieces(MOQ)Shenzhen Baiyisen Health Technology Co., Ltd.Shenzhen Baiyisen Health Technology Co., Ltd.Diamond MemberAudited SupplierSecured TradingGuangdong, ChinaEnjoy trading protection from Made-in-China.comView larger video & image","Shenzhen Baiyisen Health Technology Co., Ltd.",https://baiyisen.en.made-in-china.com,,,Leading Global,"Guangdong, China","Shenzhen, Guangdong, China",2025-08-12T13:58:19.742438,
hair dryer,Koofex Ionic 110000rpm BLDCHairDryerHigh Speed Brushless Motor BlowDryer,https://koofex.en.made-in-china.com/product/fAPUcXzxYoWd/China-Koofex-Ionic-110000rpm-BLDC-Hair-Dryer-High-Speed-Brushless-Motor-Blow-Dryer.html?ads_tp=&ads_id=vyBTXLqckPle,fAPUcXzxYoWd,fAPUcXzxYoWd,9.8,USD,1000,,"Koofex Ionic 110000rpm BLDCHairDryerHigh Speed Brushless Motor BlowDryerUS$ 9.8-11/ Piece1000 Pieces(MOQ)Guangzhou KooFex Appliances Co., Ltd.Guangzhou KooFex Appliances Co., Ltd.Diamond MemberAudited SupplierSecured TradingGuangdong, ChinaEnjoy trading protection from Made-in-China.comView larger video & image5(5.0)""Fast Delivery""Fast Delivery","Guangzhou KooFex Appliances Co., Ltd.",https://koofex.en.made-in-china.com?ads_tp=&ads_id=vyBTXLqckPle,5.0,5.0,Rpm Professional Electric,"Guangdong, China","733-736 Fengrun Business Square, 318 Jinzhongheng Road, Baiyun District",2025-08-12T13:58:21.724597,
hair dryer,2024 Hot Selling Ionic Professional Salon LED Display ScreenHairBlowerDryerBLDC 2000W High Power 3 in 1 One StepHairDryer,https://huipuhairdryer.en.made-in-china.com/product/qAFrWZdlfLVJ/China-2024-Hot-Selling-Ionic-Professional-Salon-LED-Display-Screen-Hair-Blower-Dryer-BLDC-2000W-High-Power-3-in-1-One-Step-Hair-Dryer.html,qAFrWZdlfLVJ,qAFrWZdlfLVJ,37.0,USD,500,,"2024 Hot Selling Ionic Professional Salon LED Display ScreenHairBlowerDryerBLDC 2000W High Power 3 in 1 One StepHairDryerUS$ 37-38.5/ pieces500 pieces(MOQ)Wenzhou Huipu Electrical Appliance Co., Ltd.Wenzhou Huipu Electrical Appliance Co., Ltd.Diamond MemberAudited SupplierSecured TradingZhejiang, ChinaEnjoy trading protection from Made-in-China.comView larger video & image5(5.0)""Fast Delivery""Fast Delivery","Wenzhou Huipu Electrical Appliance Co., Ltd.",https://huipuhairdryer.en.made-in-china.com,5.0,5.0,Wenzhou Huipu Electric Co.,"Zhejiang, China","Wenzhou, Zhejiang, China",2025-08-12T13:58:22.601394,
hair dryer,High Speed 110000 Rpm Brushless Negative IonHairDryer,https://bidisco.en.made-in-china.com/product/YxVrUdDObecp/China-High-Speed-110000-Rpm-Brushless-Negative-Ion-Hair-Dryer.html,YxVrUdDObecp,YxVrUdDObecp,29.3,USD,500,,"High Speed 110000 Rpm Brushless Negative IonHairDryerUS$ 29.3-35/ Piece500 Pieces(MOQ)Dongguan Bidisco Electric CO., LTDDongguan Bidisco Electric CO., LTDDiamond MemberAudited SupplierSecured TradingGuangdong, ChinaManufacturer/Factory & Trading CompanyEnjoy trading protection from Made-in-China.comView larger video & image5(5.0)""Fast Dispatch""Fast Dispatch","Dongguan Bidisco Electric CO., LTD",https://bidisco.en.made-in-china.com,5.0,5.0,Dongguan Bidisco Electric Co.,"Guangdong, China","NO.297 JIANGNAN ROAD, QISHI TOWN, DONGGUAN CITY",2025-08-12T13:58:23.384781,
hair dryer,Salon High Speed Professional Anion LeaflessHairDryerwith Anti-Frizz Features Warranty,https://shanghaijinglang.en.made-in-china.com/product/LGjYEkMoYIhp/China-Salon-High-Speed-Professional-Anion-Leafless-Hair-Dryer-with-Anti-Frizz-Features-Warranty.html,LGjYEkMoYIhp,LGjYEkMoYIhp,15.0,USD,1000,,"Salon High Speed Professional Anion LeaflessHairDryerwith Anti-Frizz Features WarrantyUS$ 15-22/ Piece1000 Pieces(MOQ)Jinglang Electric Appliances (Shanghai) Co., Ltd.Jinglang Electric Appliances (Shanghai) Co., Ltd.Diamond MemberAudited SupplierSecured TradingShanghai, ChinaEnjoy trading protection from Made-in-China.comView larger video & image5(5.0)""Fast Delivery""Fast Delivery","Jinglang Electric Appliances (Shanghai) Co., Ltd.",https://shanghaijinglang.en.made-in-china.com,5.0,5.0,Our company,"Shanghai, China","No. 1108, Rongmei Road, Songjiang University Town",2025-08-12T13:58:24.875541,
hair dryer,Source Factoryhigh Speed 110000rpm High Speed Best HouseholdHairPattern Blow Dryer5 In1 Hot Air Brush Comb BlowDryerBrushhair Stylerfactory New Design BLDC,https://baiyisen.en.made-in-china.com/product/LtnRcvrVIJpB/China-Source-Factoryhigh-Speed-110000rpm-High-Speed-Best-Household-Hair-Pattern-Blow-Dryer5-In1-Hot-Air-Brush-Comb-Blow-Dryer-Brushhair-Stylerfactory-New-Design-BLDC.html,LtnRcvrVIJpB,LtnRcvrVIJpB,27.8,USD,1000,,"CE certifiedvalid since 2024-10-24(contact issuer for current status)Source Factoryhigh Speed 110000rpm High Speed Best HouseholdHairPattern Blow Dryer5 In1 Hot Air Brush Comb BlowDryerBrushhair Stylerfactory New Design BLDCUS$ 27.8-29.8/ Piece1000 Pieces(MOQ)Shenzhen Baiyisen Health Technology Co., Ltd.Shenzhen Baiyisen Health Technology Co., Ltd.Diamond MemberAudited SupplierSecured TradingGuangdong, ChinaEnjoy trading protection from Made-in-China.comView larger video & image","Shenzhen Baiyisen Health Technology Co., Ltd.",https://baiyisen.en.made-in-china.com,,,Leading Global,"Guangdong, China","Shenzhen, Guangdong, China",2025-08-12T13:58:25.913451,
hair dryer,High Speed Constant Temperature Negative IonHairDryerProfessional Hammer Electric BlowerDryer,https://huipuhairdryer.en.made-in-china.com/product/EADYOxfTBHkQ/China-High-Speed-Constant-Temperature-Negative-Ion-Hair-Dryer-Professional-Hammer-Electric-Blower-Dryer.html,EADYOxfTBHkQ,EADYOxfTBHkQ,21.9,USD,50,,"High Speed Constant Temperature Negative IonHairDryerProfessional Hammer Electric BlowerDryerUS$ 21.9-25/ Piece50 Pieces(MOQ)Wenzhou Huipu Electrical Appliance Co., Ltd.Wenzhou Huipu Electrical Appliance Co., Ltd.Diamond MemberAudited SupplierSecured TradingZhejiang, ChinaEnjoy trading protection from Made-in-China.comView larger video & image5(5.0)""On-time Delivery""On-time Delivery","Wenzhou Huipu Electrical Appliance Co., Ltd.",https://huipuhairdryer.en.made-in-china.com,5.0,5.0,Wenzhou Huipu Electric Co.,"Zhejiang, China","Wenzhou, Zhejiang, China",2025-08-12T13:58:26.861342,
hair dryer,High Quality Professional Drayer DC MotorHairBlowDryer2000W Drayer BlowDryers,https://reputable-trading.en.made-in-china.com/product/MTRrptxEBukW/China-High-Quality-Professional-Drayer-DC-Motor-Hair-Blow-Dryer-2000W-Drayer-Blow-Dryers.html,MTRrptxEBukW,MTRrptxEBukW,7.86,USD,500,,"High Quality Professional Drayer DC MotorHairBlowDryer2000W Drayer BlowDryersUS$ 7.86-9.86/ Piece500 Pieces(MOQ)Yiwu Reputable Trade Co., Ltd.Yiwu Reputable Trade Co., Ltd.Diamond MemberZhejiang, ChinaTrading CompanyView larger video & image","Yiwu Reputable Trade Co., Ltd.",https://reputable-trading.en.made-in-china.com,,,Yiwu Reputable Trade Co.,Province China,"Room 305, Unit 3, Building 36",2025-08-12T13:58:28.585437,
hair dryer,Fast DryingHairCare Dsn HD15HairDryerHome Appliance Negative IonsDryer,https://himtop.en.made-in-china.com/product/pdjAniDyaHfx/China-Fast-Drying-Hair-Care-Dsn-HD15-Hair-Dryer-Home-Appliance-Negative-Ions-Dryer.html,pdjAniDyaHfx,pdjAniDyaHfx,55.0,USD,1,,"Fast DryingHairCare Dsn HD15HairDryerHome Appliance Negative IonsDryerUS$ 55-65/ Piece1 Piece(MOQ)Shenzhen Himtop Technology Co., Ltd.Shenzhen Himtop Technology Co., Ltd.Diamond MemberAudited SupplierGuangdong, ChinaView larger video & image5(4.5)""Quick Response""Quick Response","Shenzhen Himtop Technology Co., Ltd.",https://himtop.en.made-in-china.com,4.5,4.0,Bantian International,"Guangdong, China","18th Floor, Block a, Bantian International Center",2025-08-12T13:58:30.358138,
hair dryer,"Curling Iron for Effortless Long-Lasting Curls 5-in-1 Curling IronHairDryerSet 110, 000 Rpm Silent Brushless Motor",https://baiyisen.en.made-in-china.com/product/NGAUsdnxIErz/China-Curling-Iron-for-Effortless-Long-Lasting-Curls-5-in-1-Curling-Iron-Hair-Dryer-Set-110-000-Rpm-Silent-Brushless-Motor.html,NGAUsdnxIErz,NGAUsdnxIErz,30.0,USD,1000,,"Curling Iron for Effortless Long-Lasting Curls 5-in-1 Curling IronHairDryerSet 110, 000 Rpm Silent Brushless MotorUS$ 30-39/ Piece1000 Pieces(MOQ)Shenzhen Baiyisen Health Technology Co., Ltd.Shenzhen Baiyisen Health Technology Co., Ltd.Diamond MemberAudited SupplierGuangdong, ChinaView larger video & image","Shenzhen Baiyisen Health Technology Co., Ltd.",https://baiyisen.en.made-in-china.com,,,Leading Global,"Guangdong, China","Shenzhen, Guangdong, China",2025-08-12T13:58:31.364966,
hair dryer,Lightweight Build 1600W Motor Cool Shot Function Negative Ion TechnologyHairDryer,https://cy-electronic.en.made-in-china.com/product/BmdRbXzcLFph/China-Lightweight-Build-1600W-Motor-Cool-Shot-Function-Negative-Ion-Technology-Hair-Dryer.html,BmdRbXzcLFph,BmdRbXzcLFph,36.0,USD,1,,"Lightweight Build 1600W Motor Cool Shot Function Negative Ion TechnologyHairDryerUS$ 36-42/ Piece1 Piece(MOQ)Chaozhou Chengying Technology Co., LtdChaozhou Chengying Technology Co., LtdDiamond MemberAudited SupplierSecured TradingGuangdong, ChinaEnjoy trading protection from Made-in-China.comView larger video & image5(4.6)""Fast Delivery""Fast Delivery","Chaozhou Chengying Technology Co., Ltd",https://cy-electronic.en.made-in-china.com,4.6,4.0,Chaozhou Chengying Technology Co.,"Guangdong, China","No. 17, Building C, Chaoshan Commercial Plaza",2025-08-12T13:58:32.243100,
hair dryer,Wholesale Adjustable Hot Cold Air Profession Hairdryer 2000W High Power Salon Negative Ionic Far Infrared TherapyHairDryer,https://huipuhairdryer.en.made-in-china.com/product/uakrzMOKAHWb/China-Wholesale-Adjustable-Hot-Cold-Air-Profession-Hairdryer-2000W-High-Power-Salon-Negative-Ionic-Far-Infrared-Therapy-Hair-Dryer.html,uakrzMOKAHWb,uakrzMOKAHWb,19.0,USD,1,,"Wholesale Adjustable Hot Cold Air Profession Hairdryer 2000W High Power Salon Negative Ionic Far Infrared TherapyHairDryerUS$ 19-20/ pieces1 pieces(MOQ)Wenzhou Huipu Electrical Appliance Co., Ltd.Wenzhou Huipu Electrical Appliance Co., Ltd.Diamond MemberAudited SupplierSecured TradingZhejiang, ChinaEnjoy trading protection from Made-in-China.comView larger video & image5(5.0)""Fast Delivery""Fast Delivery","Wenzhou Huipu Electrical Appliance Co., Ltd.",https://huipuhairdryer.en.made-in-china.com,5.0,5.0,Wenzhou Huipu Electric Co.,"Zhejiang, China","Wenzhou, Zhejiang, China",2025-08-12T13:58:32.981940,
hair dryer,Custom OEM/ODM Cross-BorderHairDryerwith Brushless Motor - High-SpeedHairProtection Professional BlowDryer,https://muselect.en.made-in-china.com/product/LpARYUBosTWK/China-Custom-OEM-ODM-Cross-Border-Hair-Dryer-with-Brushless-Motor-High-Speed-Hair-Protection-Professional-Blow-Dryer.html,LpARYUBosTWK,LpARYUBosTWK,28.75,USD,1000,,"Custom OEM/ODM Cross-BorderHairDryerwith Brushless Motor - High-SpeedHairProtection Professional BlowDryerUS$ 28.75/ Piece1000 Pieces(MOQ)Market Union Co. Ltd.Market Union Co. Ltd.Diamond MemberAudited SupplierZhejiang, ChinaTrading CompanyView larger video & image",Market Union Co. Ltd.,https://muselect.en.made-in-china.com,,,Market Union Group has become one of the largest group,"Zhejiang, China","8F, Building B16 (West Area), No. 2560",2025-08-12T13:58:34.620264,
hair dryer,High Quality Household High Speed Constant Temperature AnionHairDryer,https://shanghaijinglang.en.made-in-china.com/product/otyUFxVuhDWp/China-High-Quality-Household-High-Speed-Constant-Temperature-Anion-Hair-Dryer.html,otyUFxVuhDWp,otyUFxVuhDWp,20.0,USD,800,,"High Quality Household High Speed Constant Temperature AnionHairDryerUS$ 20-30/ Piece800 Pieces(MOQ)Jinglang Electric Appliances (Shanghai) Co., Ltd.Jinglang Electric Appliances (Shanghai) Co., Ltd.Diamond MemberAudited SupplierSecured TradingShanghai, ChinaEnjoy trading protection from Made-in-China.comView larger video & image5(5.0)""Fast Dispatch""Fast Dispatch","Jinglang Electric Appliances (Shanghai) Co., Ltd.",https://shanghaijinglang.en.made-in-china.com,,,,,,2025-08-12T13:58:35.726966,
hair dryer,New-Style Fashionable 2023 Updated Diffuser 1800W Women Curly IonicHairDryer,https://goodseller-household.en.made-in-china.com/product/KEDpyGSLVxRA/China-New-Style-Fashionable-2023-Updated-Diffuser-1800W-Women-Curly-Ionic-Hair-Dryer.html,KEDpyGSLVxRA,KEDpyGSLVxRA,10.0,USD,95,,"New-Style Fashionable 2023 Updated Diffuser 1800W Women Curly IonicHairDryerUS$ 10-10.5/ Piece95 Pieces(MOQ)Good Seller Co., LtdGood Seller Co., LtdDiamond MemberAudited SupplierZhejiang, ChinaTrading CompanyView larger video & image5(5.0)""Fast Delivery""Fast Delivery","Good Seller Co., Ltd",https://goodseller-household.en.made-in-china.com,5.0,5.0,Our company,"Zhejiang, China","Floor 5, No. 113 Qiushi Road, Beiyuan",2025-08-12T13:58:37.989058,
hair dryer,OEM Customized 1200W Professional Electric Ionic BlowHairDryer,https://bidisco.en.made-in-china.com/product/gwHfLGSyEshu/China-OEM-Customized-1200W-Professional-Electric-Ionic-Blow-Hair-Dryer.html,gwHfLGSyEshu,gwHfLGSyEshu,12.36,USD,300,,"OEM Customized 1200W Professional Electric Ionic BlowHairDryerUS$ 12.36-12.7/ Piece300 Pieces(MOQ)Dongguan Bidisco Electric CO., LTDDongguan Bidisco Electric CO., LTDDiamond MemberAudited SupplierSecured TradingGuangdong, ChinaManufacturer/Factory & Trading CompanyEnjoy trading protection from Made-in-China.comView larger video & image5(5.0)""On-time Delivery""On-time Delivery","Dongguan Bidisco Electric CO., LTD",https://bidisco.en.made-in-china.com,5.0,5.0,Dongguan Bidisco Electric Co.,"Guangdong, China","NO.297 JIANGNAN ROAD, QISHI TOWN, DONGGUAN CITY",2025-08-12T13:58:38.918115,
hair dryer,2025 Factory New Model Straightener Curler Hot Air Brush BlowDryerand 1300W High SpeedHairDryerBrush,https://baiyisen.en.made-in-china.com/product/QTEruWCyTnYR/China-2025-Factory-New-Model-Straightener-Curler-Hot-Air-Brush-Blow-Dryer-and-1300W-High-Speed-Hair-Dryer-Brush.html,QTEruWCyTnYR,QTEruWCyTnYR,30.0,USD,1000,,"2025 Factory New Model Straightener Curler Hot Air Brush BlowDryerand 1300W High SpeedHairDryerBrushUS$ 30-39/ Piece1000 Pieces(MOQ)Shenzhen Baiyisen Health Technology Co., Ltd.Shenzhen Baiyisen Health Technology Co., Ltd.Diamond MemberAudited SupplierGuangdong, ChinaView larger video & image","Shenzhen Baiyisen Health Technology Co., Ltd.",https://baiyisen.en.made-in-china.com,,,Leading Global,"Guangdong, China","Shenzhen, Guangdong, China",2025-08-12T13:58:40.377461,
hair dryer,Home Blue Negative IonHairSalon High PowerHairDryer,https://mktslkt-a.en.made-in-china.com/product/WtqpkscOwNVS/China-Home-Blue-Negative-Ion-Hair-Salon-High-Power-Hair-Dryer.html,WtqpkscOwNVS,WtqpkscOwNVS,4.0,USD,1000,,"Home Blue Negative IonHairSalon High PowerHairDryerUS$ 4-4.6/ Piece1000 Pieces(MOQ)Market Union Co., Ltd.Market Union Co., Ltd.Diamond MemberAudited SupplierZhejiang, ChinaTrading CompanyView larger video & image5(5.0)""Fast Dispatch""Fast Dispatch","Market Union Co., Ltd.",https://mktslkt-a.en.made-in-china.com,5.0,5.0,MU Group,"Zhejiang, China","12F, Building B10 (East Village), No. 2560",2025-08-12T13:58:42.633002,
hair dryer,High-Speed SalonHairDryerwith Lonic Feature and Concentrator Nozzle,https://rongheglobal.en.made-in-china.com/product/BaQpYorxRGUZ/China-High-Speed-Salon-Hair-Dryer-with-Lonic-Feature-and-Concentrator-Nozzle.html,BaQpYorxRGUZ,BaQpYorxRGUZ,12.0,USD,1000,,"High-Speed SalonHairDryerwith Lonic Feature and Concentrator NozzleUS$ 12/ pieces1000 pieces(MOQ)Zhejiang Ronghe Industrial Co., Ltd.Zhejiang Ronghe Industrial Co., Ltd.Gold MemberAudited SupplierZhejiang, ChinaManufacturer/Factory & Trading CompanyISO9001:2015View larger video & image","Zhejiang Ronghe Industrial Co., Ltd.",https://rongheglobal.en.made-in-china.com,,,"Post a Sourcing Request Now 











Product Group","Zhejiang, China","No. 368 Chongde Street, Lingxia Town, Jindong District",2025-08-12T13:58:44.564914,
hair dryer,Electrical Appliance HouseholdHairDryerWall-MountedHairDryer,https://wzhuipu.en.made-in-china.com/product/nsgxALUPvzVF/China-Electrical-Appliance-Household-Hair-Dryer-Wall-Mounted-Hair-Dryer.html,nsgxALUPvzVF,nsgxALUPvzVF,10.0,USD,1000,,"Electrical Appliance HouseholdHairDryerWall-MountedHairDryerUS$ 10/ Piece1000 Pieces(MOQ)Wenzhou Huipu Electrical Appliance Co., Ltd.Wenzhou Huipu Electrical Appliance Co., Ltd.Gold MemberAudited SupplierZhejiang, ChinaManufacturer/Factory & Trading CompanyView larger video & image","Wenzhou Huipu Electrical Appliance Co., Ltd.",https://wzhuipu.en.made-in-china.com,,,"Post Sourcing Request
















                                    Wenzhou Huipu Electric","Zhejiang, China","Light Industry District of Lucheng, Wenzhou, Zhejiang",2025-08-12T13:58:46.687157,
hair dryer,Customizable Ionic Light 3-Shift ProfessionalHairDryerHot,https://3c5d389ced10cf96.en.made-in-china.com/product/ITlYKtLAFfhn/China-Customizable-Ionic-Light-3-Shift-Professional-Hair-Dryer-Hot.html,ITlYKtLAFfhn,ITlYKtLAFfhn,5.89,USD,200,,"Customizable Ionic Light 3-Shift ProfessionalHairDryerHotUS$ 5.89-7.26/ Piece200 Pieces(MOQ)Guangzhou Xinyang Electric Appliance Co., Ltd.Guangzhou Xinyang Electric Appliance Co., Ltd.Gold MemberAudited SupplierSecured TradingGuangdong, ChinaManufacturer/Factory & Trading CompanyEnjoy trading protection from Made-in-China.comView larger video & image5(5.0)""On-time Delivery""On-time Delivery","Guangzhou Xinyang Electric Appliance Co., Ltd.",https://3c5d389ced10cf96.en.made-in-china.com,5.0,5.0,"Post a Sourcing Request Now 











Product Group","Guangdong, China","Dragon Returns to The Street, Guangzhou, Guangdong",2025-08-12T13:58:49.734511,
hair dryer,ABS Plastic Professional 1600WHairDryerfor Hotel,https://alumihk.en.made-in-china.com/product/qXHnNdCuEfYi/China-ABS-Plastic-Professional-1600W-Hair-Dryer-for-Hotel.html,qXHnNdCuEfYi,qXHnNdCuEfYi,10.0,USD,200,,"ABS Plastic Professional 1600WHairDryerfor HotelUS$ 10-15/ Piece200 Pieces(MOQ)Alumi Industrial Co., Ltd.Alumi Industrial Co., Ltd.Gold MemberGuangdong, ChinaView larger video & image","Alumi Industrial Co., Ltd.",https://alumihk.en.made-in-china.com,,,"Post Sourcing Request
















                                    Alumi Industrial Co.","Guangdong, China","Huang Pu Road, Huang Pu District, Guangzhou",2025-08-12T13:58:52.245009,
