keyword,title,listing_url,item_number,sku,price,currency,min_order_quantity,max_order_quantity,units_available,brand,category,description,seller_name,seller_profile_url,seller_rating,seller_total_reviews,seller_email,seller_business_name,seller_country,seller_state_province,seller_zip_code,seller_phone,seller_address,scraped_at,last_updated
hair dryer,Wholesale Vietnamese HumanHairHighlightP4/27 Bone Straight 13X4 Lace Front Wig,https://elegant-hair.en.made-in-china.com/product/mQOYxDeCJwRE/China-Wholesale-Vietnamese-Human-Hair-Highlight-P4-27-Bone-Straight-13X4-Lace-Front-Wig.html,mQOYxDeCJwRE,mQOYxDeCJwRE,49.5,USD,1,,,,,"Wholesale Vietnamese HumanHairHighlightP4/27 Bone Straight 13X4 Lace Front WigUS$ 49.5-213.8/ Piece1 Piece(MOQ)Xuchang Elegant Hair Products Co., Ltd.Xuchang Elegant Hair Products Co., Ltd.Diamond MemberAudited SupplierSecured TradingHenan, ChinaManufacturer/FactoryEnjoy trading protection from Made-in-China.comView larger video & image","Xuchang Elegant Hair Products Co., Ltd.",https://elegant-hair.en.made-in-china.com,,,,Changge Elegant Hair Products Co.,"Henan, China",,,,"Xuchang, Henan, China",2025-08-12T13:28:02.826763,
hair dryer,U TipHairExtensions Real HumanHairDark Brown UtipHairExtensions HumanHairfor Women 20 Inch Brown Ktip HumanHairExtensions Pre Bonded Soft Straight 50g,https://rebeccahairfactory.en.made-in-china.com/product/SQupgWsAILUx/China-U-Tip-Hair-Extensions-Real-Human-Hair-Dark-Brown-Utip-Hair-Extensions-Human-Hair-for-Women-20-Inch-Brown-Ktip-Human-Hair-Extensions-Pre-Bonded-Soft-Straight-50g.html,SQupgWsAILUx,SQupgWsAILUx,78.8,USD,1,,,,,"U TipHairExtensions Real HumanHairDark Brown UtipHairExtensions HumanHairfor Women 20 Inch Brown Ktip HumanHairExtensions Pre Bonded Soft Straight 50gUS$ 78.8-86.7/ Piece1 Piece(MOQ)Henan Rebecca Hair Products Co.,LtdHenan Rebecca Hair Products Co.,LtdDiamond MemberAudited SupplierSecured TradingHenan, ChinaManufacturer/Factory & Trading CompanyISO45001:2018Enjoy trading protection from Made-in-China.comView larger video & image5(4.9)""On-time Delivery""On-time Delivery","Henan Rebecca Hair Products Co.,Ltd",https://rebeccahairfactory.en.made-in-china.com,4.9,4.0,,Henan Rebecca Hair Products Co.,"Henan, China",,,,"No. 666, Rebecca Road, Xuchang",2025-08-12T13:28:03.781226,
hair dryer,Brazilian Real Remy HumanHairHighlight 4/27 Deep Wave Frontal Lace Wig,https://elegant-hair.en.made-in-china.com/product/sfaRvSMHgxYh/China-Brazilian-Real-Remy-Human-Hair-Highlight-4-27-Deep-Wave-Frontal-Lace-Wig.html,sfaRvSMHgxYh,sfaRvSMHgxYh,53.0,USD,1,,,,,"Brazilian Real Remy HumanHairHighlight 4/27 Deep Wave Frontal Lace WigUS$ 53-206/ Piece1 Piece(MOQ)Xuchang Elegant Hair Products Co., Ltd.Xuchang Elegant Hair Products Co., Ltd.Diamond MemberAudited SupplierSecured TradingHenan, ChinaManufacturer/FactoryEnjoy trading protection from Made-in-China.comView larger video & image","Xuchang Elegant Hair Products Co., Ltd.",https://elegant-hair.en.made-in-china.com,,,,Changge Elegant Hair Products Co.,"Henan, China",,,,"Xuchang, Henan, China",2025-08-12T13:28:04.814904,
hair dryer,Factory Price Water Curly Deep Wave Ombre Highlight 4/27 Lace Front Wig,https://elegant-hair.en.made-in-china.com/product/bmsRwrUorZYN/China-Factory-Price-Water-Curly-Deep-Wave-Ombre-Highlight-4-27-Lace-Front-Wig.html,bmsRwrUorZYN,bmsRwrUorZYN,54.0,USD,1,,,,,"Factory Price Water Curly Deep Wave Ombre Highlight 4/27 Lace Front WigUS$ 54-218/ Piece1 Piece(MOQ)Xuchang Elegant Hair Products Co., Ltd.Xuchang Elegant Hair Products Co., Ltd.Diamond MemberAudited SupplierSecured TradingHenan, ChinaManufacturer/FactoryEnjoy trading protection from Made-in-China.comView larger video & image","Xuchang Elegant Hair Products Co., Ltd.",https://elegant-hair.en.made-in-china.com,,,,Changge Elegant Hair Products Co.,"Henan, China",,,,"Xuchang, Henan, China",2025-08-12T13:28:06.636732,
hair dryer,22 Inch U TipHairExtensions Ombre U TipHairExtension HumanHairU TipHairExtension Brown U Tip HumanHairExtensions for Women,https://rebeccahairfactory.en.made-in-china.com/product/exLYgfyCsPpR/China-22-Inch-U-Tip-Hair-Extensions-Ombre-U-Tip-Hair-Extension-Human-Hair-U-Tip-Hair-Extension-Brown-U-Tip-Human-Hair-Extensions-for-Women.html,exLYgfyCsPpR,exLYgfyCsPpR,86.5,USD,1,,,,,"22 Inch U TipHairExtensions Ombre U TipHairExtension HumanHairU TipHairExtension Brown U Tip HumanHairExtensions for WomenUS$ 86.5-102.1/ Piece1 Piece(MOQ)Henan Rebecca Hair Products Co.,LtdHenan Rebecca Hair Products Co.,LtdDiamond MemberAudited SupplierSecured TradingHenan, ChinaManufacturer/Factory & Trading CompanyISO45001:2018Enjoy trading protection from Made-in-China.comView larger video & image5(4.9)""On-time Delivery""On-time Delivery","Henan Rebecca Hair Products Co.,Ltd",https://rebeccahairfactory.en.made-in-china.com,4.9,4.0,,Henan Rebecca Hair Products Co.,"Henan, China",,,,"No. 666, Rebecca Road, Xuchang",2025-08-12T13:28:07.597835,
hair dryer,Wholesale Price Deep Wave Highlight 4/27 Glueless Lace Front HumanHairWigs,https://elegant-hair.en.made-in-china.com/product/xmNpgIREmwUn/China-Wholesale-Price-Deep-Wave-Highlight-4-27-Glueless-Lace-Front-Human-Hair-Wigs.html,xmNpgIREmwUn,xmNpgIREmwUn,52.0,USD,1,,,,,"Wholesale Price Deep Wave Highlight 4/27 Glueless Lace Front HumanHairWigsUS$ 52-213/ Piece1 Piece(MOQ)Xuchang Elegant Hair Products Co., Ltd.Xuchang Elegant Hair Products Co., Ltd.Diamond MemberAudited SupplierSecured TradingHenan, ChinaManufacturer/FactoryEnjoy trading protection from Made-in-China.comView larger video & image","Xuchang Elegant Hair Products Co., Ltd.",https://elegant-hair.en.made-in-china.com,,,,Changge Elegant Hair Products Co.,"Henan, China",,,,"Xuchang, Henan, China",2025-08-12T13:28:08.617990,
hair dryer,Highlight Seamless Top Quality Russian Cuticle Tape in HumanHairExtensions,https://eleganthair.en.made-in-china.com/product/kSHJRovdZYcU/China-Highlight-Seamless-Top-Quality-Russian-Cuticle-Tape-in-Human-Hair-Extensions.html,kSHJRovdZYcU,kSHJRovdZYcU,24.0,USD,1,,,,,"Highlight Seamless Top Quality Russian Cuticle Tape in HumanHairExtensionsUS$ 24/ Piece1 Piece(MOQ)Changge Elegant Hair Products Co., Ltd.Changge Elegant Hair Products Co., Ltd.Diamond MemberAudited SupplierSecured TradingHenan, ChinaEnjoy trading protection from Made-in-China.comView larger video & image5(5.0)""Fast Dispatch""Fast Dispatch","Changge Elegant Hair Products Co., Ltd.",https://eleganthair.en.made-in-china.com,5.0,5.0,,Changge Elegant Hair Products Co.,"Henan, China",,,,"Industrial Zone of Changge, Xuchang, Henan",2025-08-12T13:28:09.802495,
hair dryer,Blonde Highlight Mix Color Deep Wave Curly HD Transparent Lace Front Wigs,https://elegant-hair.en.made-in-china.com/product/laTpBXqcOQYD/China-Blonde-Highlight-Mix-Color-Deep-Wave-Curly-HD-Transparent-Lace-Front-Wigs.html,laTpBXqcOQYD,laTpBXqcOQYD,51.2,USD,1,,,,,"Blonde Highlight Mix Color Deep Wave Curly HD Transparent Lace Front WigsUS$ 51.2-196.5/ Piece1 Piece(MOQ)Xuchang Elegant Hair Products Co., Ltd.Xuchang Elegant Hair Products Co., Ltd.Diamond MemberAudited SupplierSecured TradingHenan, ChinaManufacturer/FactoryEnjoy trading protection from Made-in-China.comView larger video & image","Xuchang Elegant Hair Products Co., Ltd.",https://elegant-hair.en.made-in-china.com,,,,Changge Elegant Hair Products Co.,"Henan, China",,,,"Xuchang, Henan, China",2025-08-12T13:28:11.023442,
hair dryer,Wholesale 30inch Deep Wave HumanHairHighlight Ombre Curly Lace Frontal Wigs,https://elegant-hair.en.made-in-china.com/product/xtaRuBojIEUI/China-Wholesale-30inch-Deep-Wave-Human-Hair-Highlight-Ombre-Curly-Lace-Frontal-Wigs.html,xtaRuBojIEUI,xtaRuBojIEUI,146.5,USD,1,,,,,"Wholesale 30inch Deep Wave HumanHairHighlight Ombre Curly Lace Frontal WigsUS$ 146.5-216.3/ Piece1 Piece(MOQ)Xuchang Elegant Hair Products Co., Ltd.Xuchang Elegant Hair Products Co., Ltd.Diamond MemberAudited SupplierSecured TradingHenan, ChinaManufacturer/FactoryEnjoy trading protection from Made-in-China.comView larger video & image","Xuchang Elegant Hair Products Co., Ltd.",https://elegant-hair.en.made-in-china.com,,,,Changge Elegant Hair Products Co.,"Henan, China",,,,"Xuchang, Henan, China",2025-08-12T13:28:12.158249,
hair dryer,Multiple Colors Silky Straight HumanHairTape inHairExtensions 18-22 InchHairExtensions Tape in Remy RealHair50 Gram Tape in Extensions,https://rebeccahairfactory.en.made-in-china.com/product/ldFfTEpGTPAx/China-Multiple-Colors-Silky-Straight-Human-Hair-Tape-in-Hair-Extensions-18-22-Inch-Hair-Extensions-Tape-in-Remy-Real-Hair-50-Gram-Tape-in-Extensions.html,ldFfTEpGTPAx,ldFfTEpGTPAx,37.0,USD,1,,,,,"Multiple Colors Silky Straight HumanHairTape inHairExtensions 18-22 InchHairExtensions Tape in Remy RealHair50 Gram Tape in ExtensionsUS$ 37-54.5/ Piece1 Piece(MOQ)Henan Rebecca Hair Products Co.,LtdHenan Rebecca Hair Products Co.,LtdDiamond MemberAudited SupplierSecured TradingHenan, ChinaManufacturer/Factory & Trading CompanyISO45001:2018Enjoy trading protection from Made-in-China.comView larger video & image5(4.9)""Fast Delivery""Fast Delivery","Henan Rebecca Hair Products Co.,Ltd",https://rebeccahairfactory.en.made-in-china.com,4.9,4.0,,Henan Rebecca Hair Products Co.,"Henan, China",,,,"No. 666, Rebecca Road, Xuchang",2025-08-12T13:28:13.176619,
hair dryer,Wholesale 150% Density Pre-PluckedP4/27 Highlight Straight 13X4 Swiss Lace Front Wigs,https://elegant-hair.en.made-in-china.com/product/wnNUSqgcSOry/China-Wholesale-150-Density-Pre-Plucked-P4-27-Highlight-Straight-13X4-Swiss-Lace-Front-Wigs.html,wnNUSqgcSOry,wnNUSqgcSOry,56.0,USD,1,,,,,"Wholesale 150% Density Pre-PluckedP4/27 Highlight Straight 13X4 Swiss Lace Front WigsUS$ 56-192/ Piece1 Piece(MOQ)Xuchang Elegant Hair Products Co., Ltd.Xuchang Elegant Hair Products Co., Ltd.Diamond MemberAudited SupplierSecured TradingHenan, ChinaManufacturer/FactoryEnjoy trading protection from Made-in-China.comView larger video & image","Xuchang Elegant Hair Products Co., Ltd.",https://elegant-hair.en.made-in-china.com,,,,Changge Elegant Hair Products Co.,"Henan, China",,,,"Xuchang, Henan, China",2025-08-12T13:28:14.322489,
hair dryer,18 Inch U TipHairExtensions Medium Brown to Blonde U Tips HumanHairExtensions Highlight U TipHairExtensions HumanHairfor WomenHairExtensions,https://rebeccahairfactory.en.made-in-china.com/product/YENpBCFUZrRv/China-18-Inch-U-Tip-Hair-Extensions-Medium-Brown-to-Blonde-U-Tips-Human-Hair-Extensions-Highlight-U-Tip-Hair-Extensions-Human-Hair-for-Women-Hair-Extensions.html,YENpBCFUZrRv,YENpBCFUZrRv,49.9,USD,1,,,,,"18 Inch U TipHairExtensions Medium Brown to Blonde U Tips HumanHairExtensions Highlight U TipHairExtensions HumanHairfor WomenHairExtensionsUS$ 49.9-54.9/ Piece1 Piece(MOQ)Henan Rebecca Hair Products Co.,LtdHenan Rebecca Hair Products Co.,LtdDiamond MemberAudited SupplierSecured TradingHenan, ChinaManufacturer/Factory & Trading CompanyISO45001:2018Enjoy trading protection from Made-in-China.comView larger video & image5(4.9)""On-time Delivery""On-time Delivery","Henan Rebecca Hair Products Co.,Ltd",https://rebeccahairfactory.en.made-in-china.com,4.9,4.0,,Henan Rebecca Hair Products Co.,"Henan, China",,,,"No. 666, Rebecca Road, Xuchang",2025-08-12T13:28:15.255071,
hair dryer,Wholesale 150% DensityP4/27 Highlight Blonde Straight 13X4 Swiss Lace Front Wigs,https://elegant-hair.en.made-in-china.com/product/dQZRPHMurwYK/China-Wholesale-150-Density-P4-27-Highlight-Blonde-Straight-13X4-Swiss-Lace-Front-Wigs.html,dQZRPHMurwYK,dQZRPHMurwYK,46.3,USD,1,,,,,"Wholesale 150% DensityP4/27 Highlight Blonde Straight 13X4 Swiss Lace Front WigsUS$ 46.3-208.6/ Piece1 Piece(MOQ)Xuchang Elegant Hair Products Co., Ltd.Xuchang Elegant Hair Products Co., Ltd.Diamond MemberAudited SupplierSecured TradingHenan, ChinaManufacturer/FactoryEnjoy trading protection from Made-in-China.comView larger video & image","Xuchang Elegant Hair Products Co., Ltd.",https://elegant-hair.en.made-in-china.com,,,,Changge Elegant Hair Products Co.,"Henan, China",,,,"Xuchang, Henan, China",2025-08-12T13:28:16.288701,
hair dryer,Automatic Liquid Honey Cosmetic Packing Olive Oil Blister Forming Filling Sealing Machine,https://cngrandmachinery.en.made-in-china.com/product/adVtYyGbAcWC/China-Automatic-Liquid-Honey-Cosmetic-Packing-Olive-Oil-Blister-Forming-Filling-Sealing-Machine.html,adVtYyGbAcWC,adVtYyGbAcWC,12500.0,USD,1,,,,,"Automatic Liquid Honey Cosmetic Packing Olive Oil Blister Forming Filling Sealing MachineUS$ 12500-14000/ Set1 Set(MOQ)WENZHOU GRAND MACHINERY TECHNOLOGY CO., LTD.WENZHOU GRAND MACHINERY TECHNOLOGY CO., LTD.Diamond MemberAudited SupplierSecured TradingZhejiang, ChinaTrading CompanyEnjoy trading protection from Made-in-China.comView larger video & image5(5.0)""Fast Delivery""Fast Delivery","WENZHOU GRAND MACHINERY TECHNOLOGY CO., LTD.",https://cngrandmachinery.en.made-in-china.com,5.0,5.0,,Wenzhou Grand Machinery Technology Co.,"Province, China",,,,"Ruian Feiyun, Wenzhou, Zhejiang",2025-08-12T13:28:22.664081,
hair dryer,Automatic Single Dose Oral Liquid Packing Machine Plastic Ampoule Forming Filling Sealing Machine,https://cngrandmachinery.en.made-in-china.com/product/lnaUoHychwVf/China-Automatic-Single-Dose-Oral-Liquid-Packing-Machine-Plastic-Ampoule-Forming-Filling-Sealing-Machine.html,lnaUoHychwVf,lnaUoHychwVf,12000.0,USD,1,,,,,"Automatic Single Dose Oral Liquid Packing Machine Plastic Ampoule Forming Filling Sealing MachineUS$ 12000-14000/ Set1 Set(MOQ)WENZHOU GRAND MACHINERY TECHNOLOGY CO., LTD.WENZHOU GRAND MACHINERY TECHNOLOGY CO., LTD.Diamond MemberAudited SupplierSecured TradingZhejiang, ChinaTrading CompanyEnjoy trading protection from Made-in-China.comView larger video & image5(5.0)""Fast Dispatch""Fast Dispatch","WENZHOU GRAND MACHINERY TECHNOLOGY CO., LTD.",https://cngrandmachinery.en.made-in-china.com,5.0,5.0,,Wenzhou Grand Machinery Technology Co.,"Province, China",,,,"Ruian Feiyun, Wenzhou, Zhejiang",2025-08-12T13:28:23.721378,
hair dryer,Ffs Oral Liquid Olive Oil Plastic Ampoule Forming Filling and Sealing Machine,https://cngrandmachinery.en.made-in-china.com/product/QxzrJMIVgdcO/China-Ffs-Oral-Liquid-Olive-Oil-Plastic-Ampoule-Forming-Filling-and-Sealing-Machine.html,QxzrJMIVgdcO,QxzrJMIVgdcO,13000.0,USD,1,,,,,"Ffs Oral Liquid Olive Oil Plastic Ampoule Forming Filling and Sealing MachineUS$ 13000-15000/ Set1 Set(MOQ)WENZHOU GRAND MACHINERY TECHNOLOGY CO., LTD.WENZHOU GRAND MACHINERY TECHNOLOGY CO., LTD.Diamond MemberAudited SupplierSecured TradingZhejiang, ChinaTrading CompanyEnjoy trading protection from Made-in-China.comView larger video & image5(5.0)""On-time Delivery""On-time Delivery","WENZHOU GRAND MACHINERY TECHNOLOGY CO., LTD.",https://cngrandmachinery.en.made-in-china.com,5.0,5.0,,Wenzhou Grand Machinery Technology Co.,"Province, China",,,,"Ruian Feiyun, Wenzhou, Zhejiang",2025-08-12T13:28:24.802372,
hair dryer,Automatic Olive Oil Packing Machine Liquid Ampoule Forming Filling and Packaging Machine,https://cngrandmachinery.en.made-in-china.com/product/pAEreOaGIxVv/China-Automatic-Olive-Oil-Packing-Machine-Liquid-Ampoule-Forming-Filling-and-Packaging-Machine.html,pAEreOaGIxVv,pAEreOaGIxVv,11000.0,USD,1,,,,,"Automatic Olive Oil Packing Machine Liquid Ampoule Forming Filling and Packaging MachineUS$ 11000-13000/ Set1 Set(MOQ)WENZHOU GRAND MACHINERY TECHNOLOGY CO., LTD.WENZHOU GRAND MACHINERY TECHNOLOGY CO., LTD.Diamond MemberAudited SupplierSecured TradingZhejiang, ChinaTrading CompanyEnjoy trading protection from Made-in-China.comView larger video & image5(5.0)""Fast Dispatch""Fast Dispatch","WENZHOU GRAND MACHINERY TECHNOLOGY CO., LTD.",https://cngrandmachinery.en.made-in-china.com,5.0,5.0,,Wenzhou Grand Machinery Technology Co.,"Province, China",,,,"Ruian Feiyun, Wenzhou, Zhejiang",2025-08-12T13:28:25.900118,
hair dryer,UK Plug AC Power Cord Cable forHairDryerPower Cable,https://yiliancable.en.made-in-china.com/product/hGirTdcVEvWs/China-UK-Plug-AC-Power-Cord-Cable-for-Hair-Dryer-Power-Cable.html,hGirTdcVEvWs,hGirTdcVEvWs,0.25,USD,5000,,,,,"UK Plug AC Power Cord Cable forHairDryerPower CableUS$ 0.25-0.33/ Piece5000 Pieces(MOQ)Guangdong Yilian Cables Co., Ltd.Guangdong Yilian Cables Co., Ltd.Diamond MemberAudited SupplierGuangdong, ChinaManufacturer/FactoryISO9001:2015View larger video & image","Guangdong Yilian Cables Co., Ltd.",https://yiliancable.en.made-in-china.com,,,,Guangdong Yilian Cables Company Ltd,"Guangdong, China",,,,"Jintian Industrial Zone, Houpu, Mianhu Town",2025-08-12T13:28:27.516903,
hair dryer,8ml Plastic Ampoule 10ml Vial Olive Oil Honey Bfs Oral Liquid Forming Filling and Sealing Machine,https://cngrandmachinery.en.made-in-china.com/product/JmSYOzrDZCkw/China-8ml-Plastic-Ampoule-10ml-Vial-Olive-Oil-Honey-Bfs-Oral-Liquid-Forming-Filling-and-Sealing-Machine.html,JmSYOzrDZCkw,JmSYOzrDZCkw,12000.0,USD,1,,,,,"8ml Plastic Ampoule 10ml Vial Olive Oil Honey Bfs Oral Liquid Forming Filling and Sealing MachineUS$ 12000-14000/ Set1 Set(MOQ)WENZHOU GRAND MACHINERY TECHNOLOGY CO., LTD.WENZHOU GRAND MACHINERY TECHNOLOGY CO., LTD.Diamond MemberAudited SupplierSecured TradingZhejiang, ChinaTrading CompanyEnjoy trading protection from Made-in-China.comView larger video & image5(5.0)""On-time Delivery""On-time Delivery","WENZHOU GRAND MACHINERY TECHNOLOGY CO., LTD.",https://cngrandmachinery.en.made-in-china.com,5.0,5.0,,Wenzhou Grand Machinery Technology Co.,"Province, China",,,,"Ruian Feiyun, Wenzhou, Zhejiang",2025-08-12T13:28:28.610836,
hair dryer,Micro 689 2RS 689zz Deep Groove Ball Bearing 9*17*4mmHairDryerBlower Motor Bearing,https://fskbearing.en.made-in-china.com/product/AncYpHdChShR/China-Micro-689-2RS-689zz-Deep-Groove-Ball-Bearing-9-17-4mm-Hair-Dryer-Blower-Motor-Bearing.html,AncYpHdChShR,AncYpHdChShR,0.5,USD,1,,,,,"Micro 689 2RS 689zz Deep Groove Ball Bearing 9*17*4mmHairDryerBlower Motor BearingUS$ 0.5/ Piece1 Piece(MOQ)Wuxi Fsk Transmission Bearing Co., Ltd.Wuxi Fsk Transmission Bearing Co., Ltd.Diamond MemberAudited SupplierSecured TradingJiangsu, ChinaEnjoy trading protection from Made-in-China.comView larger video & image5(5.0)""Fast Delivery""Fast Delivery","Wuxi Fsk Transmission Bearing Co., Ltd.",https://fskbearing.en.made-in-china.com,5.0,5.0,,"Post Sourcing Request













Wuxi Fsk Transmission Bearing Co.","Jiangsu, China",,,,"No. 220 Middle Renmin Road Liangxi District Wuxi Jiangsu, Wuxi, Jiangsu",2025-08-12T13:28:30.623648,
hair dryer,Deep Groove Ball Bearings 608 for Pumps,https://kent-bearing.en.made-in-china.com/product/MJLYZncCCkhV/China-Deep-Groove-Ball-Bearings-608-for-Pumps.html,MJLYZncCCkhV,MJLYZncCCkhV,0.1,USD,1000,,,,,"Deep Groove Ball Bearings 608 for PumpsUS$ 0.1-10/ Piece1000 Pieces(MOQ)Ningbo Kent Bearing Co., Ltd.Ningbo Kent Bearing Co., Ltd.Diamond MemberAudited SupplierZhejiang, ChinaView larger video & image5(5.0)""Fast Dispatch""Fast Dispatch","Ningbo Kent Bearing Co., Ltd.",https://kent-bearing.en.made-in-china.com,5.0,5.0,,"Post Sourcing Request
















                                    Ningbo Kent Bearing Co.","Zhejiang, China",,,,"Mayan Industry Zone, Henghe Town, Ningbo",2025-08-12T13:28:32.502304,
hair dryer,1.5mm Thickness 1000*600mm High Temperature Mica Sheet Heating Element,https://superbheater.en.made-in-china.com/product/JeEniSYMaFTo/China-1-5mm-Thickness-1000-600mm-High-Temperature-Mica-Sheet-Heating-Element.html,JeEniSYMaFTo,JeEniSYMaFTo,1.0,USD,1,,,,,"1.5mm Thickness 1000*600mm High Temperature Mica Sheet Heating ElementUS$ 1-9/ Piece1 Piece(MOQ)Shenzhen Superb Heater Technology Co., LimitedShenzhen Superb Heater Technology Co., LimitedDiamond MemberAudited SupplierGuangdong, ChinaView larger video & image","Shenzhen Superb Heater Technology Co., Limited",https://superbheater.en.made-in-china.com,,,,,"Guangdong, China",,,,"2f, No3 Third Industrial Zone, Shiyan Town",2025-08-12T13:28:34.561059,
hair dryer,Electric Insulation Mica Sheet 0.5mm Thin Mica Sheet Mica Paper Price,https://superbheater.en.made-in-china.com/product/ZtNryQbAXlWu/China-Electric-Insulation-Mica-Sheet-0-5mm-Thin-Mica-Sheet-Mica-Paper-Price.html,ZtNryQbAXlWu,ZtNryQbAXlWu,0.8,USD,1,,,,,"Electric Insulation Mica Sheet 0.5mm Thin Mica Sheet Mica Paper PriceUS$ 0.8-12/ Piece1 Piece(MOQ)Shenzhen Superb Heater Technology Co., LimitedShenzhen Superb Heater Technology Co., LimitedDiamond MemberAudited SupplierGuangdong, ChinaView larger video & image","Shenzhen Superb Heater Technology Co., Limited",https://superbheater.en.made-in-china.com,,,,,"Guangdong, China",,,,"2f, No3 Third Industrial Zone, Shiyan Town",2025-08-12T13:28:35.779202,
hair dryer,"Bearing for Autoparts, Motorcyle Parts, Ball Bearings 60 Series",https://kent-bearing.en.made-in-china.com/product/pxuURmwjOWVL/China-Bearing-for-Autoparts-Motorcyle-Parts-Ball-Bearings-60-Series.html,pxuURmwjOWVL,pxuURmwjOWVL,0.1,USD,1000,,,,,"Bearing for Autoparts, Motorcyle Parts, Ball Bearings 60 SeriesUS$ 0.1-10/ Set1000 Sets(MOQ)Ningbo Kent Bearing Co., Ltd.Ningbo Kent Bearing Co., Ltd.Diamond MemberAudited SupplierZhejiang, ChinaView larger video & image5(5.0)""On-time Delivery""On-time Delivery","Ningbo Kent Bearing Co., Ltd.",https://kent-bearing.en.made-in-china.com,5.0,5.0,,"Post Sourcing Request
















                                    Ningbo Kent Bearing Co.","Zhejiang, China",,,,"Mayan Industry Zone, Henghe Town, Ningbo",2025-08-12T13:28:36.759729,
hair dryer,Mica Board Manufacturers Can Customize High-Temperature Resistant Mica Board Silver Insulation Board,https://superbheater.en.made-in-china.com/product/eQbRSyKCSMWl/China-Mica-Board-Manufacturers-Can-Customize-High-Temperature-Resistant-Mica-Board-Silver-Insulation-Board.html,eQbRSyKCSMWl,eQbRSyKCSMWl,1.0,USD,10,,,,,"Mica Board Manufacturers Can Customize High-Temperature Resistant Mica Board Silver Insulation BoardUS$ 1-1.4/ Piece10 Pieces(MOQ)Shenzhen Superb Heater Technology Co., LimitedShenzhen Superb Heater Technology Co., LimitedDiamond MemberAudited SupplierGuangdong, ChinaView larger video & image","Shenzhen Superb Heater Technology Co., Limited",https://superbheater.en.made-in-china.com,,,,,"Guangdong, China",,,,"2f, No3 Third Industrial Zone, Shiyan Town",2025-08-12T13:28:37.964911,
hair dryer,"P6 Precision 6000 Series Ball Bearings for Meters, Motors, Washing Machines,HairDryers, Electric Tools",https://kent-bearing.en.made-in-china.com/product/IxYUnQOHTVWm/China-P6-Precision-6000-Series-Ball-Bearings-for-Meters-Motors-Washing-Machines-Hair-Dryers-Electric-Tools.html,IxYUnQOHTVWm,IxYUnQOHTVWm,0.1,USD,100,,,,,"P6 Precision 6000 Series Ball Bearings for Meters, Motors, Washing Machines,HairDryers, Electric ToolsUS$ 0.1-10/ Set100 Sets(MOQ)Ningbo Kent Bearing Co., Ltd.Ningbo Kent Bearing Co., Ltd.Diamond MemberAudited SupplierZhejiang, ChinaView larger video & image5(5.0)""Fast Delivery""Fast Delivery","Ningbo Kent Bearing Co., Ltd.",https://kent-bearing.en.made-in-china.com,5.0,5.0,,"Post Sourcing Request
















                                    Ningbo Kent Bearing Co.","Zhejiang, China",,,,"Mayan Industry Zone, Henghe Town, Ningbo",2025-08-12T13:28:38.909694,
hair dryer,1.0mm Thickness 1000*600mm High Temperature Mica Sheet,https://superbheater.en.made-in-china.com/product/moQJDrYxmOAM/China-1-0mm-Thickness-1000-600mm-High-Temperature-Mica-Sheet.html,moQJDrYxmOAM,moQJDrYxmOAM,3.0,USD,5,,,,,"1.0mm Thickness 1000*600mm High Temperature Mica SheetUS$ 3-6/ Piece5 Pieces(MOQ)Shenzhen Superb Heater Technology Co., LimitedShenzhen Superb Heater Technology Co., LimitedDiamond MemberAudited SupplierGuangdong, ChinaView larger video & image","Shenzhen Superb Heater Technology Co., Limited",https://superbheater.en.made-in-china.com,,,,,"Guangdong, China",,,,"2f, No3 Third Industrial Zone, Shiyan Town",2025-08-12T13:28:40.208001,
hair dryer,Mica Plates Sheets Thick Microwave Oven Replacement Part for Midea Universal Home Appliances Parts,https://superbheater.en.made-in-china.com/product/ECsmSfrdHthP/China-Mica-Plates-Sheets-Thick-Microwave-Oven-Replacement-Part-for-Midea-Universal-Home-Appliances-Parts.html,ECsmSfrdHthP,ECsmSfrdHthP,,USD,50,,,,,"Mica Plates Sheets Thick Microwave Oven Replacement Part for Midea Universal Home Appliances Parts50 Pieces(MOQ)Shenzhen Superb Heater Technology Co., LimitedShenzhen Superb Heater Technology Co., LimitedDiamond MemberAudited SupplierGuangdong, ChinaView larger video & image","Shenzhen Superb Heater Technology Co., Limited",https://superbheater.en.made-in-china.com,,,,,"Guangdong, China",,,,"2f, No3 Third Industrial Zone, Shiyan Town",2025-08-12T13:28:41.436346,
hair dryer,0.8mm Thickness 1000*1200mm High Temperature Mica Sheet,https://superbheater.en.made-in-china.com/product/qMxmIopDgZth/China-0-8mm-Thickness-1000-1200mm-High-Temperature-Mica-Sheet.html,qMxmIopDgZth,qMxmIopDgZth,1.0,USD,1,,,,,"0.8mm Thickness 1000*1200mm High Temperature Mica SheetUS$ 1-9/ Piece1 Piece(MOQ)Shenzhen Superb Heater Technology Co., LimitedShenzhen Superb Heater Technology Co., LimitedDiamond MemberAudited SupplierGuangdong, ChinaView larger video & image","Shenzhen Superb Heater Technology Co., Limited",https://superbheater.en.made-in-china.com,,,,,"Guangdong, China",,,,"2f, No3 Third Industrial Zone, Shiyan Town",2025-08-12T13:28:42.651274,
hair dryer,0.3mm Thickness 1000*600mm Mica Sheet in Mica Heater,https://superbheater.en.made-in-china.com/product/beQEHMpFXOTI/China-0-3mm-Thickness-1000-600mm-Mica-Sheet-in-Mica-Heater.html,beQEHMpFXOTI,beQEHMpFXOTI,3.0,USD,5,,,,,"0.3mm Thickness 1000*600mm Mica Sheet in Mica HeaterUS$ 3-6/ Piece5 Pieces(MOQ)Shenzhen Superb Heater Technology Co., LimitedShenzhen Superb Heater Technology Co., LimitedDiamond MemberAudited SupplierGuangdong, ChinaView larger video & image","Shenzhen Superb Heater Technology Co., Limited",https://superbheater.en.made-in-china.com,,,,,"Guangdong, China",,,,"2f, No3 Third Industrial Zone, Shiyan Town",2025-08-12T13:28:43.858948,
