keyword,title,listing_url,item_number,sku,price,currency,min_order_quantity,max_order_quantity,description,seller_name,seller_profile_url,seller_rating,seller_total_reviews,seller_business_name,seller_country,seller_address,seller_email,scraped_at,last_updated
hair dryer,Multiple Colors Silky Straight HumanHairTape inHairExtensions 18-22 InchHairExtensions Tape in Remy RealHair50 Gram Tape in Extensions,https://rebeccahairfactory.en.made-in-china.com/product/ldFfTEpGTPAx/China-Multiple-Colors-Silky-Straight-Human-Hair-Tape-in-Hair-Extensions-18-22-Inch-Hair-Extensions-Tape-in-Remy-Real-Hair-50-Gram-Tape-in-Extensions.html,,1,37.0,USD,1,,"Multiple Colors Silky Straight HumanHairTape inHairExtensions 18-22 InchHairExtensions Tape in Remy RealHair50 Gram Tape in ExtensionsUS$ 37-54.5/ Piece1 Piece(MOQ)Henan Rebecca Hair Products Co.,LtdHenan Rebecca Hair Products Co.,LtdDiamond MemberAudited SupplierSecured TradingHenan, ChinaManufacturer/Factory & Trading CompanyISO45001:2018Enjoy trading protection from Made-in-China.comView larger video & image5(4.9)""Fast Dispatch""Fast Dispatch","Henan Rebecca Hair Products Co.,Ltd",https://rebeccahairfactory.en.made-in-china.com,4.9,4.0,Henan Rebecca Hair Products Co.,"Henan, China","No. 666, Rebecca Road, Xuchang",,2025-08-12T20:15:51.994339,
hair dryer,U TipHairExtensions Real HumanHairDark Brown UtipHairExtensions HumanHairfor Women 20 Inch Brown Ktip HumanHairExtensions Pre Bonded Soft Straight 50g,https://rebeccahairfactory.en.made-in-china.com/product/SQupgWsAILUx/China-U-Tip-Hair-Extensions-Real-Human-Hair-Dark-Brown-Utip-Hair-Extensions-Human-Hair-for-Women-20-Inch-Brown-Ktip-Human-Hair-Extensions-Pre-Bonded-Soft-Straight-50g.html,,1,78.8,USD,1,,"U TipHairExtensions Real HumanHairDark Brown UtipHairExtensions HumanHairfor Women 20 Inch Brown Ktip HumanHairExtensions Pre Bonded Soft Straight 50gUS$ 78.8-86.7/ Piece1 Piece(MOQ)Henan Rebecca Hair Products Co.,LtdHenan Rebecca Hair Products Co.,LtdDiamond MemberAudited SupplierSecured TradingHenan, ChinaManufacturer/Factory & Trading CompanyISO45001:2018Enjoy trading protection from Made-in-China.comView larger video & image5(4.9)""Fast Delivery""Fast Delivery","Henan Rebecca Hair Products Co.,Ltd",https://rebeccahairfactory.en.made-in-china.com,4.9,4.0,Henan Rebecca Hair Products Co.,"Henan, China","No. 666, Rebecca Road, Xuchang",,2025-08-12T20:15:53.117633,
hair dryer,22 Inch U TipHairExtensions Ombre U TipHairExtension HumanHairU TipHairExtension Brown U Tip HumanHairExtensions for Women,https://rebeccahairfactory.en.made-in-china.com/product/exLYgfyCsPpR/China-22-Inch-U-Tip-Hair-Extensions-Ombre-U-Tip-Hair-Extension-Human-Hair-U-Tip-Hair-Extension-Brown-U-Tip-Human-Hair-Extensions-for-Women.html,,1,86.5,USD,1,,"22 Inch U TipHairExtensions Ombre U TipHairExtension HumanHairU TipHairExtension Brown U Tip HumanHairExtensions for WomenUS$ 86.5-102.1/ Piece1 Piece(MOQ)Henan Rebecca Hair Products Co.,LtdHenan Rebecca Hair Products Co.,LtdDiamond MemberAudited SupplierSecured TradingHenan, ChinaManufacturer/Factory & Trading CompanyISO45001:2018Enjoy trading protection from Made-in-China.comView larger video & image5(4.9)""Fast Dispatch""Fast Dispatch","Henan Rebecca Hair Products Co.,Ltd",https://rebeccahairfactory.en.made-in-china.com,4.9,4.0,Henan Rebecca Hair Products Co.,"Henan, China","No. 666, Rebecca Road, Xuchang",,2025-08-12T20:15:54.196626,
hair dryer,18 Inch U TipHairExtensions Medium Brown to Blonde U Tips HumanHairExtensions Highlight U TipHairExtensions HumanHairfor WomenHairExtensions,https://rebeccahairfactory.en.made-in-china.com/product/YENpBCFUZrRv/China-18-Inch-U-Tip-Hair-Extensions-Medium-Brown-to-Blonde-U-Tips-Human-Hair-Extensions-Highlight-U-Tip-Hair-Extensions-Human-Hair-for-Women-Hair-Extensions.html,,1,49.9,USD,1,,"18 Inch U TipHairExtensions Medium Brown to Blonde U Tips HumanHairExtensions Highlight U TipHairExtensions HumanHairfor WomenHairExtensionsUS$ 49.9-54.9/ Piece1 Piece(MOQ)Henan Rebecca Hair Products Co.,LtdHenan Rebecca Hair Products Co.,LtdDiamond MemberAudited SupplierSecured TradingHenan, ChinaManufacturer/Factory & Trading CompanyISO45001:2018Enjoy trading protection from Made-in-China.comView larger video & image5(4.9)""Fast Dispatch""Fast Dispatch","Henan Rebecca Hair Products Co.,Ltd",https://rebeccahairfactory.en.made-in-china.com,4.9,4.0,Henan Rebecca Hair Products Co.,"Henan, China","No. 666, Rebecca Road, Xuchang",,2025-08-12T20:15:55.312693,
hair dryer,"20"" U TipHairExtensions HumanHairU Tip Multiple Colours Choose NaturalHairExtensions HumanHairTipHairExtensions for Women",https://rebeccahairfactory.en.made-in-china.com/product/VnzRwMZTbrUX/China-20-U-Tip-Hair-Extensions-Human-Hair-U-Tip-Multiple-Colours-Choose-Natural-Hair-Extensions-Human-Hair-Tip-Hair-Extensions-for-Women.html,,1,65.1,USD,1,,"20"" U TipHairExtensions HumanHairU Tip Multiple Colours Choose NaturalHairExtensions HumanHairTipHairExtensions for WomenUS$ 65.1-86.7/ Piece1 Piece(MOQ)Henan Rebecca Hair Products Co.,LtdHenan Rebecca Hair Products Co.,LtdDiamond MemberAudited SupplierSecured TradingHenan, ChinaManufacturer/Factory & Trading CompanyISO45001:2018Enjoy trading protection from Made-in-China.comView larger video & image5(4.9)""Fast Dispatch""Fast Dispatch","Henan Rebecca Hair Products Co.,Ltd",https://rebeccahairfactory.en.made-in-china.com,4.9,4.0,Henan Rebecca Hair Products Co.,"Henan, China","No. 666, Rebecca Road, Xuchang",,2025-08-12T20:15:57.083679,
hair dryer,Wholesale 100% Real Natural Virgin Best Seamless 100% Brazilian Remy Clip inHairExtension,https://shangkaihair.en.made-in-china.com/product/FycnSLxTCbWH/China-Wholesale-100-Real-Natural-Virgin-Best-Seamless-100-Brazilian-Remy-Clip-in-Hair-Extension.html,,1,28.0,USD,1,,"Wholesale 100% Real Natural Virgin Best Seamless 100% Brazilian Remy Clip inHairExtensionUS$ 28-88/ Piece1 Piece(MOQ)Juancheng Shangkai Hair Products FactoryJuancheng Shangkai Hair Products FactoryDiamond MemberAudited SupplierSecured TradingShandong, ChinaManufacturer/Factory & Trading CompanyEnjoy trading protection from Made-in-China.comView larger video & image5(5.0)""Fantastic Service""Fantastic Service",Juancheng Shangkai Hair Products,https://shangkaihair.en.made-in-china.com,5.0,5.0,Factory & Trading Company,"Shandong, China","2nd Human Hair Industry,Juancheng, Heze",,2025-08-12T20:15:59.443823,
hair dryer,Ce Certification 24V 10000rpm 100W 200W PMDC Motor with Silicon Wire,https://greatup.en.made-in-china.com/product/xvanFoLOfZWH/China-Ce-Certification-24V-10000rpm-100W-200W-PMDC-Motor-with-Silicon-Wire.html,,1,3.05,USD,1000,,"Ce Certification 24V 10000rpm 100W 200W PMDC Motor with Silicon WireUS$ 3.05-3.78/ Piece1000 Pieces(MOQ)RITSCHER INTERNATIONAL LIMITEDRITSCHER INTERNATIONAL LIMITEDDiamond MemberAudited SupplierGuangdong, ChinaView larger video & image",RITSCHER INTERNATIONAL LIMITED,https://greatup.en.made-in-china.com,,,Ritscher group,"Guangdong, China","Dongfeng Town, Zhongshan City, Zhongshan",,2025-08-12T20:16:01.431617,
hair dryer,Wholesale Blonde Ombre Color Balayage Color Russian Seamless Clip inHairExtension,https://shangkaihair.en.made-in-china.com/product/ACVnsvJxXocS/China-Wholesale-Blonde-Ombre-Color-Balayage-Color-Russian-Seamless-Clip-in-Hair-Extension.html,,1,28.0,USD,1,,"Wholesale Blonde Ombre Color Balayage Color Russian Seamless Clip inHairExtensionUS$ 28-88/ Piece1 Piece(MOQ)Juancheng Shangkai Hair Products FactoryJuancheng Shangkai Hair Products FactoryDiamond MemberAudited SupplierSecured TradingShandong, ChinaManufacturer/Factory & Trading CompanyEnjoy trading protection from Made-in-China.comView larger video & image5(5.0)""Fantastic Service""Fantastic Service",Juancheng Shangkai Hair Products,https://shangkaihair.en.made-in-china.com,5.0,5.0,Factory & Trading Company,"Shandong, China","2nd Human Hair Industry,Juancheng, Heze",,2025-08-12T20:16:02.797227,
hair dryer,AC 3000rpm Gear Electric Motor for Hood Oven/Pump/Dry-Type Transformer/Forced Airflow Systems/Lubricant Pump,https://greatup.en.made-in-china.com/product/vXznRdoxYLVE/China-AC-3000rpm-Gear-Electric-Motor-for-Hood-Oven-Pump-Dry-Type-Transformer-Forced-Airflow-Systems-Lubricant-Pump.html,,1,1.8,USD,1000,,"AC 3000rpm Gear Electric Motor for Hood Oven/Pump/Dry-Type Transformer/Forced Airflow Systems/Lubricant PumpUS$ 1.8-2.5/ Piece1000 Pieces(MOQ)RITSCHER INTERNATIONAL LIMITEDRITSCHER INTERNATIONAL LIMITEDDiamond MemberAudited SupplierGuangdong, ChinaView larger video & image",RITSCHER INTERNATIONAL LIMITED,https://greatup.en.made-in-china.com,,,Ritscher group,"Guangdong, China","Dongfeng Town, Zhongshan City, Zhongshan",,2025-08-12T20:16:03.919540,
hair dryer,"Brazilian HumanHairSeamless Clip inHairExtension for White Woman, AfroHairExtension Clip in Remy",https://shangkaihair.en.made-in-china.com/product/jsVmKDxTbbWU/China-Brazilian-Human-Hair-Seamless-Clip-in-Hair-Extension-for-White-Woman-Afro-Hair-Extension-Clip-in-Remy.html,,1,28.0,USD,1,,"Brazilian HumanHairSeamless Clip inHairExtension for White Woman, AfroHairExtension Clip in RemyUS$ 28-88/ Piece1 Piece(MOQ)Juancheng Shangkai Hair Products FactoryJuancheng Shangkai Hair Products FactoryDiamond MemberAudited SupplierSecured TradingShandong, ChinaManufacturer/Factory & Trading CompanyEnjoy trading protection from Made-in-China.comView larger video & image5(5.0)""Perfect Service""Perfect Service",Juancheng Shangkai Hair Products,https://shangkaihair.en.made-in-china.com,5.0,5.0,Factory & Trading Company,"Shandong, China","2nd Human Hair Industry,Juancheng, Heze",,2025-08-12T20:16:05.298427,
hair dryer,High-Quality 100g 20 Inch Wholesale Price InvisiableHairPieces HumanHairStraight Fish-Line Wire MicroHairExtension for Women,https://rebeccahairfactory.en.made-in-china.com/product/AxHpmCEborRG/China-High-Quality-100g-20-Inch-Wholesale-Price-Invisiable-Hair-Pieces-Human-Hair-Straight-Fish-Line-Wire-Micro-Hair-Extension-for-Women.html,,1,65.5,USD,1,,"High-Quality 100g 20 Inch Wholesale Price InvisiableHairPieces HumanHairStraight Fish-Line Wire MicroHairExtension for WomenUS$ 65.5-89.8/ Piece1 Piece(MOQ)Henan Rebecca Hair Products Co.,LtdHenan Rebecca Hair Products Co.,LtdDiamond MemberAudited SupplierSecured TradingHenan, ChinaManufacturer/Factory & Trading CompanyISO45001:2018Enjoy trading protection from Made-in-China.comView larger video & image5(4.9)""Fast Delivery""Fast Delivery","Henan Rebecca Hair Products Co.,Ltd",https://rebeccahairfactory.en.made-in-china.com,4.9,4.0,Henan Rebecca Hair Products Co.,"Henan, China","No. 666, Rebecca Road, Xuchang",,2025-08-12T20:16:06.443642,
hair dryer,AC Fan Electrical/Electric Shaded Pole Motor for Refrigerator/Range Hood/Air Purifier Motor,https://greatup.en.made-in-china.com/product/kyAQbHSuZKVz/China-AC-Fan-Electrical-Electric-Shaded-Pole-Motor-for-Refrigerator-Range-Hood-Air-Purifier-Motor.html,,1,2.2,USD,500,,"AC Fan Electrical/Electric Shaded Pole Motor for Refrigerator/Range Hood/Air Purifier MotorUS$ 2.2-3.5/ Piece500 Pieces(MOQ)RITSCHER INTERNATIONAL LIMITEDRITSCHER INTERNATIONAL LIMITEDDiamond MemberAudited SupplierGuangdong, ChinaView larger video & image",RITSCHER INTERNATIONAL LIMITED,https://greatup.en.made-in-china.com,,,Ritscher group,"Guangdong, China","Dongfeng Town, Zhongshan City, Zhongshan",,2025-08-12T20:16:07.581699,
hair dryer,Factory Price Thickness End Luxy Seamless Remy Clip inHairExtension,https://shangkaihair.en.made-in-china.com/product/aCkxvAnGIocQ/China-Factory-Price-Thickness-End-Luxy-Seamless-Remy-Clip-in-Hair-Extension.html,,1,28.0,USD,1,,"Factory Price Thickness End Luxy Seamless Remy Clip inHairExtensionUS$ 28-88/ Piece1 Piece(MOQ)Juancheng Shangkai Hair Products FactoryJuancheng Shangkai Hair Products FactoryDiamond MemberAudited SupplierSecured TradingShandong, ChinaManufacturer/Factory & Trading CompanyEnjoy trading protection from Made-in-China.comView larger video & image5(5.0)""Professional Service""Professional Service",Juancheng Shangkai Hair Products,https://shangkaihair.en.made-in-china.com,5.0,5.0,Factory & Trading Company,"Shandong, China","2nd Human Hair Industry,Juancheng, Heze",,2025-08-12T20:16:08.841068,
hair dryer,Long Size Wholesale Price Soft and Silky 22-Inch U TipHairExtensions Remy U TipsHairExtensions Real HumanHairExtensions,https://rebeccahairfactory.en.made-in-china.com/product/kxlrgnJEWYpK/China-Long-Size-Wholesale-Price-Soft-and-Silky-22-Inch-U-Tip-Hair-Extensions-Remy-U-Tips-Hair-Extensions-Real-Human-Hair-Extensions.html,,1,78.2,USD,1,,"Long Size Wholesale Price Soft and Silky 22-Inch U TipHairExtensions Remy U TipsHairExtensions Real HumanHairExtensionsUS$ 78.2-102.1/ Piece1 Piece(MOQ)Henan Rebecca Hair Products Co.,LtdHenan Rebecca Hair Products Co.,LtdDiamond MemberAudited SupplierSecured TradingHenan, ChinaManufacturer/Factory & Trading CompanyISO45001:2018Enjoy trading protection from Made-in-China.comView larger video & image5(4.9)""On-time Delivery""On-time Delivery","Henan Rebecca Hair Products Co.,Ltd",https://rebeccahairfactory.en.made-in-china.com,4.9,4.0,Henan Rebecca Hair Products Co.,"Henan, China","No. 666, Rebecca Road, Xuchang",,2025-08-12T20:16:10.164172,
hair dryer,"20"" Multiple Colours Tape inHairExtensions, Seamless Tape inHairExtensions Real HumanHairExtensions RemyHairTape inHairfor Women",https://rebeccahairfactory.en.made-in-china.com/product/WwOtfncuJLAP/China-20-Multiple-Colours-Tape-in-Hair-Extensions-Seamless-Tape-in-Hair-Extensions-Real-Human-Hair-Extensions-Remy-Hair-Tape-in-Hair-for-Women.html,,1,42.5,USD,1,,"20"" Multiple Colours Tape inHairExtensions, Seamless Tape inHairExtensions Real HumanHairExtensions RemyHairTape inHairfor WomenUS$ 42.5-46.8/ Piece1 Piece(MOQ)Henan Rebecca Hair Products Co.,LtdHenan Rebecca Hair Products Co.,LtdDiamond MemberAudited SupplierSecured TradingHenan, ChinaManufacturer/Factory & Trading CompanyISO45001:2018Enjoy trading protection from Made-in-China.comView larger video & image5(4.9)""Fast Delivery""Fast Delivery","Henan Rebecca Hair Products Co.,Ltd",https://rebeccahairfactory.en.made-in-china.com,4.9,4.0,Henan Rebecca Hair Products Co.,"Henan, China","No. 666, Rebecca Road, Xuchang",,2025-08-12T20:16:11.470735,
hair dryer,Long Life AC Electric Single-Phase Motor for Vacuum Fan Motor,https://greatup.en.made-in-china.com/product/hBaQLVConFcA/China-Long-Life-AC-Electric-Single-Phase-Motor-for-Vacuum-Fan-Motor.html,,1,2.5,USD,800,,"Long Life AC Electric Single-Phase Motor for Vacuum Fan MotorUS$ 2.5-3.8/ Piece800 Pieces(MOQ)RITSCHER INTERNATIONAL LIMITEDRITSCHER INTERNATIONAL LIMITEDDiamond MemberAudited SupplierGuangdong, ChinaView larger video & image",RITSCHER INTERNATIONAL LIMITED,https://greatup.en.made-in-china.com,,,Ritscher group,"Guangdong, China","Dongfeng Town, Zhongshan City, Zhongshan",,2025-08-12T20:16:12.594344,
hair dryer,Virgin BrazilianHairSeamless Human RemyHairClip in Extensions,https://shangkaihair.en.made-in-china.com/product/qycJSOmCGbVF/China-Virgin-Brazilian-Hair-Seamless-Human-Remy-Hair-Clip-in-Extensions.html,,1,58.0,USD,1,,"Virgin BrazilianHairSeamless Human RemyHairClip in ExtensionsUS$ 58-128/ Piece1 Piece(MOQ)Juancheng Shangkai Hair Products FactoryJuancheng Shangkai Hair Products FactoryDiamond MemberAudited SupplierSecured TradingShandong, ChinaManufacturer/Factory & Trading CompanyEnjoy trading protection from Made-in-China.comView larger video & image5(5.0)""Helpful Customer Service""Helpful Customer Service",Juancheng Shangkai Hair Products,https://shangkaihair.en.made-in-china.com,5.0,5.0,Factory & Trading Company,"Shandong, China","2nd Human Hair Industry,Juancheng, Heze",,2025-08-12T20:16:14.091480,
hair dryer,Electric/Electrical Yj72 AC High Quality Shaded Pole Motor for Exhaust Fan Motor,https://greatup.en.made-in-china.com/product/NBqJMSlYLsWR/China-Electric-Electrical-Yj72-AC-High-Quality-Shaded-Pole-Motor-for-Exhaust-Fan-Motor.html,,1,3.2,USD,1000,,"Electric/Electrical Yj72 AC High Quality Shaded Pole Motor for Exhaust Fan MotorUS$ 3.2/ Piece1000 Pieces(MOQ)RITSCHER INTERNATIONAL LIMITEDRITSCHER INTERNATIONAL LIMITEDDiamond MemberAudited SupplierGuangdong, ChinaView larger video & image",RITSCHER INTERNATIONAL LIMITED,https://greatup.en.made-in-china.com,,,Ritscher group,"Guangdong, China","Dongfeng Town, Zhongshan City, Zhongshan",,2025-08-12T20:16:15.273808,
hair dryer,Seamless Clip inHairExtension Russian VirginHairClip HumanHairExtensions,https://shangkaihair.en.made-in-china.com/product/gshxqbEYnokZ/China-Seamless-Clip-in-Hair-Extension-Russian-Virgin-Hair-Clip-Human-Hair-Extensions.html,,1,58.0,USD,1,,"Seamless Clip inHairExtension Russian VirginHairClip HumanHairExtensionsUS$ 58-128/ Piece1 Piece(MOQ)Juancheng Shangkai Hair Products FactoryJuancheng Shangkai Hair Products FactoryDiamond MemberAudited SupplierSecured TradingShandong, ChinaManufacturer/Factory & Trading CompanyEnjoy trading protection from Made-in-China.comView larger video & image5(5.0)""Perfect Service""Perfect Service",Juancheng Shangkai Hair Products,https://shangkaihair.en.made-in-china.com,5.0,5.0,Factory & Trading Company,"Shandong, China","2nd Human Hair Industry,Juancheng, Heze",,2025-08-12T20:16:16.523227,
hair dryer,AC Electrical Manufacturers Evaporator Fan Electric Motor for Rotisserie,https://greatup.en.made-in-china.com/product/AsaEzywuAXke/China-AC-Electrical-Manufacturers-Evaporator-Fan-Electric-Motor-for-Rotisserie.html,,1,1.2,USD,500,,"AC Electrical Manufacturers Evaporator Fan Electric Motor for RotisserieUS$ 1.2-1.5/ Piece500 Pieces(MOQ)RITSCHER INTERNATIONAL LIMITEDRITSCHER INTERNATIONAL LIMITEDDiamond MemberAudited SupplierGuangdong, ChinaView larger video & image",RITSCHER INTERNATIONAL LIMITED,https://greatup.en.made-in-china.com,,,Ritscher group,"Guangdong, China","Dongfeng Town, Zhongshan City, Zhongshan",,2025-08-12T20:16:17.722865,
hair dryer,Factory Price High Quality RussianHairSeamless Clip inHairExtensions,https://shangkaihair.en.made-in-china.com/product/FsWQbyEoMeck/China-Factory-Price-High-Quality-Russian-Hair-Seamless-Clip-in-Hair-Extensions.html,,1,48.0,USD,1,,"Factory Price High Quality RussianHairSeamless Clip inHairExtensionsUS$ 48-120/ Piece1 Piece(MOQ)Juancheng Shangkai Hair Products FactoryJuancheng Shangkai Hair Products FactoryDiamond MemberAudited SupplierSecured TradingShandong, ChinaManufacturer/Factory & Trading CompanyEnjoy trading protection from Made-in-China.comView larger video & image5(5.0)""Professional Service""Professional Service",Juancheng Shangkai Hair Products,https://shangkaihair.en.made-in-china.com,5.0,5.0,Factory & Trading Company,"Shandong, China","2nd Human Hair Industry,Juancheng, Heze",,2025-08-12T20:16:19.002646,
hair dryer,AC Electrical/Electric Shaded Pole Motor for High Temperature Sterilizing Cabinet/Warm Air Blower,https://greatup.en.made-in-china.com/product/LvbEXZlcyNWq/China-AC-Electrical-Electric-Shaded-Pole-Motor-for-High-Temperature-Sterilizing-Cabinet-Warm-Air-Blower.html,,1,2.8,USD,100,,"AC Electrical/Electric Shaded Pole Motor for High Temperature Sterilizing Cabinet/Warm Air BlowerUS$ 2.8/ Piece100 Pieces(MOQ)RITSCHER INTERNATIONAL LIMITEDRITSCHER INTERNATIONAL LIMITEDDiamond MemberAudited SupplierGuangdong, ChinaView larger video & image",RITSCHER INTERNATIONAL LIMITED,https://greatup.en.made-in-china.com,,,Ritscher group,"Guangdong, China","Dongfeng Town, Zhongshan City, Zhongshan",,2025-08-12T20:16:20.105250,
hair dryer,New Coming Finest RemyHairInvisible Seamless Clip inHairExtension HumanHair,https://shangkaihair.en.made-in-china.com/product/uCVQBjxTXqcH/China-New-Coming-Finest-Remy-Hair-Invisible-Seamless-Clip-in-Hair-Extension-Human-Hair.html,,1,28.0,USD,1,,"New Coming Finest RemyHairInvisible Seamless Clip inHairExtension HumanHairUS$ 28-88/ Piece1 Piece(MOQ)Juancheng Shangkai Hair Products FactoryJuancheng Shangkai Hair Products FactoryDiamond MemberAudited SupplierSecured TradingShandong, ChinaManufacturer/Factory & Trading CompanyEnjoy trading protection from Made-in-China.comView larger video & image5(5.0)""Excellent Job""Excellent Job",Juancheng Shangkai Hair Products,https://shangkaihair.en.made-in-china.com,5.0,5.0,Factory & Trading Company,"Shandong, China","2nd Human Hair Industry,Juancheng, Heze",,2025-08-12T20:16:21.369351,
hair dryer,Russian Cuticle RemyHairPU Seamless Clip in VirginHairExtensions,https://shangkaihair.en.made-in-china.com/product/XjWJMPnrZokv/China-Russian-Cuticle-Remy-Hair-PU-Seamless-Clip-in-Virgin-Hair-Extensions.html,,1,28.0,USD,1,,"Russian Cuticle RemyHairPU Seamless Clip in VirginHairExtensionsUS$ 28-88/ Piece1 Piece(MOQ)Juancheng Shangkai Hair Products FactoryJuancheng Shangkai Hair Products FactoryDiamond MemberAudited SupplierSecured TradingShandong, ChinaManufacturer/Factory & Trading CompanyEnjoy trading protection from Made-in-China.comView larger video & image5(5.0)""Professional Service""Professional Service",Juancheng Shangkai Hair Products,https://shangkaihair.en.made-in-china.com,5.0,5.0,Factory & Trading Company,"Shandong, China","2nd Human Hair Industry,Juancheng, Heze",,2025-08-12T20:16:22.609690,
hair dryer,Factory Direct Supply Wholesale Price PU Seamless Clip inHairExtensions,https://shangkaihair.en.made-in-china.com/product/JCkEbxmFHehc/China-Factory-Direct-Supply-Wholesale-Price-PU-Seamless-Clip-in-Hair-Extensions.html,,1,38.0,USD,1,,"Factory Direct Supply Wholesale Price PU Seamless Clip inHairExtensionsUS$ 38-88/ Piece1 Piece(MOQ)Juancheng Shangkai Hair Products FactoryJuancheng Shangkai Hair Products FactoryDiamond MemberAudited SupplierSecured TradingShandong, ChinaManufacturer/Factory & Trading CompanyEnjoy trading protection from Made-in-China.comView larger video & image5(5.0)""Excellent Job""Excellent Job",Juancheng Shangkai Hair Products,https://shangkaihair.en.made-in-china.com,5.0,5.0,Factory & Trading Company,"Shandong, China","2nd Human Hair Industry,Juancheng, Heze",,2025-08-12T20:16:23.866237,
hair dryer,Top Quality Hot Selling Unprocessed 100% Human Virgin Remy Silk Straight Indian Seamless Clip inHairExtensions,https://shangkaihair.en.made-in-china.com/product/INWmvsQOkMkh/China-Top-Quality-Hot-Selling-Unprocessed-100-Human-Virgin-Remy-Silk-Straight-Indian-Seamless-Clip-in-Hair-Extensions.html,,1,28.0,USD,1,,"Top Quality Hot Selling Unprocessed 100% Human Virgin Remy Silk Straight Indian Seamless Clip inHairExtensionsUS$ 28-88/ Piece1 Piece(MOQ)Juancheng Shangkai Hair Products FactoryJuancheng Shangkai Hair Products FactoryDiamond MemberAudited SupplierSecured TradingShandong, ChinaManufacturer/Factory & Trading CompanyEnjoy trading protection from Made-in-China.comView larger video & image5(5.0)""Excellent Job""Excellent Job",Juancheng Shangkai Hair Products,https://shangkaihair.en.made-in-china.com,5.0,5.0,Factory & Trading Company,"Shandong, China","2nd Human Hair Industry,Juancheng, Heze",,2025-08-12T20:16:25.230254,
hair dryer,50g/18 Inch U TipHairExtensions HumanHairMultiple ColoursHairExtensions Utip HumanHairExtensions U Tip HumanHairExtensions for Women Daily Use,https://rebeccahairfactory.en.made-in-china.com/product/UnurZJdTvRYB/China-50g-18-Inch-U-Tip-Hair-Extensions-Human-Hair-Multiple-Colours-Hair-Extensions-Utip-Human-Hair-Extensions-U-Tip-Human-Hair-Extensions-for-Women-Daily-Use.html,,1,43.6,USD,1,,"50g/18 Inch U TipHairExtensions HumanHairMultiple ColoursHairExtensions Utip HumanHairExtensions U Tip HumanHairExtensions for Women Daily UseUS$ 43.6-54.9/ Piece1 Piece(MOQ)Henan Rebecca Hair Products Co.,LtdHenan Rebecca Hair Products Co.,LtdDiamond MemberAudited SupplierSecured TradingHenan, ChinaManufacturer/Factory & Trading CompanyISO45001:2018Enjoy trading protection from Made-in-China.comView larger video & image5(4.9)""Fast Delivery""Fast Delivery","Henan Rebecca Hair Products Co.,Ltd",https://rebeccahairfactory.en.made-in-china.com,4.9,4.0,Henan Rebecca Hair Products Co.,"Henan, China","No. 666, Rebecca Road, Xuchang",,2025-08-12T20:16:26.427484,
hair dryer,"22"" Blonde Colours Tape in StraightHairExtensions Remy HumanHairExtensions Natural Seamless Skin Wef Invisible Tape inHairExtensions",https://rebeccahairfactory.en.made-in-china.com/product/GZwaIRcdZgAW/China-22-Blonde-Colours-Tape-in-Straight-Hair-Extensions-Remy-Human-Hair-Extensions-Natural-Seamless-Skin-Wef-Invisible-Tape-in-Hair-Extensions.html,,1,49.5,USD,1,,"22"" Blonde Colours Tape in StraightHairExtensions Remy HumanHairExtensions Natural Seamless Skin Wef Invisible Tape inHairExtensionsUS$ 49.5-54.5/ Piece1 Piece(MOQ)Henan Rebecca Hair Products Co.,LtdHenan Rebecca Hair Products Co.,LtdDiamond MemberAudited SupplierSecured TradingHenan, ChinaManufacturer/Factory & Trading CompanyISO45001:2018Enjoy trading protection from Made-in-China.comView larger video & image5(4.9)""Fast Delivery""Fast Delivery","Henan Rebecca Hair Products Co.,Ltd",https://rebeccahairfactory.en.made-in-china.com,4.9,4.0,Henan Rebecca Hair Products Co.,"Henan, China","No. 666, Rebecca Road, Xuchang",,2025-08-12T20:16:27.533330,
