keyword,title,listing_url,item_number,sku,price,currency,min_order_quantity,max_order_quantity,description,seller_name,seller_profile_url,seller_rating,seller_total_reviews,seller_business_name,seller_country,seller_address,seller_email,scraped_at,last_updated
hair dryer,Bidisco Custom Private Label Ionic Negative Ion AnionHairDryersHigh Quality Professional BlowHairDryer,https://bidisco.en.made-in-china.com/product/DatrAHOoITWQ/China-Bidisco-Custom-Private-Label-Ionic-Negative-Ion-Anion-Hair-Dryers-High-Quality-Professional-Blow-Hair-Dryer.html,,1,11.96,USD,500,,"Bidisco Custom Private Label Ionic Negative Ion AnionHairDryersHigh Quality Professional BlowHairDryerUS$ 11.96-12.32/ Piece500 Pieces(MOQ)Dongguan Bidisco Electric CO., LTDDongguan Bidisco Electric CO., LTDDiamond MemberAudited SupplierGuangdong, ChinaManufacturer/Factory & Trading CompanyView larger video & image5(5.0)""Fast Dispatch""Fast Dispatch","Dongguan Bidisco Electric CO., LTD",https://bidisco.en.made-in-china.com,5.0,5.0,Dongguan Bidisco Electric Co.,"Guangdong, China","NO.297 JIANGNAN ROAD, QISHI TOWN, DONGGUAN CITY",,2025-08-12T20:14:50.871738,
hair dryer,Intelligent Heat Control 3 Speed Settings & Negative Ion Technology 1600W MotorHairDryer,https://cy-electronic.en.made-in-china.com/product/WQORMzPGhdYh/China-Intelligent-Heat-Control-3-Speed-Settings-Negative-Ion-Technology-1600W-Motor-Hair-Dryer.html,,1,36.0,USD,1,,"Intelligent Heat Control 3 Speed Settings & Negative Ion Technology 1600W MotorHairDryerUS$ 36-42/ Piece1 Piece(MOQ)Chaozhou Chengying Technology Co., LtdChaozhou Chengying Technology Co., LtdDiamond MemberAudited SupplierGuangdong, ChinaView larger video & image5(4.6)""On-time Delivery""On-time Delivery","Chaozhou Chengying Technology Co., Ltd",https://cy-electronic.en.made-in-china.com,4.6,4.0,Chaozhou Chengying Technology Co.,"Guangdong, China","No. 17, Building C, Chaoshan Commercial Plaza",,2025-08-12T20:14:53.167486,
hair dryer,"Negative Ionic BlowDryerwith 110, 000 RpmHairDryer",https://mktslkt-a.en.made-in-china.com/product/sGqRTHVunCkK/China-Negative-Ionic-Blow-Dryer-with-110-000-Rpm-Hair-Dryer.html,,1,6.0,USD,1000,,"Negative Ionic BlowDryerwith 110, 000 RpmHairDryerUS$ 6-6.7/ Piece1000 Pieces(MOQ)Market Union Co., Ltd.Market Union Co., Ltd.Diamond MemberAudited SupplierZhejiang, ChinaTrading CompanyView larger video & image5(5.0)""Fast Delivery""Fast Delivery","Market Union Co., Ltd.",https://mktslkt-a.en.made-in-china.com,5.0,5.0,MU Group,"Zhejiang, China","12F, Building B10 (East Village), No. 2560",,2025-08-12T20:14:55.143881,
hair dryer,China Manufacturers Professional Salon 2000W Negative Ionic BLDCHairDryerBrushless High Speed FoldableHairBlowDryer,https://huipuhairdryer.en.made-in-china.com/product/VtPrCQzoYlkh/China-China-Manufacturers-Professional-Salon-2000W-Negative-Ionic-BLDC-Hair-Dryer-Brushless-High-Speed-Foldable-Hair-Blow-Dryer.html,,1,36.0,USD,500,,"China Manufacturers Professional Salon 2000W Negative Ionic BLDCHairDryerBrushless High Speed FoldableHairBlowDryerUS$ 36-37.5/ pieces500 pieces(MOQ)Wenzhou Huipu Electrical Appliance Co., Ltd.Wenzhou Huipu Electrical Appliance Co., Ltd.Diamond MemberAudited SupplierZhejiang, ChinaView larger video & image5(5.0)""On-time Delivery""On-time Delivery","Wenzhou Huipu Electrical Appliance Co., Ltd.",https://huipuhairdryer.en.made-in-china.com,5.0,5.0,Wenzhou Huipu Electric Co.,"Zhejiang, China","Wenzhou, Zhejiang, China",,2025-08-12T20:14:57.176188,
hair dryer,High Quality Hot Selling Quick Drying 113000rpm Negative Ion ProfessionalHairDryer,https://dglizbella.en.made-in-china.com/product/aATrhPHDTLkU/China-High-Quality-Hot-Selling-Quick-Drying-113000rpm-Negative-Ion-Professional-Hair-Dryer.html,,1,38.0,USD,1,,"High Quality Hot Selling Quick Drying 113000rpm Negative Ion ProfessionalHairDryerUS$ 38-42/ Piece1 Piece(MOQ)Dongguan Zhimi Electrical Technology Co., Ltd.Dongguan Zhimi Electrical Technology Co., Ltd.Diamond MemberAudited SupplierGuangdong, ChinaManufacturer/Factory & Trading CompanyView larger video & image5(5.0)""Reliable Supplier""Reliable Supplier","Dongguan Zhimi Electrical Technology Co., Ltd.",https://dglizbella.en.made-in-china.com,5.0,5.0,"Post a Sourcing Request Now 











Product Group","Guangdong, China","Room 501, Building 6, No.168 Fuli East Road",,2025-08-12T20:14:59.074401,
hair dryer,OEM 110-220V Travel Dual Voltage ACHairDryerwith Ions High PowerHairDryerwith Diffuser,https://fiyele.en.made-in-china.com/product/tfNUbkVHEyhS/China-OEM-110-220V-Travel-Dual-Voltage-AC-Hair-Dryer-with-Ions-High-Power-Hair-Dryer-with-Diffuser.html,,1,7.88,USD,2000,,"OEM 110-220V Travel Dual Voltage ACHairDryerwith Ions High PowerHairDryerwith DiffuserUS$ 7.88-8.22/ Piece2000 Pieces(MOQ)Yueqing Fiy Electric Co., Ltd.Yueqing Fiy Electric Co., Ltd.Diamond MemberAudited SupplierZhejiang, ChinaManufacturer/Factory & Trading CompanyView larger video & image5(5.0)""Fast Delivery""Fast Delivery","Yueqing Fiy Electric Co., Ltd.",https://fiyele.en.made-in-china.com,5.0,5.0,"Post Sourcing Request
















                                    Yueqing Fiy Electric Co.","Zhejiang, China","Building 2, Xianyangchen Industrial Zone, Hongqiao",,2025-08-12T20:15:01.335297,
hair dryer,ABS Materials Wall-Mounted HotelHairDryer,https://wontry.en.made-in-china.com/product/djWQeBGUZTkh/China-ABS-Materials-Wall-Mounted-Hotel-Hair-Dryer.html,,1,11.0,USD,500,,"ABS Materials Wall-Mounted HotelHairDryerUS$ 11-13/ Piece500 Pieces(MOQ)Wenzhou Won-Try Electric Appliance Co., Ltd.Wenzhou Won-Try Electric Appliance Co., Ltd.Gold MemberAudited SupplierZhejiang, ChinaManufacturer/FactoryView larger video & image","Wenzhou Won-Try Electric Appliance Co., Ltd.",https://wontry.en.made-in-china.com,,,Try Electric Appliance Co.,"Zhejiang, China","6#Ze Chuan Road, Getian Industrial Zone, Zeya Ouhai",,2025-08-12T20:15:03.424506,
hair dryer,Plasma AiHairDryerhigh PerformanceHairStraightener Constant Temperature Blowing Does Not Perm The Scalp HouseholdHairDryerProfessional Handheld Blow Dry,https://baiyisen.en.made-in-china.com/product/sRBYwtnKZmkN/China-Plasma-Ai-Hair-Dryerhigh-Performance-Hair-Straightener-Constant-Temperature-Blowing-Does-Not-Perm-The-Scalp-Household-Hair-Dryer-Professional-Handheld-Blow-Dry.html,,1,30.0,USD,2000,,"Plasma AiHairDryerhigh PerformanceHairStraightener Constant Temperature Blowing Does Not Perm The Scalp HouseholdHairDryerProfessional Handheld Blow DryUS$ 30-39/ Piece2000 Pieces(MOQ)Shenzhen Baiyisen Health Technology Co., Ltd.Shenzhen Baiyisen Health Technology Co., Ltd.Diamond MemberAudited SupplierGuangdong, ChinaView larger video & image","Shenzhen Baiyisen Health Technology Co., Ltd.",https://baiyisen.en.made-in-china.com,,,Leading Global,"Guangdong, China","Shenzhen, Guangdong, China",,2025-08-12T20:15:05.687430,
hair dryer,High Speed 110000rpm BrushlessHairDryerFast Hairdryer 20 Million Negative IonicHairDryerhair BlowDryerHigh Speed IonicHairDryerfor Professional Salon,https://baiyisen.en.made-in-china.com/product/hnBRxQLHVdUu/China-High-Speed-110000rpm-Brushless-Hair-Dryer-Fast-Hairdryer-20-Million-Negative-Ionic-Hair-Dryerhair-Blow-Dryer-High-Speed-Ionic-Hair-Dryer-for-Professional-Salon.html,,1,31.0,USD,500,,"CE certifiedvalid since 2024-10-24(contact issuer for current status)High Speed 110000rpm BrushlessHairDryerFast Hairdryer 20 Million Negative IonicHairDryerhair BlowDryerHigh Speed IonicHairDryerfor Professional SalonUS$ 31-39/ Piece500 Pieces(MOQ)Shenzhen Baiyisen Health Technology Co., Ltd.Shenzhen Baiyisen Health Technology Co., Ltd.Diamond MemberAudited SupplierSecured TradingGuangdong, ChinaEnjoy trading protection from Made-in-China.comView larger video & image","Shenzhen Baiyisen Health Technology Co., Ltd.",https://baiyisen.en.made-in-china.com,,,Leading Global,"Guangdong, China","Shenzhen, Guangdong, China",,2025-08-12T20:15:07.038425,
hair dryer,Koofex Ionic 110000rpm BLDCHairDryerHigh Speed Brushless Motor BlowDryer,https://koofex.en.made-in-china.com/product/fAPUcXzxYoWd/China-Koofex-Ionic-110000rpm-BLDC-Hair-Dryer-High-Speed-Brushless-Motor-Blow-Dryer.html?ads_tp=&ads_id=vyBTXLqckPle,,1,9.8,USD,1000,,"Koofex Ionic 110000rpm BLDCHairDryerHigh Speed Brushless Motor BlowDryerUS$ 9.8-11/ Piece1000 Pieces(MOQ)Guangzhou KooFex Appliances Co., Ltd.Guangzhou KooFex Appliances Co., Ltd.Diamond MemberAudited SupplierSecured TradingGuangdong, ChinaEnjoy trading protection from Made-in-China.comView larger video & image5(5.0)""Fast Dispatch""Fast Dispatch","Guangzhou KooFex Appliances Co., Ltd.",https://koofex.en.made-in-china.com?ads_tp=&ads_id=vyBTXLqckPle,,,,,,,2025-08-12T20:15:09.442075,
hair dryer,2024 Hot Selling Ionic Professional Salon LED Display ScreenHairBlowerDryerBLDC 2000W High Power 3 in 1 One StepHairDryer,https://huipuhairdryer.en.made-in-china.com/product/qAFrWZdlfLVJ/China-2024-Hot-Selling-Ionic-Professional-Salon-LED-Display-Screen-Hair-Blower-Dryer-BLDC-2000W-High-Power-3-in-1-One-Step-Hair-Dryer.html,,1,37.0,USD,500,,"2024 Hot Selling Ionic Professional Salon LED Display ScreenHairBlowerDryerBLDC 2000W High Power 3 in 1 One StepHairDryerUS$ 37-38.5/ pieces500 pieces(MOQ)Wenzhou Huipu Electrical Appliance Co., Ltd.Wenzhou Huipu Electrical Appliance Co., Ltd.Diamond MemberAudited SupplierSecured TradingZhejiang, ChinaEnjoy trading protection from Made-in-China.comView larger video & image5(5.0)""Fast Dispatch""Fast Dispatch","Wenzhou Huipu Electrical Appliance Co., Ltd.",https://huipuhairdryer.en.made-in-china.com,5.0,5.0,Wenzhou Huipu Electric Co.,"Zhejiang, China","Wenzhou, Zhejiang, China",,2025-08-12T20:15:10.918340,
hair dryer,Salon High Speed Professional Anion LeaflessHairDryerwith Anti-Frizz Features Warranty,https://shanghaijinglang.en.made-in-china.com/product/LGjYEkMoYIhp/China-Salon-High-Speed-Professional-Anion-Leafless-Hair-Dryer-with-Anti-Frizz-Features-Warranty.html,,1,15.0,USD,1000,,"Salon High Speed Professional Anion LeaflessHairDryerwith Anti-Frizz Features WarrantyUS$ 15-22/ Piece1000 Pieces(MOQ)Jinglang Electric Appliances (Shanghai) Co., Ltd.Jinglang Electric Appliances (Shanghai) Co., Ltd.Diamond MemberAudited SupplierSecured TradingShanghai, ChinaEnjoy trading protection from Made-in-China.comView larger video & image5(5.0)""Fast Delivery""Fast Delivery","Jinglang Electric Appliances (Shanghai) Co., Ltd.",https://shanghaijinglang.en.made-in-china.com,5.0,5.0,Our company,"Shanghai, China","No. 1108, Rongmei Road, Songjiang University Town",,2025-08-12T20:15:13.170556,
hair dryer,High Speed 110000 Rpm Brushless Negative IonHairDryer,https://bidisco.en.made-in-china.com/product/YxVrUdDObecp/China-High-Speed-110000-Rpm-Brushless-Negative-Ion-Hair-Dryer.html,,1,29.3,USD,500,,"High Speed 110000 Rpm Brushless Negative IonHairDryerUS$ 29.3-35/ Piece500 Pieces(MOQ)Dongguan Bidisco Electric CO., LTDDongguan Bidisco Electric CO., LTDDiamond MemberAudited SupplierSecured TradingGuangdong, ChinaManufacturer/Factory & Trading CompanyEnjoy trading protection from Made-in-China.comView larger video & image5(5.0)""Fast Delivery""Fast Delivery","Dongguan Bidisco Electric CO., LTD",https://bidisco.en.made-in-china.com,5.0,5.0,Dongguan Bidisco Electric Co.,"Guangdong, China","NO.297 JIANGNAN ROAD, QISHI TOWN, DONGGUAN CITY",,2025-08-12T20:15:15.297118,
hair dryer,Source Factoryhigh Speed 110000rpm High Speed Best HouseholdHairPattern Blow Dryer5 In1 Hot Air Brush Comb BlowDryerBrushhair Stylerfactory New Design BLDC,https://baiyisen.en.made-in-china.com/product/LtnRcvrVIJpB/China-Source-Factoryhigh-Speed-110000rpm-High-Speed-Best-Household-Hair-Pattern-Blow-Dryer5-In1-Hot-Air-Brush-Comb-Blow-Dryer-Brushhair-Stylerfactory-New-Design-BLDC.html,,1,27.8,USD,1000,,"CE certifiedvalid since 2024-10-24(contact issuer for current status)Source Factoryhigh Speed 110000rpm High Speed Best HouseholdHairPattern Blow Dryer5 In1 Hot Air Brush Comb BlowDryerBrushhair Stylerfactory New Design BLDCUS$ 27.8-29.8/ Piece1000 Pieces(MOQ)Shenzhen Baiyisen Health Technology Co., Ltd.Shenzhen Baiyisen Health Technology Co., Ltd.Diamond MemberAudited SupplierSecured TradingGuangdong, ChinaEnjoy trading protection from Made-in-China.comView larger video & image","Shenzhen Baiyisen Health Technology Co., Ltd.",https://baiyisen.en.made-in-china.com,,,Leading Global,"Guangdong, China","Shenzhen, Guangdong, China",,2025-08-12T20:15:16.794249,
hair dryer,High Speed Constant Temperature Negative IonHairDryerProfessional Hammer Electric BlowerDryer,https://huipuhairdryer.en.made-in-china.com/product/EADYOxfTBHkQ/China-High-Speed-Constant-Temperature-Negative-Ion-Hair-Dryer-Professional-Hammer-Electric-Blower-Dryer.html,,1,21.9,USD,50,,"High Speed Constant Temperature Negative IonHairDryerProfessional Hammer Electric BlowerDryerUS$ 21.9-25/ Piece50 Pieces(MOQ)Wenzhou Huipu Electrical Appliance Co., Ltd.Wenzhou Huipu Electrical Appliance Co., Ltd.Diamond MemberAudited SupplierSecured TradingZhejiang, ChinaEnjoy trading protection from Made-in-China.comView larger video & image5(5.0)""On-time Delivery""On-time Delivery","Wenzhou Huipu Electrical Appliance Co., Ltd.",https://huipuhairdryer.en.made-in-china.com,5.0,5.0,Wenzhou Huipu Electric Co.,"Zhejiang, China","Wenzhou, Zhejiang, China",,2025-08-12T20:15:18.064713,
hair dryer,High Quality Professional Drayer DC MotorHairBlowDryer2000W Drayer BlowDryers,https://reputable-trading.en.made-in-china.com/product/MTRrptxEBukW/China-High-Quality-Professional-Drayer-DC-Motor-Hair-Blow-Dryer-2000W-Drayer-Blow-Dryers.html,,1,7.86,USD,500,,"High Quality Professional Drayer DC MotorHairBlowDryer2000W Drayer BlowDryersUS$ 7.86-9.86/ Piece500 Pieces(MOQ)Yiwu Reputable Trade Co., Ltd.Yiwu Reputable Trade Co., Ltd.Diamond MemberZhejiang, ChinaTrading CompanyView larger video & image","Yiwu Reputable Trade Co., Ltd.",https://reputable-trading.en.made-in-china.com,,,Yiwu Reputable Trade Co.,Province China,"Room 305, Unit 3, Building 36",,2025-08-12T20:15:20.238756,
hair dryer,Fast DryingHairCare Dsn HD15HairDryerHome Appliance Negative IonsDryer,https://himtop.en.made-in-china.com/product/pdjAniDyaHfx/China-Fast-Drying-Hair-Care-Dsn-HD15-Hair-Dryer-Home-Appliance-Negative-Ions-Dryer.html,,1,55.0,USD,1,,"Fast DryingHairCare Dsn HD15HairDryerHome Appliance Negative IonsDryerUS$ 55-65/ Piece1 Piece(MOQ)Shenzhen Himtop Technology Co., Ltd.Shenzhen Himtop Technology Co., Ltd.Diamond MemberAudited SupplierGuangdong, ChinaView larger video & image5(4.5)""Immediate Response""Immediate Response","Shenzhen Himtop Technology Co., Ltd.",https://himtop.en.made-in-china.com,4.5,4.0,Bantian International,"Guangdong, China","18th Floor, Block a, Bantian International Center",,2025-08-12T20:15:22.790418,
hair dryer,"Curling Iron for Effortless Long-Lasting Curls 5-in-1 Curling IronHairDryerSet 110, 000 Rpm Silent Brushless Motor",https://baiyisen.en.made-in-china.com/product/NGAUsdnxIErz/China-Curling-Iron-for-Effortless-Long-Lasting-Curls-5-in-1-Curling-Iron-Hair-Dryer-Set-110-000-Rpm-Silent-Brushless-Motor.html,,1,30.0,USD,1000,,"Curling Iron for Effortless Long-Lasting Curls 5-in-1 Curling IronHairDryerSet 110, 000 Rpm Silent Brushless MotorUS$ 30-39/ Piece1000 Pieces(MOQ)Shenzhen Baiyisen Health Technology Co., Ltd.Shenzhen Baiyisen Health Technology Co., Ltd.Diamond MemberAudited SupplierGuangdong, ChinaView larger video & image","Shenzhen Baiyisen Health Technology Co., Ltd.",https://baiyisen.en.made-in-china.com,,,Leading Global,"Guangdong, China","Shenzhen, Guangdong, China",,2025-08-12T20:15:24.139465,
hair dryer,Wholesale Adjustable Hot Cold Air Profession Hairdryer 2000W High Power Salon Negative Ionic Far Infrared TherapyHairDryer,https://huipuhairdryer.en.made-in-china.com/product/uakrzMOKAHWb/China-Wholesale-Adjustable-Hot-Cold-Air-Profession-Hairdryer-2000W-High-Power-Salon-Negative-Ionic-Far-Infrared-Therapy-Hair-Dryer.html,,1,19.0,USD,1,,"Wholesale Adjustable Hot Cold Air Profession Hairdryer 2000W High Power Salon Negative Ionic Far Infrared TherapyHairDryerUS$ 19-20/ pieces1 pieces(MOQ)Wenzhou Huipu Electrical Appliance Co., Ltd.Wenzhou Huipu Electrical Appliance Co., Ltd.Diamond MemberAudited SupplierSecured TradingZhejiang, ChinaEnjoy trading protection from Made-in-China.comView larger video & image5(5.0)""Fast Delivery""Fast Delivery","Wenzhou Huipu Electrical Appliance Co., Ltd.",https://huipuhairdryer.en.made-in-china.com,5.0,5.0,Wenzhou Huipu Electric Co.,"Zhejiang, China","Wenzhou, Zhejiang, China",,2025-08-12T20:15:25.455477,
hair dryer,Custom OEM/ODM Cross-BorderHairDryerwith Brushless Motor - High-SpeedHairProtection Professional BlowDryer,https://muselect.en.made-in-china.com/product/LpARYUBosTWK/China-Custom-OEM-ODM-Cross-Border-Hair-Dryer-with-Brushless-Motor-High-Speed-Hair-Protection-Professional-Blow-Dryer.html,,1,28.75,USD,1000,,"Custom OEM/ODM Cross-BorderHairDryerwith Brushless Motor - High-SpeedHairProtection Professional BlowDryerUS$ 28.75/ Piece1000 Pieces(MOQ)Market Union Co. Ltd.Market Union Co. Ltd.Diamond MemberAudited SupplierZhejiang, ChinaTrading CompanyView larger video & image",Market Union Co. Ltd.,https://muselect.en.made-in-china.com,,,Market Union Group has become one of the largest group,"Zhejiang, China","8F, Building B16 (West Area), No. 2560",,2025-08-12T20:15:28.336953,
hair dryer,Lightweight Build 1600W Motor Cool Shot Function Negative Ion TechnologyHairDryer,https://cy-electronic.en.made-in-china.com/product/BmdRbXzcLFph/China-Lightweight-Build-1600W-Motor-Cool-Shot-Function-Negative-Ion-Technology-Hair-Dryer.html,,1,36.0,USD,1,,"Lightweight Build 1600W Motor Cool Shot Function Negative Ion TechnologyHairDryerUS$ 36-42/ Piece1 Piece(MOQ)Chaozhou Chengying Technology Co., LtdChaozhou Chengying Technology Co., LtdDiamond MemberAudited SupplierSecured TradingGuangdong, ChinaEnjoy trading protection from Made-in-China.comView larger video & image5(4.6)""Fast Delivery""Fast Delivery","Chaozhou Chengying Technology Co., Ltd",https://cy-electronic.en.made-in-china.com,4.6,4.0,Chaozhou Chengying Technology Co.,"Guangdong, China","No. 17, Building C, Chaoshan Commercial Plaza",,2025-08-12T20:15:30.148080,
hair dryer,New-Style Fashionable 2023 Updated Diffuser 1800W Women Curly IonicHairDryer,https://goodseller-household.en.made-in-china.com/product/KEDpyGSLVxRA/China-New-Style-Fashionable-2023-Updated-Diffuser-1800W-Women-Curly-Ionic-Hair-Dryer.html,,1,10.0,USD,95,,"New-Style Fashionable 2023 Updated Diffuser 1800W Women Curly IonicHairDryerUS$ 10-10.5/ Piece95 Pieces(MOQ)Good Seller Co., LtdGood Seller Co., LtdDiamond MemberAudited SupplierZhejiang, ChinaTrading CompanyView larger video & image5(5.0)""On-time Delivery""On-time Delivery","Good Seller Co., Ltd",https://goodseller-household.en.made-in-china.com,5.0,5.0,Our company,"Zhejiang, China","Floor 5, No. 113 Qiushi Road, Beiyuan",,2025-08-12T20:15:32.168405,
hair dryer,High Quality Household High Speed Constant Temperature AnionHairDryer,https://shanghaijinglang.en.made-in-china.com/product/otyUFxVuhDWp/China-High-Quality-Household-High-Speed-Constant-Temperature-Anion-Hair-Dryer.html,,1,20.0,USD,800,,"High Quality Household High Speed Constant Temperature AnionHairDryerUS$ 20-30/ Piece800 Pieces(MOQ)Jinglang Electric Appliances (Shanghai) Co., Ltd.Jinglang Electric Appliances (Shanghai) Co., Ltd.Diamond MemberAudited SupplierSecured TradingShanghai, ChinaEnjoy trading protection from Made-in-China.comView larger video & image5(5.0)""Fast Dispatch""Fast Dispatch","Jinglang Electric Appliances (Shanghai) Co., Ltd.",https://shanghaijinglang.en.made-in-china.com,5.0,5.0,Our company,"Shanghai, China","No. 1108, Rongmei Road, Songjiang University Town",,2025-08-12T20:15:33.192859,
hair dryer,OEM Customized 1200W Professional Electric Ionic BlowHairDryer,https://bidisco.en.made-in-china.com/product/gwHfLGSyEshu/China-OEM-Customized-1200W-Professional-Electric-Ionic-Blow-Hair-Dryer.html,,1,12.36,USD,300,,"OEM Customized 1200W Professional Electric Ionic BlowHairDryerUS$ 12.36-12.7/ Piece300 Pieces(MOQ)Dongguan Bidisco Electric CO., LTDDongguan Bidisco Electric CO., LTDDiamond MemberAudited SupplierSecured TradingGuangdong, ChinaManufacturer/Factory & Trading CompanyEnjoy trading protection from Made-in-China.comView larger video & image5(5.0)""On-time Delivery""On-time Delivery","Dongguan Bidisco Electric CO., LTD",https://bidisco.en.made-in-china.com,5.0,5.0,Dongguan Bidisco Electric Co.,"Guangdong, China","NO.297 JIANGNAN ROAD, QISHI TOWN, DONGGUAN CITY",,2025-08-12T20:15:34.173967,
hair dryer,High-Speed SalonHairDryerwith Lonic Feature and Concentrator Nozzle,https://rongheglobal.en.made-in-china.com/product/BaQpYorxRGUZ/China-High-Speed-Salon-Hair-Dryer-with-Lonic-Feature-and-Concentrator-Nozzle.html,,1,12.0,USD,1000,,"High-Speed SalonHairDryerwith Lonic Feature and Concentrator NozzleUS$ 12/ pieces1000 pieces(MOQ)Zhejiang Ronghe Industrial Co., Ltd.Zhejiang Ronghe Industrial Co., Ltd.Gold MemberAudited SupplierZhejiang, ChinaManufacturer/Factory & Trading CompanyISO9001:2015View larger video & image","Zhejiang Ronghe Industrial Co., Ltd.",https://rongheglobal.en.made-in-china.com,,,"Post a Sourcing Request Now 











Product Group","Zhejiang, China","No. 368 Chongde Street, Lingxia Town, Jindong District",,2025-08-12T20:15:36.086234,
hair dryer,Home Blue Negative IonHairSalon High PowerHairDryer,https://mktslkt-a.en.made-in-china.com/product/WtqpkscOwNVS/China-Home-Blue-Negative-Ion-Hair-Salon-High-Power-Hair-Dryer.html,,1,4.0,USD,1000,,"Home Blue Negative IonHairSalon High PowerHairDryerUS$ 4-4.6/ Piece1000 Pieces(MOQ)Market Union Co., Ltd.Market Union Co., Ltd.Diamond MemberAudited SupplierZhejiang, ChinaTrading CompanyView larger video & image5(5.0)""On-time Delivery""On-time Delivery","Market Union Co., Ltd.",https://mktslkt-a.en.made-in-china.com,5.0,5.0,MU Group,"Zhejiang, China","12F, Building B10 (East Village), No. 2560",,2025-08-12T20:15:38.134672,
hair dryer,2025 Factory New Model Straightener Curler Hot Air Brush BlowDryerand 1300W High SpeedHairDryerBrush,https://baiyisen.en.made-in-china.com/product/QTEruWCyTnYR/China-2025-Factory-New-Model-Straightener-Curler-Hot-Air-Brush-Blow-Dryer-and-1300W-High-Speed-Hair-Dryer-Brush.html,,1,30.0,USD,1000,,"2025 Factory New Model Straightener Curler Hot Air Brush BlowDryerand 1300W High SpeedHairDryerBrushUS$ 30-39/ Piece1000 Pieces(MOQ)Shenzhen Baiyisen Health Technology Co., Ltd.Shenzhen Baiyisen Health Technology Co., Ltd.Diamond MemberAudited SupplierGuangdong, ChinaView larger video & image","Shenzhen Baiyisen Health Technology Co., Ltd.",https://baiyisen.en.made-in-china.com,,,Leading Global,"Guangdong, China","Shenzhen, Guangdong, China",,2025-08-12T20:15:39.543948,
hair dryer,ABS Plastic Professional 1600WHairDryerfor Hotel,https://alumihk.en.made-in-china.com/product/qXHnNdCuEfYi/China-ABS-Plastic-Professional-1600W-Hair-Dryer-for-Hotel.html,,1,10.0,USD,200,,"ABS Plastic Professional 1600WHairDryerfor HotelUS$ 10-15/ Piece200 Pieces(MOQ)Alumi Industrial Co., Ltd.Alumi Industrial Co., Ltd.Gold MemberGuangdong, ChinaView larger video & image","Alumi Industrial Co., Ltd.",https://alumihk.en.made-in-china.com,,,"Post Sourcing Request
















                                    Alumi Industrial Co.","Guangdong, China","Huang Pu Road, Huang Pu District, Guangzhou",,2025-08-12T20:15:41.805156,
hair dryer,Customizable Ionic Light 3-Shift ProfessionalHairDryerHot,https://3c5d389ced10cf96.en.made-in-china.com/product/ITlYKtLAFfhn/China-Customizable-Ionic-Light-3-Shift-Professional-Hair-Dryer-Hot.html,,1,5.89,USD,200,,"Customizable Ionic Light 3-Shift ProfessionalHairDryerHotUS$ 5.89-7.26/ Piece200 Pieces(MOQ)Guangzhou Xinyang Electric Appliance Co., Ltd.Guangzhou Xinyang Electric Appliance Co., Ltd.Gold MemberAudited SupplierSecured TradingGuangdong, ChinaManufacturer/Factory & Trading CompanyEnjoy trading protection from Made-in-China.comView larger video & image5(5.0)""Fast Delivery""Fast Delivery","Guangzhou Xinyang Electric Appliance Co., Ltd.",https://3c5d389ced10cf96.en.made-in-china.com,5.0,5.0,"Post a Sourcing Request Now 











Product Group","Guangdong, China","Dragon Returns to The Street, Guangzhou, Guangdong",,2025-08-12T20:15:43.915445,
hair dryer,China Factory Direct High Quality 2000W Powerful Quick Dry High SpeedHairDryerIonic Professional Hammer Electric BlowerDryer,https://huipuhairdryer.en.made-in-china.com/product/NGwrhTZdEzWJ/China-China-Factory-Direct-High-Quality-2000W-Powerful-Quick-Dry-High-Speed-Hair-Dryer-Ionic-Professional-Hammer-Electric-Blower-Dryer.html,,1,8.6,USD,1,,"China Factory Direct High Quality 2000W Powerful Quick Dry High SpeedHairDryerIonic Professional Hammer Electric BlowerDryerUS$ 8.6-18.5/ pieces1 pieces(MOQ)Wenzhou Huipu Electrical Appliance Co., Ltd.Wenzhou Huipu Electrical Appliance Co., Ltd.Diamond MemberAudited SupplierSecured TradingZhejiang, ChinaEnjoy trading protection from Made-in-China.comView larger video & image5(5.0)""Fast Delivery""Fast Delivery","Wenzhou Huipu Electrical Appliance Co., Ltd.",https://huipuhairdryer.en.made-in-china.com,5.0,5.0,Wenzhou Huipu Electric Co.,"Zhejiang, China","Wenzhou, Zhejiang, China",,2025-08-12T20:15:45.999076,
