keyword,title,listing_url,item_number,sku,price,currency,min_order_quantity,max_order_quantity,units_available,brand,category,description,seller_name,seller_profile_url,seller_rating,seller_total_reviews,seller_email,seller_business_name,seller_country,seller_state_province,seller_zip_code,seller_phone,seller_address,scraped_at,last_updated
hair dryer,Top Quality Hot Selling Unprocessed 100% Human Virgin Remy Silk Straight Indian Seamless Clip inHairExtensions,https://shangkaihair.en.made-in-china.com/product/INWmvsQOkMkh/China-Top-Quality-Hot-Selling-Unprocessed-100-Human-Virgin-Remy-Silk-Straight-Indian-Seamless-Clip-in-Hair-Extensions.html,INWmvsQOkMkh,INWmvsQOkMkh,28.0,USD,1,,,,,,Juancheng Shangkai Hair Products,https://shangkaihair.en.made-in-china.com,,,,,,,,,,2025-08-12T13:01:41.081054,
hair dryer,"High Quality Macaroni Machine, Pasta Making Machine, Macaroni Production Line Large Scale Commercial Pasta Extruder Machine Production Line",https://sunward.en.made-in-china.com/product/NCtxGcVKAyhL/China-High-Quality-Macaroni-Machine-Pasta-Making-Machine-Macaroni-Production-Line-Large-Scale-Commercial-Pasta-Extruder-Machine-Production-Line.html,NCtxGcVKAyhL,NCtxGcVKAyhL,32000.0,USD,1,,,,,,"Jinan Sunward Machinery Co., Ltd.",https://sunward.en.made-in-china.com,,,,,,,,,,2025-08-12T13:01:45.057486,
hair dryer,Italian Pasta Making Machine Macaroni Making Machine,https://sunward.en.made-in-china.com/product/usaQAKkdLjhC/China-Italian-Pasta-Making-Machine-Macaroni-Making-Machine.html,usaQAKkdLjhC,usaQAKkdLjhC,35000.0,USD,1,,,,,,"Jinan Sunward Machinery Co., Ltd.",https://sunward.en.made-in-china.com,,,,,,,,,,2025-08-12T13:01:45.625181,
hair dryer,Automatic Pasta Macaroni Machine Making Line Screw Fried Snack Pellets Food Machinery / Snack Pellet Processing Line / Pasta Macaroni Making Machine,https://sunward.en.made-in-china.com/product/uKqJgUeYqVrQ/China-Automatic-Pasta-Macaroni-Machine-Making-Line-Screw-Fried-Snack-Pellets-Food-Machinery-Snack-Pellet-Processing-Line-Pasta-Macaroni-Making-Machine.html,uKqJgUeYqVrQ,uKqJgUeYqVrQ,35000.0,USD,1,,,,,,"Jinan Sunward Machinery Co., Ltd.",https://sunward.en.made-in-china.com,,,,,,,,,,2025-08-12T13:01:46.176981,
hair dryer,New Design Industrial Extruder Italy Pasta Macaroni Making Machine 100 Kg/H,https://sunward.en.made-in-china.com/product/rNTJfLVvCshj/China-New-Design-Industrial-Extruder-Italy-Pasta-Macaroni-Making-Machine-100-Kg-H.html,rNTJfLVvCshj,rNTJfLVvCshj,35000.0,USD,1,,,,,,"Jinan Sunward Machinery Co., Ltd.",https://sunward.en.made-in-china.com,,,,,,,,,,2025-08-12T13:01:46.742900,
hair dryer,Industrial Macaroni Pasta Slanty Snack Pellet Chips Making Machine Production Line Big Capacity Macaroni Making Machine with Factory Quality,https://sunward.en.made-in-china.com/product/dOZAbKeucqpF/China-Industrial-Macaroni-Pasta-Slanty-Snack-Pellet-Chips-Making-Machine-Production-Line-Big-Capacity-Macaroni-Making-Machine-with-Factory-Quality.html,dOZAbKeucqpF,dOZAbKeucqpF,35000.0,USD,1,,,,,,"Jinan Sunward Machinery Co., Ltd.",https://sunward.en.made-in-china.com,,,,,,,,,,2025-08-12T13:01:47.324046,
hair dryer,Easy Operate Pasta Macaroni Food Making Machinery,https://sunward.en.made-in-china.com/product/IsAnTRhVbCWK/China-Easy-Operate-Pasta-Macaroni-Food-Making-Machinery.html,IsAnTRhVbCWK,IsAnTRhVbCWK,35000.0,USD,1,,,,,,"Jinan Sunward Machinery Co., Ltd.",https://sunward.en.made-in-china.com,,,,,,,,,,2025-08-12T13:01:48.911062,
hair dryer,Italian Pasta Production Line Industrial Pasta Making Machine,https://sunward.en.made-in-china.com/product/gXMxPebuYkpT/China-Italian-Pasta-Production-Line-Industrial-Pasta-Making-Machine.html,gXMxPebuYkpT,gXMxPebuYkpT,35000.0,USD,1,,,,,,"Jinan Sunward Machinery Co., Ltd.",https://sunward.en.made-in-china.com,,,,,,,,,,2025-08-12T13:01:49.481332,
hair dryer,PortableHairWashing Sink and Chair Discount Barber Chairs,https://honglibeauty.en.made-in-china.com/product/GdaATkcOsfWm/China-Portable-Hair-Washing-Sink-and-Chair-Discount-Barber-Chairs.html,GdaATkcOsfWm,GdaATkcOsfWm,264.0,USD,10,,,,,,"Wenling Hongli Barber & Beauty Co., Ltd.",,,,,,,,,,,2025-08-12T13:01:49.486341,
hair dryer,Styling Chairs SalonHairSalon Furniture Barber,https://honglibeauty.en.made-in-china.com/product/MdRaFlpAhzkL/China-Styling-Chairs-Salon-Hair-Salon-Furniture-Barber.html,MdRaFlpAhzkL,MdRaFlpAhzkL,258.0,USD,10,,,,,,"Wenling Hongli Barber & Beauty Co., Ltd.",,,,,,,,,,,2025-08-12T13:01:49.491857,
hair dryer,Reclining Salon Shampoo Chair Salon Classic Barber Chair,https://honglibeauty.en.made-in-china.com/product/EFpGRDHMOahV/China-Reclining-Salon-Shampoo-Chair-Salon-Classic-Barber-Chair.html,EFpGRDHMOahV,EFpGRDHMOahV,258.0,USD,10,,,,,,"Wenling Hongli Barber & Beauty Co., Ltd.",,,,,,,,,,,2025-08-12T13:01:49.497856,
hair dryer,Used Salon Styling Chairs for Sale Vintage Hairdressing Chair,https://honglibeauty.en.made-in-china.com/product/lFgTsocvMfWd/China-Used-Salon-Styling-Chairs-for-Sale-Vintage-Hairdressing-Chair.html,lFgTsocvMfWd,lFgTsocvMfWd,258.0,USD,10,,,,,,"Wenling Hongli Barber & Beauty Co., Ltd.",,,,,,,,,,,2025-08-12T13:01:49.504369,
hair dryer,Beauty Parlour Furniture Price Low Makeup Salon Furniture,https://honglibeauty.en.made-in-china.com/product/VZAfGcKDgtWi/China-Beauty-Parlour-Furniture-Price-Low-Makeup-Salon-Furniture.html,VZAfGcKDgtWi,VZAfGcKDgtWi,293.0,USD,10,,,,,,"Wenling Hongli Barber & Beauty Co., Ltd.",,,,,,,,,,,2025-08-12T13:01:49.509369,
hair dryer,Brazilian HumanHairHighlightP4/27 Deep Wave Curly Swiss Lace Frontal Wigs,https://elegant-hair.en.made-in-china.com/product/sxyRrqzTbdUW/China-Brazilian-Human-Hair-Highlight-P4-27-Deep-Wave-Curly-Swiss-Lace-Frontal-Wigs.html,sxyRrqzTbdUW,sxyRrqzTbdUW,49.0,USD,1,,,,,,"Xuchang Elegant Hair Products Co., Ltd.",https://elegant-hair.en.made-in-china.com,,,,,,,,,,2025-08-12T13:01:53.928323,
hair dryer,P4/27 Highlight Ombre Straight HumanHair13X4 13X6 Transparent Lace Front Wig,https://eleganthair.en.made-in-china.com/product/cKvEWmoTOxrq/China-P4-27-Highlight-Ombre-Straight-Human-Hair-13X4-13X6-Transparent-Lace-Front-Wig.html,cKvEWmoTOxrq,cKvEWmoTOxrq,45.6,USD,1,,,,,,"Changge Elegant Hair Products Co., Ltd.",https://eleganthair.en.made-in-china.com,,,,,,,,,,2025-08-12T13:01:55.295747,
hair dryer,Wholesale VietnameseHairBody Wave Highlight BrownP4/27 Transparent Lace Front Wig,https://elegant-hair.en.made-in-china.com/product/BnNRhpqECwrK/China-Wholesale-Vietnamese-Hair-Body-Wave-Highlight-Brown-P4-27-Transparent-Lace-Front-Wig.html,BnNRhpqECwrK,BnNRhpqECwrK,56.0,USD,1,,,,,,"Xuchang Elegant Hair Products Co., Ltd.",https://elegant-hair.en.made-in-china.com,,,,,,,,,,2025-08-12T13:01:55.884658,
hair dryer,Wholesale Vietnamese HumanHairHighlightP4/27 Body Wave 13X4 Lace Front Wig,https://elegant-hair.en.made-in-china.com/product/CEjrpRMPbZYI/China-Wholesale-Vietnamese-Human-Hair-Highlight-P4-27-Body-Wave-13X4-Lace-Front-Wig.html,CEjrpRMPbZYI,CEjrpRMPbZYI,56.0,USD,1,,,,,,"Xuchang Elegant Hair Products Co., Ltd.",https://elegant-hair.en.made-in-china.com,,,,,,,,,,2025-08-12T13:01:56.415144,
hair dryer,Wholesale VietnameseHairNatural Straight Highlight BrownP4/27 Transparent Lace Front Wig,https://elegant-hair.en.made-in-china.com/product/xJFRTCkEYdpo/China-Wholesale-Vietnamese-Hair-Natural-Straight-Highlight-Brown-P4-27-Transparent-Lace-Front-Wig.html,xJFRTCkEYdpo,xJFRTCkEYdpo,36.0,USD,1,,,,,,"Xuchang Elegant Hair Products Co., Ltd.",https://elegant-hair.en.made-in-china.com,,,,,,,,,,2025-08-12T13:01:56.917364,
hair dryer,WholesalesP4/27 Bone Straight HumanHair13*6 HD Transparent Lace Front Wig,https://elegant-hair.en.made-in-china.com/product/nJyRfeDbhOpX/China-Wholesales-P4-27-Bone-Straight-Human-Hair-13-6-HD-Transparent-Lace-Front-Wig.html,nJyRfeDbhOpX,nJyRfeDbhOpX,54.3,USD,1,,,,,,"Xuchang Elegant Hair Products Co., Ltd.",https://elegant-hair.en.made-in-china.com,,,,,,,,,,2025-08-12T13:01:57.433209,
hair dryer,Wholesale Indian HumanHairHighlightP4/27 Body Wave 13X4 Lace Front Wigs,https://elegant-hair.en.made-in-china.com/product/znOUsxcAhdYe/China-Wholesale-Indian-Human-Hair-Highlight-P4-27-Body-Wave-13X4-Lace-Front-Wigs.html,znOUsxcAhdYe,znOUsxcAhdYe,56.5,USD,1,,,,,,"Xuchang Elegant Hair Products Co., Ltd.",https://elegant-hair.en.made-in-china.com,,,,,,,,,,2025-08-12T13:01:58.039114,
hair dryer,Body Wave 100% HumanHair4/27 Cuticle Aligned Virgin Lace Frontal Wig,https://eleganthair.en.made-in-china.com/product/PKYJAbxymQUt/China-Body-Wave-100-Human-Hair-4-27-Cuticle-Aligned-Virgin-Lace-Frontal-Wig.html,PKYJAbxymQUt,PKYJAbxymQUt,39.0,USD,1,,,,,,"Changge Elegant Hair Products Co., Ltd.",https://eleganthair.en.made-in-china.com,,,,,,,,,,2025-08-12T13:01:59.296507,
hair dryer,Brazilian HumanHairHighlightP4/27 Body Wave Curly Swiss Lace Frontal Wigs,https://elegant-hair.en.made-in-china.com/product/ImCRfySvLdpK/China-Brazilian-Human-Hair-Highlight-P4-27-Body-Wave-Curly-Swiss-Lace-Frontal-Wigs.html,ImCRfySvLdpK,ImCRfySvLdpK,52.35,USD,1,,,,,,"Xuchang Elegant Hair Products Co., Ltd.",https://elegant-hair.en.made-in-china.com,,,,,,,,,,2025-08-12T13:01:59.846861,
hair dryer,"(T4/27/P4) 18 Inch 7PCS 16 Clips Real HumanHair, 100% HumanHair, 120g Natural Soft Straight Double Weft Clip in Extensions for Women",https://rebeccahairfactory.en.made-in-china.com/product/vwofukcdllAb/China-T4-27-P4-18-Inch-7PCS-16-Clips-Real-Human-Hair-100-Human-Hair-120g-Natural-Soft-Straight-Double-Weft-Clip-in-Extensions-for-Women.html,vwofukcdllAb,vwofukcdllAb,66.0,USD,1,,,,,,"Henan Rebecca Hair Products Co.,Ltd",https://rebeccahairfactory.en.made-in-china.com,,,,,,,,,,2025-08-12T13:02:00.569967,
hair dryer,"(T4/27/P4) 20 Inch 7PCS 120g 16 Clips inHairExtensions, Chocolate Brown to Caramel Blonde RemyHairExtensions Clip inHairExtensions HumanHair",https://rebeccahairfactory.en.made-in-china.com/product/ZOoGwfMDrHtl/China-T4-27-P4-20-Inch-7PCS-120g-16-Clips-in-Hair-Extensions-Chocolate-Brown-to-Caramel-Blonde-Remy-Hair-Extensions-Clip-in-Hair-Extensions-Human-Hair.html,ZOoGwfMDrHtl,ZOoGwfMDrHtl,84.7,USD,1,,,,,,"Henan Rebecca Hair Products Co.,Ltd",https://rebeccahairfactory.en.made-in-china.com,,,,,,,,,,2025-08-12T13:02:01.160984,
hair dryer,"T4/27/P4, 22"" 120g, 7PCS 16 Clips HumanHairClip inHairExtensions, Caramel Blonde Clips inHairExtensions Remy HumanHairExtensions for Women",https://rebeccahairfactory.en.made-in-china.com/product/CwUAvlOdyHfM/China-T4-27-P4-22-120g-7PCS-16-Clips-Human-Hair-Clip-in-Hair-Extensions-Caramel-Blonde-Clips-in-Hair-Extensions-Remy-Human-Hair-Extensions-for-Women.html,CwUAvlOdyHfM,CwUAvlOdyHfM,99.6,USD,1,,,,,,"Henan Rebecca Hair Products Co.,Ltd",https://rebeccahairfactory.en.made-in-china.com,,,,,,,,,,2025-08-12T13:02:01.720861,
hair dryer,Wholesale Vietnamese HumanHairHighlightP4/27 Deep Wave 13X4 Lace Front Wig,https://elegant-hair.en.made-in-china.com/product/QnyrRbgUgZpd/China-Wholesale-Vietnamese-Human-Hair-Highlight-P4-27-Deep-Wave-13X4-Lace-Front-Wig.html,QnyrRbgUgZpd,QnyrRbgUgZpd,56.0,USD,1,,,,,,"Xuchang Elegant Hair Products Co., Ltd.",https://elegant-hair.en.made-in-china.com,,,,,,,,,,2025-08-12T13:02:02.836880,
hair dryer,Wholesale VietnameseHairBody Wave HighlightP4/27 Transparent Lace Front Wig,https://elegant-hair.en.made-in-china.com/product/gmdYlUechFRP/China-Wholesale-Vietnamese-Hair-Body-Wave-Highlight-P4-27-Transparent-Lace-Front-Wig.html,gmdYlUechFRP,gmdYlUechFRP,56.5,USD,1,,,,,,"Xuchang Elegant Hair Products Co., Ltd.",https://elegant-hair.en.made-in-china.com,,,,,,,,,,2025-08-12T13:02:03.383554,
hair dryer,Brazilian HumanHairHighlightP4/27 Bone Straight Swiss Lace Frontal Wigs,https://elegant-hair.en.made-in-china.com/product/QJFUdDkuEZYO/China-Brazilian-Human-Hair-Highlight-P4-27-Bone-Straight-Swiss-Lace-Frontal-Wigs.html,QJFUdDkuEZYO,QJFUdDkuEZYO,48.3,USD,1,,,,,,"Xuchang Elegant Hair Products Co., Ltd.",https://elegant-hair.en.made-in-china.com,,,,,,,,,,2025-08-12T13:02:03.929828,
hair dryer,150% Density Mixed Colors Straight HighlightP4/27 Lace Front HumanHairWig,https://elegant-hair.en.made-in-china.com/product/HatUMKXTIEYz/China-150-Density-Mixed-Colors-Straight-Highlight-P4-27-Lace-Front-Human-Hair-Wig.html,HatUMKXTIEYz,HatUMKXTIEYz,63.0,USD,1,,,,,,"Xuchang Elegant Hair Products Co., Ltd.",https://elegant-hair.en.made-in-china.com,,,,,,,,,,2025-08-12T13:02:04.698899,
hair dryer,Factory Price Brazilian Remy HumanHairP4/27 Highlight Transparent Lace Front Wig,https://elegant-hair.en.made-in-china.com/product/BtJUGXlvTnRE/China-Factory-Price-Brazilian-Remy-Human-Hair-P4-27-Highlight-Transparent-Lace-Front-Wig.html,BtJUGXlvTnRE,BtJUGXlvTnRE,40.0,USD,1,,,,,,"Xuchang Elegant Hair Products Co., Ltd.",https://elegant-hair.en.made-in-china.com,,,,,,,,,,2025-08-12T13:02:05.245628,
hair dryer,Wholesale Vietnamese HumanHairHighlightP4/27 Bone Straight 13X4 Lace Front Wig,https://elegant-hair.en.made-in-china.com/product/mQOYxDeCJwRE/China-Wholesale-Vietnamese-Human-Hair-Highlight-P4-27-Bone-Straight-13X4-Lace-Front-Wig.html,mQOYxDeCJwRE,mQOYxDeCJwRE,49.5,USD,1,,,,,,"Xuchang Elegant Hair Products Co., Ltd.",https://elegant-hair.en.made-in-china.com,,,,,,,,,,2025-08-12T13:02:05.888059,
hair dryer,U TipHairExtensions Real HumanHairDark Brown UtipHairExtensions HumanHairfor Women 20 Inch Brown Ktip HumanHairExtensions Pre Bonded Soft Straight 50g,https://rebeccahairfactory.en.made-in-china.com/product/SQupgWsAILUx/China-U-Tip-Hair-Extensions-Real-Human-Hair-Dark-Brown-Utip-Hair-Extensions-Human-Hair-for-Women-20-Inch-Brown-Ktip-Human-Hair-Extensions-Pre-Bonded-Soft-Straight-50g.html,SQupgWsAILUx,SQupgWsAILUx,78.8,USD,1,,,,,,"Henan Rebecca Hair Products Co.,Ltd",https://rebeccahairfactory.en.made-in-china.com,,,,,,,,,,2025-08-12T13:02:06.446550,
hair dryer,Brazilian Real Remy HumanHairHighlight 4/27 Deep Wave Frontal Lace Wig,https://elegant-hair.en.made-in-china.com/product/sfaRvSMHgxYh/China-Brazilian-Real-Remy-Human-Hair-Highlight-4-27-Deep-Wave-Frontal-Lace-Wig.html,sfaRvSMHgxYh,sfaRvSMHgxYh,53.0,USD,1,,,,,,"Xuchang Elegant Hair Products Co., Ltd.",https://elegant-hair.en.made-in-china.com,,,,,,,,,,2025-08-12T13:02:07.077761,
hair dryer,Factory Price Water Curly Deep Wave Ombre Highlight 4/27 Lace Front Wig,https://elegant-hair.en.made-in-china.com/product/bmsRwrUorZYN/China-Factory-Price-Water-Curly-Deep-Wave-Ombre-Highlight-4-27-Lace-Front-Wig.html,bmsRwrUorZYN,bmsRwrUorZYN,54.0,USD,1,,,,,,"Xuchang Elegant Hair Products Co., Ltd.",https://elegant-hair.en.made-in-china.com,,,,,,,,,,2025-08-12T13:02:07.638986,
hair dryer,22 Inch U TipHairExtensions Ombre U TipHairExtension HumanHairU TipHairExtension Brown U Tip HumanHairExtensions for Women,https://rebeccahairfactory.en.made-in-china.com/product/exLYgfyCsPpR/China-22-Inch-U-Tip-Hair-Extensions-Ombre-U-Tip-Hair-Extension-Human-Hair-U-Tip-Hair-Extension-Brown-U-Tip-Human-Hair-Extensions-for-Women.html,exLYgfyCsPpR,exLYgfyCsPpR,86.5,USD,1,,,,,,"Henan Rebecca Hair Products Co.,Ltd",https://rebeccahairfactory.en.made-in-china.com,,,,,,,,,,2025-08-12T13:02:08.201910,
hair dryer,Wholesale Price Deep Wave Highlight 4/27 Glueless Lace Front HumanHairWigs,https://elegant-hair.en.made-in-china.com/product/xmNpgIREmwUn/China-Wholesale-Price-Deep-Wave-Highlight-4-27-Glueless-Lace-Front-Human-Hair-Wigs.html,xmNpgIREmwUn,xmNpgIREmwUn,52.0,USD,1,,,,,,"Xuchang Elegant Hair Products Co., Ltd.",https://elegant-hair.en.made-in-china.com,,,,,,,,,,2025-08-12T13:02:08.723660,
hair dryer,Highlight Seamless Top Quality Russian Cuticle Tape in HumanHairExtensions,https://eleganthair.en.made-in-china.com/product/kSHJRovdZYcU/China-Highlight-Seamless-Top-Quality-Russian-Cuticle-Tape-in-Human-Hair-Extensions.html,kSHJRovdZYcU,kSHJRovdZYcU,24.0,USD,1,,,,,,"Changge Elegant Hair Products Co., Ltd.",https://eleganthair.en.made-in-china.com,,,,,,,,,,2025-08-12T13:02:09.292668,
hair dryer,Blonde Highlight Mix Color Deep Wave Curly HD Transparent Lace Front Wigs,https://elegant-hair.en.made-in-china.com/product/laTpBXqcOQYD/China-Blonde-Highlight-Mix-Color-Deep-Wave-Curly-HD-Transparent-Lace-Front-Wigs.html,laTpBXqcOQYD,laTpBXqcOQYD,51.2,USD,1,,,,,,"Xuchang Elegant Hair Products Co., Ltd.",https://elegant-hair.en.made-in-china.com,,,,,,,,,,2025-08-12T13:02:09.959677,
hair dryer,Wholesale 30inch Deep Wave HumanHairHighlight Ombre Curly Lace Frontal Wigs,https://elegant-hair.en.made-in-china.com/product/xtaRuBojIEUI/China-Wholesale-30inch-Deep-Wave-Human-Hair-Highlight-Ombre-Curly-Lace-Frontal-Wigs.html,xtaRuBojIEUI,xtaRuBojIEUI,146.5,USD,1,,,,,,"Xuchang Elegant Hair Products Co., Ltd.",https://elegant-hair.en.made-in-china.com,,,,,,,,,,2025-08-12T13:02:10.546948,
hair dryer,Multiple Colors Silky Straight HumanHairTape inHairExtensions 18-22 InchHairExtensions Tape in Remy RealHair50 Gram Tape in Extensions,https://rebeccahairfactory.en.made-in-china.com/product/ldFfTEpGTPAx/China-Multiple-Colors-Silky-Straight-Human-Hair-Tape-in-Hair-Extensions-18-22-Inch-Hair-Extensions-Tape-in-Remy-Real-Hair-50-Gram-Tape-in-Extensions.html,ldFfTEpGTPAx,ldFfTEpGTPAx,37.0,USD,1,,,,,,"Henan Rebecca Hair Products Co.,Ltd",https://rebeccahairfactory.en.made-in-china.com,,,,,,,,,,2025-08-12T13:02:11.161878,
hair dryer,Wholesale 150% Density Pre-PluckedP4/27 Highlight Straight 13X4 Swiss Lace Front Wigs,https://elegant-hair.en.made-in-china.com/product/wnNUSqgcSOry/China-Wholesale-150-Density-Pre-Plucked-P4-27-Highlight-Straight-13X4-Swiss-Lace-Front-Wigs.html,wnNUSqgcSOry,wnNUSqgcSOry,56.0,USD,1,,,,,,"Xuchang Elegant Hair Products Co., Ltd.",https://elegant-hair.en.made-in-china.com,,,,,,,,,,2025-08-12T13:02:11.720549,
hair dryer,18 Inch U TipHairExtensions Medium Brown to Blonde U Tips HumanHairExtensions Highlight U TipHairExtensions HumanHairfor WomenHairExtensions,https://rebeccahairfactory.en.made-in-china.com/product/YENpBCFUZrRv/China-18-Inch-U-Tip-Hair-Extensions-Medium-Brown-to-Blonde-U-Tips-Human-Hair-Extensions-Highlight-U-Tip-Hair-Extensions-Human-Hair-for-Women-Hair-Extensions.html,YENpBCFUZrRv,YENpBCFUZrRv,49.9,USD,1,,,,,,"Henan Rebecca Hair Products Co.,Ltd",https://rebeccahairfactory.en.made-in-china.com,,,,,,,,,,2025-08-12T13:02:12.240651,
hair dryer,Wholesale 150% DensityP4/27 Highlight Blonde Straight 13X4 Swiss Lace Front Wigs,https://elegant-hair.en.made-in-china.com/product/dQZRPHMurwYK/China-Wholesale-150-Density-P4-27-Highlight-Blonde-Straight-13X4-Swiss-Lace-Front-Wigs.html,dQZRPHMurwYK,dQZRPHMurwYK,46.3,USD,1,,,,,,"Xuchang Elegant Hair Products Co., Ltd.",https://elegant-hair.en.made-in-china.com,,,,,,,,,,2025-08-12T13:02:12.752042,
hair dryer,Automatic Liquid Honey Cosmetic Packing Olive Oil Blister Forming Filling Sealing Machine,https://cngrandmachinery.en.made-in-china.com/product/adVtYyGbAcWC/China-Automatic-Liquid-Honey-Cosmetic-Packing-Olive-Oil-Blister-Forming-Filling-Sealing-Machine.html,adVtYyGbAcWC,adVtYyGbAcWC,12500.0,USD,1,,,,,,"WENZHOU GRAND MACHINERY TECHNOLOGY CO., LTD.",https://cngrandmachinery.en.made-in-china.com,,,,,,,,,,2025-08-12T13:02:16.933766,
hair dryer,Automatic Single Dose Oral Liquid Packing Machine Plastic Ampoule Forming Filling Sealing Machine,https://cngrandmachinery.en.made-in-china.com/product/lnaUoHychwVf/China-Automatic-Single-Dose-Oral-Liquid-Packing-Machine-Plastic-Ampoule-Forming-Filling-Sealing-Machine.html,lnaUoHychwVf,lnaUoHychwVf,12000.0,USD,1,,,,,,"WENZHOU GRAND MACHINERY TECHNOLOGY CO., LTD.",https://cngrandmachinery.en.made-in-china.com,,,,,,,,,,2025-08-12T13:02:17.521520,
hair dryer,Ffs Oral Liquid Olive Oil Plastic Ampoule Forming Filling and Sealing Machine,https://cngrandmachinery.en.made-in-china.com/product/QxzrJMIVgdcO/China-Ffs-Oral-Liquid-Olive-Oil-Plastic-Ampoule-Forming-Filling-and-Sealing-Machine.html,QxzrJMIVgdcO,QxzrJMIVgdcO,13000.0,USD,1,,,,,,"WENZHOU GRAND MACHINERY TECHNOLOGY CO., LTD.",https://cngrandmachinery.en.made-in-china.com,,,,,,,,,,2025-08-12T13:02:18.116702,
hair dryer,Automatic Olive Oil Packing Machine Liquid Ampoule Forming Filling and Packaging Machine,https://cngrandmachinery.en.made-in-china.com/product/pAEreOaGIxVv/China-Automatic-Olive-Oil-Packing-Machine-Liquid-Ampoule-Forming-Filling-and-Packaging-Machine.html,pAEreOaGIxVv,pAEreOaGIxVv,11000.0,USD,1,,,,,,"WENZHOU GRAND MACHINERY TECHNOLOGY CO., LTD.",https://cngrandmachinery.en.made-in-china.com,,,,,,,,,,2025-08-12T13:02:18.677177,
hair dryer,UK Plug AC Power Cord Cable forHairDryerPower Cable,https://yiliancable.en.made-in-china.com/product/hGirTdcVEvWs/China-UK-Plug-AC-Power-Cord-Cable-for-Hair-Dryer-Power-Cable.html,hGirTdcVEvWs,hGirTdcVEvWs,0.25,USD,5000,,,,,,"Guangdong Yilian Cables Co., Ltd.",https://yiliancable.en.made-in-china.com,,,,,,,,,,2025-08-12T13:02:20.761960,
hair dryer,8ml Plastic Ampoule 10ml Vial Olive Oil Honey Bfs Oral Liquid Forming Filling and Sealing Machine,https://cngrandmachinery.en.made-in-china.com/product/JmSYOzrDZCkw/China-8ml-Plastic-Ampoule-10ml-Vial-Olive-Oil-Honey-Bfs-Oral-Liquid-Forming-Filling-and-Sealing-Machine.html,JmSYOzrDZCkw,JmSYOzrDZCkw,12000.0,USD,1,,,,,,"WENZHOU GRAND MACHINERY TECHNOLOGY CO., LTD.",https://cngrandmachinery.en.made-in-china.com,,,,,,,,,,2025-08-12T13:02:21.353441,
hair dryer,Micro 689 2RS 689zz Deep Groove Ball Bearing 9*17*4mmHairDryerBlower Motor Bearing,https://fskbearing.en.made-in-china.com/product/AncYpHdChShR/China-Micro-689-2RS-689zz-Deep-Groove-Ball-Bearing-9-17-4mm-Hair-Dryer-Blower-Motor-Bearing.html,AncYpHdChShR,AncYpHdChShR,0.5,USD,1,,,,,,"Wuxi Fsk Transmission Bearing Co., Ltd.",https://fskbearing.en.made-in-china.com,,,,,,,,,,2025-08-12T13:02:22.797943,
hair dryer,Deep Groove Ball Bearings 608 for Pumps,https://kent-bearing.en.made-in-china.com/product/MJLYZncCCkhV/China-Deep-Groove-Ball-Bearings-608-for-Pumps.html,MJLYZncCCkhV,MJLYZncCCkhV,0.1,USD,1000,,,,,,"Ningbo Kent Bearing Co., Ltd.",https://kent-bearing.en.made-in-china.com,,,,,,,,,,2025-08-12T13:02:24.042686,
hair dryer,1.5mm Thickness 1000*600mm High Temperature Mica Sheet Heating Element,https://superbheater.en.made-in-china.com/product/JeEniSYMaFTo/China-1-5mm-Thickness-1000-600mm-High-Temperature-Mica-Sheet-Heating-Element.html,JeEniSYMaFTo,JeEniSYMaFTo,1.0,USD,1,,,,,,"Shenzhen Superb Heater Technology Co., Limited",https://superbheater.en.made-in-china.com,,,,,,,,,,2025-08-12T13:02:25.462426,
hair dryer,Electric Insulation Mica Sheet 0.5mm Thin Mica Sheet Mica Paper Price,https://superbheater.en.made-in-china.com/product/ZtNryQbAXlWu/China-Electric-Insulation-Mica-Sheet-0-5mm-Thin-Mica-Sheet-Mica-Paper-Price.html,ZtNryQbAXlWu,ZtNryQbAXlWu,0.8,USD,1,,,,,,"Shenzhen Superb Heater Technology Co., Limited",https://superbheater.en.made-in-china.com,,,,,,,,,,2025-08-12T13:02:26.009604,
hair dryer,"Bearing for Autoparts, Motorcyle Parts, Ball Bearings 60 Series",https://kent-bearing.en.made-in-china.com/product/pxuURmwjOWVL/China-Bearing-for-Autoparts-Motorcyle-Parts-Ball-Bearings-60-Series.html,pxuURmwjOWVL,pxuURmwjOWVL,0.1,USD,1000,,,,,,"Ningbo Kent Bearing Co., Ltd.",https://kent-bearing.en.made-in-china.com,,,,,,,,,,2025-08-12T13:02:26.541473,
hair dryer,Mica Board Manufacturers Can Customize High-Temperature Resistant Mica Board Silver Insulation Board,https://superbheater.en.made-in-china.com/product/eQbRSyKCSMWl/China-Mica-Board-Manufacturers-Can-Customize-High-Temperature-Resistant-Mica-Board-Silver-Insulation-Board.html,eQbRSyKCSMWl,eQbRSyKCSMWl,1.0,USD,10,,,,,,"Shenzhen Superb Heater Technology Co., Limited",https://superbheater.en.made-in-china.com,,,,,,,,,,2025-08-12T13:02:27.149376,
hair dryer,"P6 Precision 6000 Series Ball Bearings for Meters, Motors, Washing Machines,HairDryers, Electric Tools",https://kent-bearing.en.made-in-china.com/product/IxYUnQOHTVWm/China-P6-Precision-6000-Series-Ball-Bearings-for-Meters-Motors-Washing-Machines-Hair-Dryers-Electric-Tools.html,IxYUnQOHTVWm,IxYUnQOHTVWm,0.1,USD,100,,,,,,"Ningbo Kent Bearing Co., Ltd.",https://kent-bearing.en.made-in-china.com,,,,,,,,,,2025-08-12T13:02:27.664735,
hair dryer,1.0mm Thickness 1000*600mm High Temperature Mica Sheet,https://superbheater.en.made-in-china.com/product/moQJDrYxmOAM/China-1-0mm-Thickness-1000-600mm-High-Temperature-Mica-Sheet.html,moQJDrYxmOAM,moQJDrYxmOAM,3.0,USD,5,,,,,,"Shenzhen Superb Heater Technology Co., Limited",https://superbheater.en.made-in-china.com,,,,,,,,,,2025-08-12T13:02:28.312463,
hair dryer,Mica Plates Sheets Thick Microwave Oven Replacement Part for Midea Universal Home Appliances Parts,https://superbheater.en.made-in-china.com/product/ECsmSfrdHthP/China-Mica-Plates-Sheets-Thick-Microwave-Oven-Replacement-Part-for-Midea-Universal-Home-Appliances-Parts.html,ECsmSfrdHthP,ECsmSfrdHthP,,USD,50,,,,,,"Shenzhen Superb Heater Technology Co., Limited",https://superbheater.en.made-in-china.com,,,,,,,,,,2025-08-12T13:02:29.777273,
hair dryer,0.8mm Thickness 1000*1200mm High Temperature Mica Sheet,https://superbheater.en.made-in-china.com/product/qMxmIopDgZth/China-0-8mm-Thickness-1000-1200mm-High-Temperature-Mica-Sheet.html,qMxmIopDgZth,qMxmIopDgZth,1.0,USD,1,,,,,,"Shenzhen Superb Heater Technology Co., Limited",https://superbheater.en.made-in-china.com,,,,,,,,,,2025-08-12T13:02:30.431845,
hair dryer,0.3mm Thickness 1000*600mm Mica Sheet in Mica Heater,https://superbheater.en.made-in-china.com/product/beQEHMpFXOTI/China-0-3mm-Thickness-1000-600mm-Mica-Sheet-in-Mica-Heater.html,beQEHMpFXOTI,beQEHMpFXOTI,3.0,USD,5,,,,,,"Shenzhen Superb Heater Technology Co., Limited",https://superbheater.en.made-in-china.com,,,,,,,,,,2025-08-12T13:02:31.010907,
hair dryer,0.7mm Thickness 1000*1200mm High Temperature Mica Sheet,https://superbheater.en.made-in-china.com/product/qoEmDPpKgOfk/China-0-7mm-Thickness-1000-1200mm-High-Temperature-Mica-Sheet.html,qoEmDPpKgOfk,qoEmDPpKgOfk,1.0,USD,10,,,,,,"Shenzhen Superb Heater Technology Co., Limited",https://superbheater.en.made-in-china.com,,,,,,,,,,2025-08-12T13:02:32.107667,
