keyword,title,listing_url,item_number,sku,price,currency,min_order_quantity,max_order_quantity,units_available,brand,category,description,seller_name,seller_profile_url,seller_rating,seller_total_reviews,seller_email,seller_business_name,seller_country,seller_state_province,seller_zip_code,seller_phone,seller_address,scraped_at,last_updated
hair dryer,Plasma AiHairDryerhigh PerformanceHairStraightener Constant Temperature Blowing Does Not Perm The Scalp HouseholdHairDryerProfessional Handheld Blow Dry,https://baiyisen.en.made-in-china.com/product/sRBYwtnKZmkN/China-Plasma-Ai-Hair-Dryerhigh-Performance-Hair-Straightener-Constant-Temperature-Blowing-Does-Not-Perm-The-Scalp-Household-Hair-Dryer-Professional-Handheld-Blow-Dry.html,sRBYwtnKZmkN,sRBYwtnKZmkN,30.0,USD,2000,,,,,,"Shenzhen Baiyisen Health Technology Co., Ltd.",https://baiyisen.en.made-in-china.com,,,,,,,,,,2025-08-12T13:00:45.678111,
hair dryer,ABS Materials Wall-Mounted HotelHairDryer,https://wontry.en.made-in-china.com/product/djWQeBGUZTkh/China-ABS-Materials-Wall-Mounted-Hotel-Hair-Dryer.html,djWQeBGUZTkh,djWQeBGUZTkh,11.0,USD,500,,,,,,"Wenzhou Won-Try Electric Appliance Co., Ltd.",https://wontry.en.made-in-china.com,,,,,,,,,,2025-08-12T13:00:47.471257,
hair dryer,Wholesale Professional Salon 2200W Hot and ColdHairDryerConstant Temperature High Speed High PowerHairDryer,https://fiyele.en.made-in-china.com/product/zaVRflIHswcx/China-Wholesale-Professional-Salon-2200W-Hot-and-Cold-Hair-Dryer-Constant-Temperature-High-Speed-High-Power-Hair-Dryer.html,zaVRflIHswcx,zaVRflIHswcx,13.34,USD,2000,,,,,,"Yueqing Fiy Electric Co., Ltd.",https://fiyele.en.made-in-china.com,,,,,,,,,,2025-08-12T13:00:48.876985,
hair dryer,Bidisco Custom Private Label Ionic Negative Ion AnionHairDryersHigh Quality Professional BlowHairDryer,https://bidisco.en.made-in-china.com/product/DatrAHOoITWQ/China-Bidisco-Custom-Private-Label-Ionic-Negative-Ion-Anion-Hair-Dryers-High-Quality-Professional-Blow-Hair-Dryer.html,DatrAHOoITWQ,DatrAHOoITWQ,11.96,USD,500,,,,,,"Dongguan Bidisco Electric CO., LTD",https://bidisco.en.made-in-china.com,,,,,,,,,,2025-08-12T13:00:50.131307,
hair dryer,High Quality Hot Selling Quick Drying 113000rpm Negative Ion ProfessionalHairDryer,https://dglizbella.en.made-in-china.com/product/aATrhPHDTLkU/China-High-Quality-Hot-Selling-Quick-Drying-113000rpm-Negative-Ion-Professional-Hair-Dryer.html,aATrhPHDTLkU,aATrhPHDTLkU,38.0,USD,1,,,,,,"Dongguan Zhimi Electrical Technology Co., Ltd.",https://dglizbella.en.made-in-china.com,,,,,,,,,,2025-08-12T13:00:51.451935,
hair dryer,China Manufacturers Professional Salon 2000W Negative Ionic BLDCHairDryerBrushless High Speed FoldableHairBlowDryer,https://huipuhairdryer.en.made-in-china.com/product/VtPrCQzoYlkh/China-China-Manufacturers-Professional-Salon-2000W-Negative-Ionic-BLDC-Hair-Dryer-Brushless-High-Speed-Foldable-Hair-Blow-Dryer.html,VtPrCQzoYlkh,VtPrCQzoYlkh,36.0,USD,500,,,,,,"Wenzhou Huipu Electrical Appliance Co., Ltd.",https://huipuhairdryer.en.made-in-china.com,,,,,,,,,,2025-08-12T13:00:52.692702,
hair dryer,"Negative Ionic BlowDryerwith 110, 000 RpmHairDryer",https://mktslkt-a.en.made-in-china.com/product/sGqRTHVunCkK/China-Negative-Ionic-Blow-Dryer-with-110-000-Rpm-Hair-Dryer.html,sGqRTHVunCkK,sGqRTHVunCkK,6.0,USD,1000,,,,,,"Market Union Co., Ltd.",https://mktslkt-a.en.made-in-china.com,,,,,,,,,,2025-08-12T13:00:53.932665,
hair dryer,Salon-Grade Performance Magnetic Nozzle Attachments Intelligent Heat ControlHairDryer,https://cy-electronic.en.made-in-china.com/product/NJeUlqkokZpO/China-Salon-Grade-Performance-Magnetic-Nozzle-Attachments-Intelligent-Heat-Control-Hair-Dryer.html,NJeUlqkokZpO,NJeUlqkokZpO,36.0,USD,1,,,,,,"Chaozhou Chengying Technology Co., Ltd",https://cy-electronic.en.made-in-china.com,,,,,,,,,,2025-08-12T13:00:55.394283,
hair dryer,High Speed 110000rpm BrushlessHairDryerFast Hairdryer 20 Million Negative IonicHairDryerhair BlowDryerHigh Speed IonicHairDryerfor Professional Salon,https://baiyisen.en.made-in-china.com/product/hnBRxQLHVdUu/China-High-Speed-110000rpm-Brushless-Hair-Dryer-Fast-Hairdryer-20-Million-Negative-Ionic-Hair-Dryerhair-Blow-Dryer-High-Speed-Ionic-Hair-Dryer-for-Professional-Salon.html,hnBRxQLHVdUu,hnBRxQLHVdUu,31.0,USD,500,,,,,,"Shenzhen Baiyisen Health Technology Co., Ltd.",https://baiyisen.en.made-in-china.com,,,,,,,,,,2025-08-12T13:00:55.913634,
hair dryer,Koofex Ionic 110000rpm BLDCHairDryerHigh Speed Brushless Motor BlowDryer,https://koofex.en.made-in-china.com/product/fAPUcXzxYoWd/China-Koofex-Ionic-110000rpm-BLDC-Hair-Dryer-High-Speed-Brushless-Motor-Blow-Dryer.html?ads_tp=&ads_id=vyBTXLqckPle,fAPUcXzxYoWd,fAPUcXzxYoWd,9.8,USD,1000,,,,,,"Guangzhou KooFex Appliances Co., Ltd.",https://koofex.en.made-in-china.com?ads_tp=&ads_id=vyBTXLqckPle,,,,,,,,,,2025-08-12T13:00:57.254826,
hair dryer,High Speed 110000 Rpm Brushless Negative IonHairDryer,https://bidisco.en.made-in-china.com/product/YxVrUdDObecp/China-High-Speed-110000-Rpm-Brushless-Negative-Ion-Hair-Dryer.html,YxVrUdDObecp,YxVrUdDObecp,29.3,USD,500,,,,,,"Dongguan Bidisco Electric CO., LTD",https://bidisco.en.made-in-china.com,,,,,,,,,,2025-08-12T13:00:58.643448,
hair dryer,2024 Hot Selling Ionic Professional Salon LED Display ScreenHairBlowerDryerBLDC 2000W High Power 3 in 1 One StepHairDryer,https://huipuhairdryer.en.made-in-china.com/product/qAFrWZdlfLVJ/China-2024-Hot-Selling-Ionic-Professional-Salon-LED-Display-Screen-Hair-Blower-Dryer-BLDC-2000W-High-Power-3-in-1-One-Step-Hair-Dryer.html,qAFrWZdlfLVJ,qAFrWZdlfLVJ,37.0,USD,500,,,,,,"Wenzhou Huipu Electrical Appliance Co., Ltd.",https://huipuhairdryer.en.made-in-china.com,,,,,,,,,,2025-08-12T13:00:59.155166,
hair dryer,Salon High Speed Professional Anion LeaflessHairDryerwith Anti-Frizz Features Warranty,https://shanghaijinglang.en.made-in-china.com/product/LGjYEkMoYIhp/China-Salon-High-Speed-Professional-Anion-Leafless-Hair-Dryer-with-Anti-Frizz-Features-Warranty.html,LGjYEkMoYIhp,LGjYEkMoYIhp,15.0,USD,1000,,,,,,"Jinglang Electric Appliances (Shanghai) Co., Ltd.",https://shanghaijinglang.en.made-in-china.com,,,,,,,,,,2025-08-12T13:01:00.506043,
hair dryer,Source Factoryhigh Speed 110000rpm High Speed Best HouseholdHairPattern Blow Dryer5 In1 Hot Air Brush Comb BlowDryerBrushhair Stylerfactory New Design BLDC,https://baiyisen.en.made-in-china.com/product/LtnRcvrVIJpB/China-Source-Factoryhigh-Speed-110000rpm-High-Speed-Best-Household-Hair-Pattern-Blow-Dryer5-In1-Hot-Air-Brush-Comb-Blow-Dryer-Brushhair-Stylerfactory-New-Design-BLDC.html,LtnRcvrVIJpB,LtnRcvrVIJpB,27.8,USD,1000,,,,,,"Shenzhen Baiyisen Health Technology Co., Ltd.",https://baiyisen.en.made-in-china.com,,,,,,,,,,2025-08-12T13:01:01.066085,
hair dryer,High Speed Constant Temperature Negative IonHairDryerProfessional Hammer Electric BlowerDryer,https://huipuhairdryer.en.made-in-china.com/product/EADYOxfTBHkQ/China-High-Speed-Constant-Temperature-Negative-Ion-Hair-Dryer-Professional-Hammer-Electric-Blower-Dryer.html,EADYOxfTBHkQ,EADYOxfTBHkQ,21.9,USD,50,,,,,,"Wenzhou Huipu Electrical Appliance Co., Ltd.",https://huipuhairdryer.en.made-in-china.com,,,,,,,,,,2025-08-12T13:01:01.596129,
hair dryer,High Quality Professional Drayer DC MotorHairBlowDryer2000W Drayer BlowDryers,https://reputable-trading.en.made-in-china.com/product/MTRrptxEBukW/China-High-Quality-Professional-Drayer-DC-Motor-Hair-Blow-Dryer-2000W-Drayer-Blow-Dryers.html,MTRrptxEBukW,MTRrptxEBukW,7.86,USD,500,,,,,,"Yiwu Reputable Trade Co., Ltd.",https://reputable-trading.en.made-in-china.com,,,,,,,,,,2025-08-12T13:01:02.823948,
hair dryer,Fast DryingHairCare Dsn HD15HairDryerHome Appliance Negative IonsDryer,https://himtop.en.made-in-china.com/product/pdjAniDyaHfx/China-Fast-Drying-Hair-Care-Dsn-HD15-Hair-Dryer-Home-Appliance-Negative-Ions-Dryer.html,pdjAniDyaHfx,pdjAniDyaHfx,55.0,USD,1,,,,,,"Shenzhen Himtop Technology Co., Ltd.",https://himtop.en.made-in-china.com,,,,,,,,,,2025-08-12T13:01:04.093860,
hair dryer,"Curling Iron for Effortless Long-Lasting Curls 5-in-1 Curling IronHairDryerSet 110, 000 Rpm Silent Brushless Motor",https://baiyisen.en.made-in-china.com/product/NGAUsdnxIErz/China-Curling-Iron-for-Effortless-Long-Lasting-Curls-5-in-1-Curling-Iron-Hair-Dryer-Set-110-000-Rpm-Silent-Brushless-Motor.html,NGAUsdnxIErz,NGAUsdnxIErz,30.0,USD,1000,,,,,,"Shenzhen Baiyisen Health Technology Co., Ltd.",https://baiyisen.en.made-in-china.com,,,,,,,,,,2025-08-12T13:01:04.712820,
hair dryer,High Quality Household High Speed Constant Temperature AnionHairDryer,https://shanghaijinglang.en.made-in-china.com/product/otyUFxVuhDWp/China-High-Quality-Household-High-Speed-Constant-Temperature-Anion-Hair-Dryer.html,otyUFxVuhDWp,otyUFxVuhDWp,20.0,USD,800,,,,,,"Jinglang Electric Appliances (Shanghai) Co., Ltd.",https://shanghaijinglang.en.made-in-china.com,,,,,,,,,,2025-08-12T13:01:05.247448,
hair dryer,Custom OEM/ODM Cross-BorderHairDryerwith Brushless Motor - High-SpeedHairProtection Professional BlowDryer,https://muselect.en.made-in-china.com/product/LpARYUBosTWK/China-Custom-OEM-ODM-Cross-Border-Hair-Dryer-with-Brushless-Motor-High-Speed-Hair-Protection-Professional-Blow-Dryer.html,LpARYUBosTWK,LpARYUBosTWK,28.75,USD,1000,,,,,,Market Union Co. Ltd.,https://muselect.en.made-in-china.com,,,,,,,,,,2025-08-12T13:01:06.776791,
hair dryer,Wholesale Adjustable Hot Cold Air Profession Hairdryer 2000W High Power Salon Negative Ionic Far Infrared TherapyHairDryer,https://huipuhairdryer.en.made-in-china.com/product/uakrzMOKAHWb/China-Wholesale-Adjustable-Hot-Cold-Air-Profession-Hairdryer-2000W-High-Power-Salon-Negative-Ionic-Far-Infrared-Therapy-Hair-Dryer.html,uakrzMOKAHWb,uakrzMOKAHWb,19.0,USD,1,,,,,,"Wenzhou Huipu Electrical Appliance Co., Ltd.",https://huipuhairdryer.en.made-in-china.com,,,,,,,,,,2025-08-12T13:01:07.300386,
hair dryer,Lightweight Build 1600W Motor Cool Shot Function Negative Ion TechnologyHairDryer,https://cy-electronic.en.made-in-china.com/product/BmdRbXzcLFph/China-Lightweight-Build-1600W-Motor-Cool-Shot-Function-Negative-Ion-Technology-Hair-Dryer.html,BmdRbXzcLFph,BmdRbXzcLFph,36.0,USD,1,,,,,,"Chaozhou Chengying Technology Co., Ltd",https://cy-electronic.en.made-in-china.com,,,,,,,,,,2025-08-12T13:01:08.570426,
hair dryer,New-Style Fashionable 2023 Updated Diffuser 1800W Women Curly IonicHairDryer,https://goodseller-household.en.made-in-china.com/product/KEDpyGSLVxRA/China-New-Style-Fashionable-2023-Updated-Diffuser-1800W-Women-Curly-Ionic-Hair-Dryer.html,KEDpyGSLVxRA,KEDpyGSLVxRA,10.0,USD,95,,,,,,"Good Seller Co., Ltd",https://goodseller-household.en.made-in-china.com,,,,,,,,,,2025-08-12T13:01:09.948999,
hair dryer,OEM Customized 1200W Professional Electric Ionic BlowHairDryer,https://bidisco.en.made-in-china.com/product/gwHfLGSyEshu/China-OEM-Customized-1200W-Professional-Electric-Ionic-Blow-Hair-Dryer.html,gwHfLGSyEshu,gwHfLGSyEshu,12.36,USD,300,,,,,,"Dongguan Bidisco Electric CO., LTD",https://bidisco.en.made-in-china.com,,,,,,,,,,2025-08-12T13:01:11.358785,
hair dryer,Home Blue Negative IonHairSalon High PowerHairDryer,https://mktslkt-a.en.made-in-china.com/product/WtqpkscOwNVS/China-Home-Blue-Negative-Ion-Hair-Salon-High-Power-Hair-Dryer.html,WtqpkscOwNVS,WtqpkscOwNVS,4.0,USD,1000,,,,,,"Market Union Co., Ltd.",https://mktslkt-a.en.made-in-china.com,,,,,,,,,,2025-08-12T13:01:12.401955,
hair dryer,2025 Factory New Model Straightener Curler Hot Air Brush BlowDryerand 1300W High SpeedHairDryerBrush,https://baiyisen.en.made-in-china.com/product/QTEruWCyTnYR/China-2025-Factory-New-Model-Straightener-Curler-Hot-Air-Brush-Blow-Dryer-and-1300W-High-Speed-Hair-Dryer-Brush.html,QTEruWCyTnYR,QTEruWCyTnYR,30.0,USD,1000,,,,,,"Shenzhen Baiyisen Health Technology Co., Ltd.",https://baiyisen.en.made-in-china.com,,,,,,,,,,2025-08-12T13:01:13.024485,
hair dryer,High-Speed SalonHairDryerwith Lonic Feature and Concentrator Nozzle,https://rongheglobal.en.made-in-china.com/product/BaQpYorxRGUZ/China-High-Speed-Salon-Hair-Dryer-with-Lonic-Feature-and-Concentrator-Nozzle.html,BaQpYorxRGUZ,BaQpYorxRGUZ,12.0,USD,1000,,,,,,"Zhejiang Ronghe Industrial Co., Ltd.",https://rongheglobal.en.made-in-china.com,,,,,,,,,,2025-08-12T13:01:14.240483,
hair dryer,China Factory Direct High Quality 2000W Powerful Quick Dry High SpeedHairDryerIonic Professional Hammer Electric BlowerDryer,https://huipuhairdryer.en.made-in-china.com/product/NGwrhTZdEzWJ/China-China-Factory-Direct-High-Quality-2000W-Powerful-Quick-Dry-High-Speed-Hair-Dryer-Ionic-Professional-Hammer-Electric-Blower-Dryer.html,NGwrhTZdEzWJ,NGwrhTZdEzWJ,8.6,USD,1,,,,,,"Wenzhou Huipu Electrical Appliance Co., Ltd.",https://huipuhairdryer.en.made-in-china.com,,,,,,,,,,2025-08-12T13:01:14.805368,
hair dryer,Customizable Ionic Light 3-Shift ProfessionalHairDryerHot,https://3c5d389ced10cf96.en.made-in-china.com/product/ITlYKtLAFfhn/China-Customizable-Ionic-Light-3-Shift-Professional-Hair-Dryer-Hot.html,ITlYKtLAFfhn,ITlYKtLAFfhn,5.89,USD,200,,,,,,"Guangzhou Xinyang Electric Appliance Co., Ltd.",https://3c5d389ced10cf96.en.made-in-china.com,,,,,,,,,,2025-08-12T13:01:16.137823,
hair dryer,ABS Plastic Professional 1600WHairDryerfor Hotel,https://alumihk.en.made-in-china.com/product/qXHnNdCuEfYi/China-ABS-Plastic-Professional-1600W-Hair-Dryer-for-Hotel.html,qXHnNdCuEfYi,qXHnNdCuEfYi,10.0,USD,200,,,,,,"Alumi Industrial Co., Ltd.",https://alumihk.en.made-in-china.com,,,,,,,,,,2025-08-12T13:01:17.341565,
hair dryer,U TipHairExtensions Real HumanHairDark Brown UtipHairExtensions HumanHairfor Women 20 Inch Brown Ktip HumanHairExtensions Pre Bonded Soft Straight 50g,https://rebeccahairfactory.en.made-in-china.com/product/SQupgWsAILUx/China-U-Tip-Hair-Extensions-Real-Human-Hair-Dark-Brown-Utip-Hair-Extensions-Human-Hair-for-Women-20-Inch-Brown-Ktip-Human-Hair-Extensions-Pre-Bonded-Soft-Straight-50g.html,SQupgWsAILUx,SQupgWsAILUx,78.8,USD,1,,,,,,"Henan Rebecca Hair Products Co.,Ltd",https://rebeccahairfactory.en.made-in-china.com,,,,,,,,,,2025-08-12T13:01:21.885466,
hair dryer,22 Inch U TipHairExtensions Ombre U TipHairExtension HumanHairU TipHairExtension Brown U Tip HumanHairExtensions for Women,https://rebeccahairfactory.en.made-in-china.com/product/exLYgfyCsPpR/China-22-Inch-U-Tip-Hair-Extensions-Ombre-U-Tip-Hair-Extension-Human-Hair-U-Tip-Hair-Extension-Brown-U-Tip-Human-Hair-Extensions-for-Women.html,exLYgfyCsPpR,exLYgfyCsPpR,86.5,USD,1,,,,,,"Henan Rebecca Hair Products Co.,Ltd",https://rebeccahairfactory.en.made-in-china.com,,,,,,,,,,2025-08-12T13:01:22.413807,
hair dryer,Multiple Colors Silky Straight HumanHairTape inHairExtensions 18-22 InchHairExtensions Tape in Remy RealHair50 Gram Tape in Extensions,https://rebeccahairfactory.en.made-in-china.com/product/ldFfTEpGTPAx/China-Multiple-Colors-Silky-Straight-Human-Hair-Tape-in-Hair-Extensions-18-22-Inch-Hair-Extensions-Tape-in-Remy-Real-Hair-50-Gram-Tape-in-Extensions.html,ldFfTEpGTPAx,ldFfTEpGTPAx,37.0,USD,1,,,,,,"Henan Rebecca Hair Products Co.,Ltd",https://rebeccahairfactory.en.made-in-china.com,,,,,,,,,,2025-08-12T13:01:22.971296,
hair dryer,18 Inch U TipHairExtensions Medium Brown to Blonde U Tips HumanHairExtensions Highlight U TipHairExtensions HumanHairfor WomenHairExtensions,https://rebeccahairfactory.en.made-in-china.com/product/YENpBCFUZrRv/China-18-Inch-U-Tip-Hair-Extensions-Medium-Brown-to-Blonde-U-Tips-Human-Hair-Extensions-Highlight-U-Tip-Hair-Extensions-Human-Hair-for-Women-Hair-Extensions.html,YENpBCFUZrRv,YENpBCFUZrRv,49.9,USD,1,,,,,,"Henan Rebecca Hair Products Co.,Ltd",https://rebeccahairfactory.en.made-in-china.com,,,,,,,,,,2025-08-12T13:01:23.502068,
hair dryer,Factory High Quality Russian Seamless Clip inHairExtensions,https://shangkaihair.en.made-in-china.com/product/cChnvUEyEqWo/China-Factory-High-Quality-Russian-Seamless-Clip-in-Hair-Extensions.html,cChnvUEyEqWo,cChnvUEyEqWo,28.0,USD,1,,,,,,Juancheng Shangkai Hair Products,https://shangkaihair.en.made-in-china.com,,,,,,,,,,2025-08-12T13:01:24.887508,
hair dryer,AC Electrical/Electric Shaded Pole Motor for High Temperature Sterilizing Cabinet/Warm Air Blower,https://greatup.en.made-in-china.com/product/LvbEXZlcyNWq/China-AC-Electrical-Electric-Shaded-Pole-Motor-for-High-Temperature-Sterilizing-Cabinet-Warm-Air-Blower.html,LvbEXZlcyNWq,LvbEXZlcyNWq,2.8,USD,100,,,,,,RITSCHER INTERNATIONAL LIMITED,https://greatup.en.made-in-china.com,,,,,,,,,,2025-08-12T13:01:26.163305,
hair dryer,Russian RemyHairExtension Seamless Clips in HumanHairDouble Drawn Omber Color,https://shangkaihair.en.made-in-china.com/product/FNWEquQrXMcg/China-Russian-Remy-Hair-Extension-Seamless-Clips-in-Human-Hair-Double-Drawn-Omber-Color.html,FNWEquQrXMcg,FNWEquQrXMcg,28.0,USD,1,,,,,,Juancheng Shangkai Hair Products,https://shangkaihair.en.made-in-china.com,,,,,,,,,,2025-08-12T13:01:26.706168,
hair dryer,Ce Certification 24V 10000rpm 100W 200W PMDC Motor with Silicon Wire,https://greatup.en.made-in-china.com/product/xvanFoLOfZWH/China-Ce-Certification-24V-10000rpm-100W-200W-PMDC-Motor-with-Silicon-Wire.html,xvanFoLOfZWH,xvanFoLOfZWH,3.05,USD,1000,,,,,,RITSCHER INTERNATIONAL LIMITED,https://greatup.en.made-in-china.com,,,,,,,,,,2025-08-12T13:01:27.211213,
hair dryer,HumanHairWire Extensions with 4 Secure Clips 100g 22 Inch Straight Extensions Natural WireHairExtensions with Transparent Fish Line Invisible Extension,https://rebeccahairfactory.en.made-in-china.com/product/QnjrNzoVvUpT/China-Human-Hair-Wire-Extensions-with-4-Secure-Clips-100g-22-Inch-Straight-Extensions-Natural-Wire-Hair-Extensions-with-Transparent-Fish-Line-Invisible-Extension.html,QnjrNzoVvUpT,QnjrNzoVvUpT,73.3,USD,1,,,,,,"Henan Rebecca Hair Products Co.,Ltd",https://rebeccahairfactory.en.made-in-china.com,,,,,,,,,,2025-08-12T13:01:27.859148,
hair dryer,"20"" U TipHairExtensions HumanHairU Tip Multiple Colours Choose NaturalHairExtensions HumanHairTipHairExtensions for Women",https://rebeccahairfactory.en.made-in-china.com/product/VnzRwMZTbrUX/China-20-U-Tip-Hair-Extensions-Human-Hair-U-Tip-Multiple-Colours-Choose-Natural-Hair-Extensions-Human-Hair-Tip-Hair-Extensions-for-Women.html,VnzRwMZTbrUX,VnzRwMZTbrUX,65.1,USD,1,,,,,,"Henan Rebecca Hair Products Co.,Ltd",https://rebeccahairfactory.en.made-in-china.com,,,,,,,,,,2025-08-12T13:01:28.410503,
hair dryer,Wholesale Price Blonde Double Weft Brazilian HumanHairSeamless Clip inHairExtension,https://shangkaihair.en.made-in-china.com/product/KyhEJCGvEMkV/China-Wholesale-Price-Blonde-Double-Weft-Brazilian-Human-Hair-Seamless-Clip-in-Hair-Extension.html,KyhEJCGvEMkV,KyhEJCGvEMkV,28.0,USD,1,,,,,,Juancheng Shangkai Hair Products,https://shangkaihair.en.made-in-china.com,,,,,,,,,,2025-08-12T13:01:28.946599,
hair dryer,AC Electrical Manufacturers Evaporator Fan Electric Motor for Rotisserie,https://greatup.en.made-in-china.com/product/AsaEzywuAXke/China-AC-Electrical-Manufacturers-Evaporator-Fan-Electric-Motor-for-Rotisserie.html,AsaEzywuAXke,AsaEzywuAXke,1.2,USD,500,,,,,,RITSCHER INTERNATIONAL LIMITED,https://greatup.en.made-in-china.com,,,,,,,,,,2025-08-12T13:01:29.471729,
hair dryer,Seamless Clip inHairExtension Russian VirginHairClip HumanHairExtensions,https://shangkaihair.en.made-in-china.com/product/gshxqbEYnokZ/China-Seamless-Clip-in-Hair-Extension-Russian-Virgin-Hair-Clip-Human-Hair-Extensions.html,gshxqbEYnokZ,gshxqbEYnokZ,58.0,USD,1,,,,,,Juancheng Shangkai Hair Products,https://shangkaihair.en.made-in-china.com,,,,,,,,,,2025-08-12T13:01:30.030111,
hair dryer,"20"" Multiple Colours Tape inHairExtensions, Seamless Tape inHairExtensions Real HumanHairExtensions RemyHairTape inHairfor Women",https://rebeccahairfactory.en.made-in-china.com/product/WwOtfncuJLAP/China-20-Multiple-Colours-Tape-in-Hair-Extensions-Seamless-Tape-in-Hair-Extensions-Real-Human-Hair-Extensions-Remy-Hair-Tape-in-Hair-for-Women.html,WwOtfncuJLAP,WwOtfncuJLAP,42.5,USD,1,,,,,,"Henan Rebecca Hair Products Co.,Ltd",https://rebeccahairfactory.en.made-in-china.com,,,,,,,,,,2025-08-12T13:01:30.570350,
hair dryer,Long Life AC Electric Single-Phase Motor for Vacuum Fan Motor,https://greatup.en.made-in-china.com/product/hBaQLVConFcA/China-Long-Life-AC-Electric-Single-Phase-Motor-for-Vacuum-Fan-Motor.html,hBaQLVConFcA,hBaQLVConFcA,2.5,USD,800,,,,,,RITSCHER INTERNATIONAL LIMITED,https://greatup.en.made-in-china.com,,,,,,,,,,2025-08-12T13:01:31.115700,
hair dryer,Full Head Indian Remy HumanHairSeamless Clip inHairExtensions,https://shangkaihair.en.made-in-china.com/product/ljWEePQYgoki/China-Full-Head-Indian-Remy-Human-Hair-Seamless-Clip-in-Hair-Extensions.html,ljWEePQYgoki,ljWEePQYgoki,48.0,USD,1,,,,,,Juancheng Shangkai Hair Products,https://shangkaihair.en.made-in-china.com,,,,,,,,,,2025-08-12T13:01:31.669306,
hair dryer,AC Fan Electrical/Electric Shaded Pole Motor for Refrigerator/Range Hood/Air Purifier Motor,https://greatup.en.made-in-china.com/product/kyAQbHSuZKVz/China-AC-Fan-Electrical-Electric-Shaded-Pole-Motor-for-Refrigerator-Range-Hood-Air-Purifier-Motor.html,kyAQbHSuZKVz,kyAQbHSuZKVz,2.2,USD,500,,,,,,RITSCHER INTERNATIONAL LIMITED,https://greatup.en.made-in-china.com,,,,,,,,,,2025-08-12T13:01:32.231186,
hair dryer,Factory Price High Quality RussianHairSeamless Clip inHairExtensions,https://shangkaihair.en.made-in-china.com/product/FsWQbyEoMeck/China-Factory-Price-High-Quality-Russian-Hair-Seamless-Clip-in-Hair-Extensions.html,FsWQbyEoMeck,FsWQbyEoMeck,48.0,USD,1,,,,,,Juancheng Shangkai Hair Products,https://shangkaihair.en.made-in-china.com,,,,,,,,,,2025-08-12T13:01:32.776705,
hair dryer,Electric/Electrical Yj72 AC High Quality Shaded Pole Motor for Exhaust Fan Motor,https://greatup.en.made-in-china.com/product/NBqJMSlYLsWR/China-Electric-Electrical-Yj72-AC-High-Quality-Shaded-Pole-Motor-for-Exhaust-Fan-Motor.html,NBqJMSlYLsWR,NBqJMSlYLsWR,3.2,USD,1000,,,,,,RITSCHER INTERNATIONAL LIMITED,https://greatup.en.made-in-china.com,,,,,,,,,,2025-08-12T13:01:33.257434,
hair dryer,Virgin BrazilianHairSeamless Human RemyHairClip in Extensions,https://shangkaihair.en.made-in-china.com/product/qycJSOmCGbVF/China-Virgin-Brazilian-Hair-Seamless-Human-Remy-Hair-Clip-in-Extensions.html,qycJSOmCGbVF,qycJSOmCGbVF,58.0,USD,1,,,,,,Juancheng Shangkai Hair Products,https://shangkaihair.en.made-in-china.com,,,,,,,,,,2025-08-12T13:01:33.807440,
hair dryer,AC 3000rpm Gear Electric Motor for Hood Oven/Pump/Dry-Type Transformer/Forced Airflow Systems/Lubricant Pump,https://greatup.en.made-in-china.com/product/vXznRdoxYLVE/China-AC-3000rpm-Gear-Electric-Motor-for-Hood-Oven-Pump-Dry-Type-Transformer-Forced-Airflow-Systems-Lubricant-Pump.html,vXznRdoxYLVE,vXznRdoxYLVE,1.8,USD,1000,,,,,,RITSCHER INTERNATIONAL LIMITED,https://greatup.en.made-in-china.com,,,,,,,,,,2025-08-12T13:01:34.297410,
hair dryer,New Coming Finest RemyHairInvisible Seamless Clip inHairExtension HumanHair,https://shangkaihair.en.made-in-china.com/product/uCVQBjxTXqcH/China-New-Coming-Finest-Remy-Hair-Invisible-Seamless-Clip-in-Hair-Extension-Human-Hair.html,uCVQBjxTXqcH,uCVQBjxTXqcH,28.0,USD,1,,,,,,Juancheng Shangkai Hair Products,https://shangkaihair.en.made-in-china.com,,,,,,,,,,2025-08-12T13:01:34.832233,
hair dryer,Wholesale 100% Real Natural Virgin Best Seamless 100% Brazilian Remy Clip inHairExtension,https://shangkaihair.en.made-in-china.com/product/FycnSLxTCbWH/China-Wholesale-100-Real-Natural-Virgin-Best-Seamless-100-Brazilian-Remy-Clip-in-Hair-Extension.html,FycnSLxTCbWH,FycnSLxTCbWH,28.0,USD,1,,,,,,Juancheng Shangkai Hair Products,https://shangkaihair.en.made-in-china.com,,,,,,,,,,2025-08-12T13:01:35.375518,
hair dryer,High Quality PU Weft Seamless Clip on HumanHairExtension Russian RemyHair,https://shangkaihair.en.made-in-china.com/product/usWxeNJOkokS/China-High-Quality-PU-Weft-Seamless-Clip-on-Human-Hair-Extension-Russian-Remy-Hair.html,usWxeNJOkokS,usWxeNJOkokS,28.0,USD,1,,,,,,Juancheng Shangkai Hair Products,https://shangkaihair.en.made-in-china.com,,,,,,,,,,2025-08-12T13:01:35.904085,
hair dryer,Long Size Wholesale Price Soft and Silky 22-Inch U TipHairExtensions Remy U TipsHairExtensions Real HumanHairExtensions,https://rebeccahairfactory.en.made-in-china.com/product/kxlrgnJEWYpK/China-Long-Size-Wholesale-Price-Soft-and-Silky-22-Inch-U-Tip-Hair-Extensions-Remy-U-Tips-Hair-Extensions-Real-Human-Hair-Extensions.html,kxlrgnJEWYpK,kxlrgnJEWYpK,78.2,USD,1,,,,,,"Henan Rebecca Hair Products Co.,Ltd",https://rebeccahairfactory.en.made-in-china.com,,,,,,,,,,2025-08-12T13:01:36.520022,
hair dryer,Factory Direct Supply Wholesale Price PU Seamless Clip inHairExtensions,https://shangkaihair.en.made-in-china.com/product/JCkEbxmFHehc/China-Factory-Direct-Supply-Wholesale-Price-PU-Seamless-Clip-in-Hair-Extensions.html,JCkEbxmFHehc,JCkEbxmFHehc,38.0,USD,1,,,,,,Juancheng Shangkai Hair Products,https://shangkaihair.en.made-in-china.com,,,,,,,,,,2025-08-12T13:01:37.043572,
hair dryer,Virgin RemyHairInvisible Seamless Clip inHairExtension HumanHairfor Women,https://shangkaihair.en.made-in-china.com/product/BNcJbtmVAohj/China-Virgin-Remy-Hair-Invisible-Seamless-Clip-in-Hair-Extension-Human-Hair-for-Women.html,BNcJbtmVAohj,BNcJbtmVAohj,28.0,USD,1,,,,,,Juancheng Shangkai Hair Products,https://shangkaihair.en.made-in-china.com,,,,,,,,,,2025-08-12T13:01:37.577282,
hair dryer,Russian Cuticle RemyHairPU Seamless Clip in VirginHairExtensions,https://shangkaihair.en.made-in-china.com/product/XjWJMPnrZokv/China-Russian-Cuticle-Remy-Hair-PU-Seamless-Clip-in-Virgin-Hair-Extensions.html,XjWJMPnrZokv,XjWJMPnrZokv,28.0,USD,1,,,,,,Juancheng Shangkai Hair Products,https://shangkaihair.en.made-in-china.com,,,,,,,,,,2025-08-12T13:01:39.108605,
hair dryer,3 Secure Clips 18 Inch Invisible Wire Real HumanHairExtensions Transparent Wire Adjustable Size Multiple Colours Long Straight Secret Extension for Women,https://rebeccahairfactory.en.made-in-china.com/product/aQIpyexdVRrG/China-3-Secure-Clips-18-Inch-Invisible-Wire-Real-Human-Hair-Extensions-Transparent-Wire-Adjustable-Size-Multiple-Colours-Long-Straight-Secret-Extension-for-Women.html,aQIpyexdVRrG,aQIpyexdVRrG,44.1,USD,1,,,,,,"Henan Rebecca Hair Products Co.,Ltd",https://rebeccahairfactory.en.made-in-china.com,,,,,,,,,,2025-08-12T13:01:39.661163,
