keyword,title,listing_url,item_number,sku,price,currency,min_order_quantity,max_order_quantity,description,seller_name,seller_profile_url,seller_rating,seller_total_reviews,seller_business_name,seller_country,seller_address,seller_email,scraped_at,last_updated
hair dryer,Wholesale Blonde Ombre Color Balayage Color Russian Seamless Clip inHairExtension,https://shangkaihair.en.made-in-china.com/product/ACVnsvJxXocS/China-Wholesale-Blonde-Ombre-Color-Balayage-Color-Russian-Seamless-Clip-in-Hair-Extension.html,6704200000,,28.0,USD,1,,"Wholesale Blonde Ombre Color Balayage Color Russian Seamless Clip inHairExtensionUS$ 28-88/ Piece1 Piece(MOQ)Juancheng Shangkai Hair Products FactoryJuancheng Shangkai Hair Products FactoryDiamond MemberAudited SupplierSecured TradingShandong, ChinaManufacturer/Factory & Trading CompanyEnjoy trading protection from Made-in-China.comView larger video & image5(5.0)""Great Service""Great Service",Juancheng Shangkai Hair Products,https://shangkaihair.en.made-in-china.com,5.0,5.0,Factory & Trading Company,"Shandong, China","2nd Human Hair Industry,Juancheng, Heze",,2025-08-13T20:42:57.344492,
hair dryer,Full Head Indian Remy HumanHairSeamless Clip inHairExtensions,https://shangkaihair.en.made-in-china.com/product/ljWEePQYgoki/China-Full-Head-Indian-Remy-Human-Hair-Seamless-Clip-in-Hair-Extensions.html,6704200000,SK-Seamless,48.0,USD,1,,"Full Head Indian Remy HumanHairSeamless Clip inHairExtensionsUS$ 48-88/ Piece1 Piece(MOQ)Juancheng Shangkai Hair Products FactoryJuancheng Shangkai Hair Products FactoryDiamond MemberAudited SupplierSecured TradingShandong, ChinaManufacturer/Factory & Trading CompanyEnjoy trading protection from Made-in-China.comView larger video & image5(5.0)""Excellent Job""Excellent Job",Juancheng Shangkai Hair Products,https://shangkaihair.en.made-in-china.com,5.0,5.0,Factory & Trading Company,"Shandong, China","2nd Human Hair Industry,Juancheng, Heze",,2025-08-13T20:43:00.728503,
hair dryer,Italian Pasta Making Machine Macaroni Making Machine,https://sunward.en.made-in-china.com/product/usaQAKkdLjhC/China-Italian-Pasta-Making-Machine-Macaroni-Making-Machine.html,8438800000,EXT100,35000.0,USD,1,,"Italian Pasta Making Machine Macaroni Making MachineUS$ 35000/ Piece1 Piece(MOQ)Jinan Sunward Machinery Co., Ltd.Jinan Sunward Machinery Co., Ltd.Diamond MemberAudited SupplierSecured TradingShandong, ChinaManufacturer/Factory & Trading CompanyEnjoy trading protection from Made-in-China.comView larger video & image","Jinan Sunward Machinery Co., Ltd.",https://sunward.en.made-in-china.com,,,Jinan Sunward Machinery Co.,"Shandong, China","2504 Room, Shanxin Mansion, Huaiyin District",,2025-08-13T20:43:10.253159,
hair dryer,New Design Industrial Extruder Italy Pasta Macaroni Making Machine 100 Kg/H,https://sunward.en.made-in-china.com/product/rNTJfLVvCshj/China-New-Design-Industrial-Extruder-Italy-Pasta-Macaroni-Making-Machine-100-Kg-H.html,8438800000,EXT100,35000.0,USD,1,,"New Design Industrial Extruder Italy Pasta Macaroni Making Machine 100 Kg/HUS$ 35000/ Piece1 Piece(MOQ)Jinan Sunward Machinery Co., Ltd.Jinan Sunward Machinery Co., Ltd.Diamond MemberAudited SupplierSecured TradingShandong, ChinaManufacturer/Factory & Trading CompanyEnjoy trading protection from Made-in-China.comView larger video & image","Jinan Sunward Machinery Co., Ltd.",https://sunward.en.made-in-china.com,,,Jinan Sunward Machinery Co.,"Shandong, China","2504 Room, Shanxin Mansion, Huaiyin District",,2025-08-13T20:43:17.291290,
hair dryer,"High Quality Macaroni Machine, Pasta Making Machine, Macaroni Production Line Large Scale Commercial Pasta Extruder Machine Production Line",https://sunward.en.made-in-china.com/product/NCtxGcVKAyhL/China-High-Quality-Macaroni-Machine-Pasta-Making-Machine-Macaroni-Production-Line-Large-Scale-Commercial-Pasta-Extruder-Machine-Production-Line.html,8438800000,EXT100,32000.0,USD,1,,"High Quality Macaroni Machine, Pasta Making Machine, Macaroni Production Line Large Scale Commercial Pasta Extruder Machine Production LineUS$ 32000-35000/ Set1 Set(MOQ)Jinan Sunward Machinery Co., Ltd.Jinan Sunward Machinery Co., Ltd.Diamond MemberAudited SupplierSecured TradingShandong, ChinaManufacturer/Factory & Trading CompanyEnjoy trading protection from Made-in-China.comView larger video & image","Jinan Sunward Machinery Co., Ltd.",https://sunward.en.made-in-china.com,,,Jinan Sunward Machinery Co.,"Shandong, China","2504 Room, Shanxin Mansion, Huaiyin District",,2025-08-13T20:43:25.640817,
hair dryer,Italian Pasta Production Line Industrial Pasta Making Machine,https://sunward.en.made-in-china.com/product/gXMxPebuYkpT/China-Italian-Pasta-Production-Line-Industrial-Pasta-Making-Machine.html,8438800000,EXT100,35000.0,USD,1,,"Italian Pasta Production Line Industrial Pasta Making MachineUS$ 35000/ Piece1 Piece(MOQ)Jinan Sunward Machinery Co., Ltd.Jinan Sunward Machinery Co., Ltd.Diamond MemberAudited SupplierSecured TradingShandong, ChinaManufacturer/Factory & Trading CompanyEnjoy trading protection from Made-in-China.comView larger video & image","Jinan Sunward Machinery Co., Ltd.",https://sunward.en.made-in-china.com,,,Jinan Sunward Machinery Co.,"Shandong, China","2504 Room, Shanxin Mansion, Huaiyin District",,2025-08-13T20:43:31.596749,
hair dryer,Automatic Pasta Macaroni Machine Making Line Screw Fried Snack Pellets Food Machinery / Snack Pellet Processing Line / Pasta Macaroni Making Machine,https://sunward.en.made-in-china.com/product/uKqJgUeYqVrQ/China-Automatic-Pasta-Macaroni-Machine-Making-Line-Screw-Fried-Snack-Pellets-Food-Machinery-Snack-Pellet-Processing-Line-Pasta-Macaroni-Making-Machine.html,8438800000,Installed,35000.0,USD,1,,"Automatic Pasta Macaroni Machine Making Line Screw Fried Snack Pellets Food Machinery / Snack Pellet Processing Line / Pasta Macaroni Making MachineUS$ 35000/ Piece1 Piece(MOQ)Jinan Sunward Machinery Co., Ltd.Jinan Sunward Machinery Co., Ltd.Diamond MemberAudited SupplierSecured TradingShandong, ChinaManufacturer/Factory & Trading CompanyEnjoy trading protection from Made-in-China.comView larger video & image","Jinan Sunward Machinery Co., Ltd.",https://sunward.en.made-in-china.com,,,Jinan Sunward Machinery Co.,"Shandong, China","2504 Room, Shanxin Mansion, Huaiyin District",,2025-08-13T20:43:39.915982,
hair dryer,Easy Operate Pasta Macaroni Food Making Machinery,https://sunward.en.made-in-china.com/product/IsAnTRhVbCWK/China-Easy-Operate-Pasta-Macaroni-Food-Making-Machinery.html,8438800000,EXT100,35000.0,USD,1,,"Easy Operate Pasta Macaroni Food Making MachineryUS$ 35000/ Piece1 Piece(MOQ)Jinan Sunward Machinery Co., Ltd.Jinan Sunward Machinery Co., Ltd.Diamond MemberAudited SupplierSecured TradingShandong, ChinaManufacturer/Factory & Trading CompanyEnjoy trading protection from Made-in-China.comView larger video & image","Jinan Sunward Machinery Co., Ltd.",https://sunward.en.made-in-china.com,,,Jinan Sunward Machinery Co.,"Shandong, China","2504 Room, Shanxin Mansion, Huaiyin District",,2025-08-13T20:43:47.237525,
hair dryer,Industrial Macaroni Pasta Slanty Snack Pellet Chips Making Machine Production Line Big Capacity Macaroni Making Machine with Factory Quality,https://sunward.en.made-in-china.com/product/dOZAbKeucqpF/China-Industrial-Macaroni-Pasta-Slanty-Snack-Pellet-Chips-Making-Machine-Production-Line-Big-Capacity-Macaroni-Making-Machine-with-Factory-Quality.html,8438800000,Installed,35000.0,USD,1,,"Industrial Macaroni Pasta Slanty Snack Pellet Chips Making Machine Production Line Big Capacity Macaroni Making Machine with Factory QualityUS$ 35000/ Piece1 Piece(MOQ)Jinan Sunward Machinery Co., Ltd.Jinan Sunward Machinery Co., Ltd.Diamond MemberAudited SupplierSecured TradingShandong, ChinaManufacturer/Factory & Trading CompanyEnjoy trading protection from Made-in-China.comView larger video & image","Jinan Sunward Machinery Co., Ltd.",https://sunward.en.made-in-china.com,,,Jinan Sunward Machinery Co.,"Shandong, China","2504 Room, Shanxin Mansion, Huaiyin District",,2025-08-13T20:43:53.738863,
hair dryer,PortableHairWashing Sink and Chair Discount Barber Chairs,https://honglibeauty.en.made-in-china.com/product/GdaATkcOsfWm/China-Portable-Hair-Washing-Sink-and-Chair-Discount-Barber-Chairs.html,9402101000,31850-2-p3,264.0,USD,10,,"PortableHairWashing Sink and Chair Discount Barber ChairsUS$ 264-370/ Piece10 Pieces(MOQ)Wenling Hongli Barber & Beauty Co., Ltd.Wenling Hongli Barber & Beauty Co., Ltd.Zhejiang, China","Wenling Hongli Barber & Beauty Co., Ltd.",,,,,,,,2025-08-13T20:43:56.273837,
hair dryer,Styling Chairs SalonHairSalon Furniture Barber,https://honglibeauty.en.made-in-china.com/product/MdRaFlpAhzkL/China-Styling-Chairs-Salon-Hair-Salon-Furniture-Barber.html,9402101000,HL-31858-2-P3,258.0,USD,10,,"Styling Chairs SalonHairSalon Furniture BarberUS$ 258-360/ Piece10 Pieces(MOQ)Wenling Hongli Barber & Beauty Co., Ltd.Wenling Hongli Barber & Beauty Co., Ltd.Zhejiang, China","Wenling Hongli Barber & Beauty Co., Ltd.",,,,,,,,2025-08-13T20:43:58.984072,
hair dryer,Used Salon Styling Chairs for Sale Vintage Hairdressing Chair,https://honglibeauty.en.made-in-china.com/product/lFgTsocvMfWd/China-Used-Salon-Styling-Chairs-for-Sale-Vintage-Hairdressing-Chair.html,9402101000,31858-2-P3,258.0,USD,10,,"Used Salon Styling Chairs for Sale Vintage Hairdressing ChairUS$ 258-360/ Piece10 Pieces(MOQ)Wenling Hongli Barber & Beauty Co., Ltd.Wenling Hongli Barber & Beauty Co., Ltd.Zhejiang, China","Wenling Hongli Barber & Beauty Co., Ltd.",,,,,,,,2025-08-13T20:44:01.991064,
hair dryer,Reclining Salon Shampoo Chair Salon Classic Barber Chair,https://honglibeauty.en.made-in-china.com/product/EFpGRDHMOahV/China-Reclining-Salon-Shampoo-Chair-Salon-Classic-Barber-Chair.html,9402101000,31858-2-P3,258.0,USD,10,,"Reclining Salon Shampoo Chair Salon Classic Barber ChairUS$ 258-360/ Piece10 Pieces(MOQ)Wenling Hongli Barber & Beauty Co., Ltd.Wenling Hongli Barber & Beauty Co., Ltd.Zhejiang, China","Wenling Hongli Barber & Beauty Co., Ltd.",,,,,,,,2025-08-13T20:44:04.403437,
hair dryer,Beauty Parlour Furniture Price Low Makeup Salon Furniture,https://honglibeauty.en.made-in-china.com/product/VZAfGcKDgtWi/China-Beauty-Parlour-Furniture-Price-Low-Makeup-Salon-Furniture.html,9402101000,31858-2-P3,293.0,USD,10,,"Beauty Parlour Furniture Price Low Makeup Salon FurnitureUS$ 293-415/ Piece10 Pieces(MOQ)Wenling Hongli Barber & Beauty Co., Ltd.Wenling Hongli Barber & Beauty Co., Ltd.Zhejiang, China","Wenling Hongli Barber & Beauty Co., Ltd.",,,,,,,,2025-08-13T20:44:06.469596,
hair dryer,"(T4/27/P4) 20 Inch 7PCS 120g 16 Clips inHairExtensions, Chocolate Brown to Caramel Blonde RemyHairExtensions Clip inHairExtensions HumanHair",https://rebeccahairfactory.en.made-in-china.com/product/ZOoGwfMDrHtl/China-T4-27-P4-20-Inch-7PCS-120g-16-Clips-in-Hair-Extensions-Chocolate-Brown-to-Caramel-Blonde-Remy-Hair-Extensions-Clip-in-Hair-Extensions-Human-Hair.html,6704200000,CLIP,84.7,USD,1,,"(T4/27/P4) 20 Inch 7PCS 120g 16 Clips inHairExtensions, Chocolate Brown to Caramel Blonde RemyHairExtensions Clip inHairExtensions HumanHairUS$ 84.7-93.2/ Piece1 Piece(MOQ)Henan Rebecca Hair Products Co.,LtdHenan Rebecca Hair Products Co.,LtdDiamond MemberAudited SupplierSecured TradingHenan, ChinaManufacturer/Factory & Trading CompanyISO45001:2018Enjoy trading protection from Made-in-China.comView larger video & image5(4.9)""On-time Delivery""On-time Delivery","Henan Rebecca Hair Products Co.,Ltd",https://rebeccahairfactory.en.made-in-china.com,4.9,4.0,Henan Rebecca Hair Products Co.,"Henan, China","No. 666, Rebecca Road, Xuchang",,2025-08-13T20:44:14.272039,
hair dryer,Factory Price Brazilian Remy HumanHairP4/27 Highlight Transparent Lace Front Wig,https://elegant-hair.en.made-in-china.com/product/BtJUGXlvTnRE/China-Factory-Price-Brazilian-Remy-Human-Hair-P4-27-Highlight-Transparent-Lace-Front-Wig.html,6704200000,,40.0,USD,1,,"Factory Price Brazilian Remy HumanHairP4/27 Highlight Transparent Lace Front WigUS$ 40-186/ Piece1 Piece(MOQ)Xuchang Elegant Hair Products Co., Ltd.Xuchang Elegant Hair Products Co., Ltd.Diamond MemberAudited SupplierSecured TradingHenan, ChinaManufacturer/FactoryEnjoy trading protection from Made-in-China.comView larger video & image","Xuchang Elegant Hair Products Co., Ltd.",https://elegant-hair.en.made-in-china.com,,,,,,,2025-08-13T20:44:40.820693,
hair dryer,P4/27 Highlight Ombre Straight HumanHair13X4 13X6 Transparent Lace Front Wig,https://eleganthair.en.made-in-china.com/product/cKvEWmoTOxrq/China-P4-27-Highlight-Ombre-Straight-Human-Hair-13X4-13X6-Transparent-Lace-Front-Wig.html,,,45.6,USD,1,,"P4/27 Highlight Ombre Straight HumanHair13X4 13X6 Transparent Lace Front WigUS$ 45.6-189.8/ Piece1 Piece(MOQ)Changge Elegant Hair Products Co., Ltd.Changge Elegant Hair Products Co., Ltd.Diamond MemberAudited SupplierSecured TradingHenan, ChinaEnjoy trading protection from Made-in-China.comView larger video & image5(5.0)""Fast Delivery""Fast Delivery","Changge Elegant Hair Products Co., Ltd.",https://eleganthair.en.made-in-china.com,5.0,5.0,Changge Elegant Hair Products Co.,"Henan, China","Industrial Zone of Changge, Xuchang, Henan",,2025-08-13T20:44:45.748564,
hair dryer,Brazilian HumanHairHighlightP4/27 Bone Straight Swiss Lace Frontal Wigs,https://elegant-hair.en.made-in-china.com/product/QJFUdDkuEZYO/China-Brazilian-Human-Hair-Highlight-P4-27-Bone-Straight-Swiss-Lace-Frontal-Wigs.html,6704200000,highlight,48.3,USD,1,,"Brazilian HumanHairHighlightP4/27 Bone Straight Swiss Lace Frontal WigsUS$ 48.3-183.5/ Piece1 Piece(MOQ)Xuchang Elegant Hair Products Co., Ltd.Xuchang Elegant Hair Products Co., Ltd.Diamond MemberAudited SupplierSecured TradingHenan, ChinaManufacturer/FactoryEnjoy trading protection from Made-in-China.comView larger video & image","Xuchang Elegant Hair Products Co., Ltd.",https://elegant-hair.en.made-in-china.com,,,Changge Elegant Hair Products Co.,"Henan, China","Xuchang, Henan, China",,2025-08-13T20:44:50.395394,
hair dryer,Brazilian HumanHairHighlightP4/27 Deep Wave Curly Swiss Lace Frontal Wigs,https://elegant-hair.en.made-in-china.com/product/sxyRrqzTbdUW/China-Brazilian-Human-Hair-Highlight-P4-27-Deep-Wave-Curly-Swiss-Lace-Frontal-Wigs.html,6704200000,,49.0,USD,1,,"Brazilian HumanHairHighlightP4/27 Deep Wave Curly Swiss Lace Frontal WigsUS$ 49-182/ Piece1 Piece(MOQ)Xuchang Elegant Hair Products Co., Ltd.Xuchang Elegant Hair Products Co., Ltd.Diamond MemberAudited SupplierSecured TradingHenan, ChinaManufacturer/FactoryEnjoy trading protection from Made-in-China.comView larger video & image","Xuchang Elegant Hair Products Co., Ltd.",https://elegant-hair.en.made-in-china.com,,,Changge Elegant Hair Products Co.,"Henan, China","Xuchang, Henan, China",,2025-08-13T20:44:53.910158,
hair dryer,Wholesale Indian HumanHairHighlightP4/27 Body Wave 13X4 Lace Front Wigs,https://elegant-hair.en.made-in-china.com/product/znOUsxcAhdYe/China-Wholesale-Indian-Human-Hair-Highlight-P4-27-Body-Wave-13X4-Lace-Front-Wigs.html,6704200000,,56.5,USD,1,,"Wholesale Indian HumanHairHighlightP4/27 Body Wave 13X4 Lace Front WigsUS$ 56.5-206.8/ Piece1 Piece(MOQ)Xuchang Elegant Hair Products Co., Ltd.Xuchang Elegant Hair Products Co., Ltd.Diamond MemberAudited SupplierSecured TradingHenan, ChinaManufacturer/FactoryEnjoy trading protection from Made-in-China.comView larger video & image","Xuchang Elegant Hair Products Co., Ltd.",https://elegant-hair.en.made-in-china.com,,,Changge Elegant Hair Products Co.,"Henan, China","Xuchang, Henan, China",,2025-08-13T20:44:57.888016,
hair dryer,Wholesale Vietnamese HumanHairHighlightP4/27 Bone Straight 13X4 Lace Front Wig,https://elegant-hair.en.made-in-china.com/product/mQOYxDeCJwRE/China-Wholesale-Vietnamese-Human-Hair-Highlight-P4-27-Bone-Straight-13X4-Lace-Front-Wig.html,6704200000,highlight,49.5,USD,1,,"Wholesale Vietnamese HumanHairHighlightP4/27 Bone Straight 13X4 Lace Front WigUS$ 49.5-213.8/ Piece1 Piece(MOQ)Xuchang Elegant Hair Products Co., Ltd.Xuchang Elegant Hair Products Co., Ltd.Diamond MemberAudited SupplierSecured TradingHenan, ChinaManufacturer/FactoryEnjoy trading protection from Made-in-China.comView larger video & image","Xuchang Elegant Hair Products Co., Ltd.",https://elegant-hair.en.made-in-china.com,,,Changge Elegant Hair Products Co.,"Henan, China","Xuchang, Henan, China",,2025-08-13T20:45:01.250251,
hair dryer,Wholesale Vietnamese HumanHairHighlightP4/27 Deep Wave 13X4 Lace Front Wig,https://elegant-hair.en.made-in-china.com/product/QnyrRbgUgZpd/China-Wholesale-Vietnamese-Human-Hair-Highlight-P4-27-Deep-Wave-13X4-Lace-Front-Wig.html,6704200000,highlight,56.0,USD,1,,"Wholesale Vietnamese HumanHairHighlightP4/27 Deep Wave 13X4 Lace Front WigUS$ 56-221/ Piece1 Piece(MOQ)Xuchang Elegant Hair Products Co., Ltd.Xuchang Elegant Hair Products Co., Ltd.Diamond MemberAudited SupplierSecured TradingHenan, ChinaManufacturer/FactoryEnjoy trading protection from Made-in-China.comView larger video & image","Xuchang Elegant Hair Products Co., Ltd.",https://elegant-hair.en.made-in-china.com,,,Changge Elegant Hair Products Co.,"Henan, China","Xuchang, Henan, China",,2025-08-13T20:45:04.753882,
hair dryer,Body Wave 100% HumanHair4/27 Cuticle Aligned Virgin Lace Frontal Wig,https://eleganthair.en.made-in-china.com/product/PKYJAbxymQUt/China-Body-Wave-100-Human-Hair-4-27-Cuticle-Aligned-Virgin-Lace-Frontal-Wig.html,,,39.0,USD,1,,"Body Wave 100% HumanHair4/27 Cuticle Aligned Virgin Lace Frontal WigUS$ 39/ Piece1 Piece(MOQ)Changge Elegant Hair Products Co., Ltd.Changge Elegant Hair Products Co., Ltd.Diamond MemberAudited SupplierSecured TradingHenan, ChinaEnjoy trading protection from Made-in-China.comView larger video & image5(5.0)""On-time Delivery""On-time Delivery","Changge Elegant Hair Products Co., Ltd.",https://eleganthair.en.made-in-china.com,5.0,5.0,Changge Elegant Hair Products Co.,"Henan, China","Industrial Zone of Changge, Xuchang, Henan",,2025-08-13T20:45:08.464248,
hair dryer,150% Density Mixed Colors Straight HighlightP4/27 Lace Front HumanHairWig,https://elegant-hair.en.made-in-china.com/product/HatUMKXTIEYz/China-150-Density-Mixed-Colors-Straight-Highlight-P4-27-Lace-Front-Human-Hair-Wig.html,6704200000,highlight,63.0,USD,1,,"150% Density Mixed Colors Straight HighlightP4/27 Lace Front HumanHairWigUS$ 63-186/ Piece1 Piece(MOQ)Xuchang Elegant Hair Products Co., Ltd.Xuchang Elegant Hair Products Co., Ltd.Diamond MemberAudited SupplierSecured TradingHenan, ChinaManufacturer/FactoryEnjoy trading protection from Made-in-China.comView larger video & image","Xuchang Elegant Hair Products Co., Ltd.",https://elegant-hair.en.made-in-china.com,,,Changge Elegant Hair Products Co.,"Henan, China","Xuchang, Henan, China",,2025-08-13T20:45:12.341014,
hair dryer,"T4/27/P4, 22"" 120g, 7PCS 16 Clips HumanHairClip inHairExtensions, Caramel Blonde Clips inHairExtensions Remy HumanHairExtensions for Women",https://rebeccahairfactory.en.made-in-china.com/product/CwUAvlOdyHfM/China-T4-27-P4-22-120g-7PCS-16-Clips-Human-Hair-Clip-in-Hair-Extensions-Caramel-Blonde-Clips-in-Hair-Extensions-Remy-Human-Hair-Extensions-for-Women.html,6704200000,CLIP,99.6,USD,1,,"T4/27/P4, 22"" 120g, 7PCS 16 Clips HumanHairClip inHairExtensions, Caramel Blonde Clips inHairExtensions Remy HumanHairExtensions for WomenUS$ 99.6-109.6/ Piece1 Piece(MOQ)Henan Rebecca Hair Products Co.,LtdHenan Rebecca Hair Products Co.,LtdDiamond MemberAudited SupplierSecured TradingHenan, ChinaManufacturer/Factory & Trading CompanyISO45001:2018Enjoy trading protection from Made-in-China.comView larger video & image5(4.9)""Fast Dispatch""Fast Dispatch","Henan Rebecca Hair Products Co.,Ltd",https://rebeccahairfactory.en.made-in-china.com,4.9,4.0,Henan Rebecca Hair Products Co.,"Henan, China","No. 666, Rebecca Road, Xuchang",,2025-08-13T20:45:16.790025,
hair dryer,Wholesale Vietnamese HumanHairHighlightP4/27 Body Wave 13X4 Lace Front Wig,https://elegant-hair.en.made-in-china.com/product/CEjrpRMPbZYI/China-Wholesale-Vietnamese-Human-Hair-Highlight-P4-27-Body-Wave-13X4-Lace-Front-Wig.html,6704200000,nature,56.0,USD,1,,"Wholesale Vietnamese HumanHairHighlightP4/27 Body Wave 13X4 Lace Front WigUS$ 56-209/ Piece1 Piece(MOQ)Xuchang Elegant Hair Products Co., Ltd.Xuchang Elegant Hair Products Co., Ltd.Diamond MemberAudited SupplierSecured TradingHenan, ChinaManufacturer/FactoryEnjoy trading protection from Made-in-China.comView larger video & image","Xuchang Elegant Hair Products Co., Ltd.",https://elegant-hair.en.made-in-china.com,,,Changge Elegant Hair Products Co.,"Henan, China","Xuchang, Henan, China",,2025-08-13T20:45:20.629554,
hair dryer,"(T4/27/P4) 18 Inch 7PCS 16 Clips Real HumanHair, 100% HumanHair, 120g Natural Soft Straight Double Weft Clip in Extensions for Women",https://rebeccahairfactory.en.made-in-china.com/product/vwofukcdllAb/China-T4-27-P4-18-Inch-7PCS-16-Clips-Real-Human-Hair-100-Human-Hair-120g-Natural-Soft-Straight-Double-Weft-Clip-in-Extensions-for-Women.html,6704200000,CLIP,66.0,USD,1,,"(T4/27/P4) 18 Inch 7PCS 16 Clips Real HumanHair, 100% HumanHair, 120g Natural Soft Straight Double Weft Clip in Extensions for WomenUS$ 66-72.6/ Piece1 Piece(MOQ)Henan Rebecca Hair Products Co.,LtdHenan Rebecca Hair Products Co.,LtdDiamond MemberAudited SupplierSecured TradingHenan, ChinaManufacturer/Factory & Trading CompanyISO45001:2018Enjoy trading protection from Made-in-China.comView larger video & image5(4.9)""On-time Delivery""On-time Delivery","Henan Rebecca Hair Products Co.,Ltd",https://rebeccahairfactory.en.made-in-china.com,4.9,4.0,Henan Rebecca Hair Products Co.,"Henan, China","No. 666, Rebecca Road, Xuchang",,2025-08-13T20:45:25.074313,
hair dryer,Brazilian HumanHairHighlightP4/27 Body Wave Curly Swiss Lace Frontal Wigs,https://elegant-hair.en.made-in-china.com/product/ImCRfySvLdpK/China-Brazilian-Human-Hair-Highlight-P4-27-Body-Wave-Curly-Swiss-Lace-Frontal-Wigs.html,6704200000,,52.35,USD,1,,"Brazilian HumanHairHighlightP4/27 Body Wave Curly Swiss Lace Frontal WigsUS$ 52.35-186.43/ Piece1 Piece(MOQ)Xuchang Elegant Hair Products Co., Ltd.Xuchang Elegant Hair Products Co., Ltd.Diamond MemberAudited SupplierSecured TradingHenan, ChinaManufacturer/FactoryEnjoy trading protection from Made-in-China.comView larger video & image","Xuchang Elegant Hair Products Co., Ltd.",https://elegant-hair.en.made-in-china.com,,,Changge Elegant Hair Products Co.,"Henan, China","Xuchang, Henan, China",,2025-08-13T20:45:29.975954,
hair dryer,WholesalesP4/27 Bone Straight HumanHair13*6 HD Transparent Lace Front Wig,https://elegant-hair.en.made-in-china.com/product/nJyRfeDbhOpX/China-Wholesales-P4-27-Bone-Straight-Human-Hair-13-6-HD-Transparent-Lace-Front-Wig.html,6704200000,,54.3,USD,1,,"WholesalesP4/27 Bone Straight HumanHair13*6 HD Transparent Lace Front WigUS$ 54.3-185.2/ Piece1 Piece(MOQ)Xuchang Elegant Hair Products Co., Ltd.Xuchang Elegant Hair Products Co., Ltd.Diamond MemberAudited SupplierSecured TradingHenan, ChinaManufacturer/FactoryEnjoy trading protection from Made-in-China.comView larger video & image","Xuchang Elegant Hair Products Co., Ltd.",https://elegant-hair.en.made-in-china.com,,,Changge Elegant Hair Products Co.,"Henan, China","Xuchang, Henan, China",,2025-08-13T20:45:33.295879,
hair dryer,Wholesale VietnameseHairNatural Straight Highlight BrownP4/27 Transparent Lace Front Wig,https://elegant-hair.en.made-in-china.com/product/xJFRTCkEYdpo/China-Wholesale-Vietnamese-Hair-Natural-Straight-Highlight-Brown-P4-27-Transparent-Lace-Front-Wig.html,6704200000,highlight,36.0,USD,1,,"Wholesale VietnameseHairNatural Straight Highlight BrownP4/27 Transparent Lace Front WigUS$ 36/ Piece1 Piece(MOQ)Xuchang Elegant Hair Products Co., Ltd.Xuchang Elegant Hair Products Co., Ltd.Diamond MemberAudited SupplierSecured TradingHenan, ChinaManufacturer/FactoryEnjoy trading protection from Made-in-China.comView larger video & image","Xuchang Elegant Hair Products Co., Ltd.",https://elegant-hair.en.made-in-china.com,,,Changge Elegant Hair Products Co.,"Henan, China","Xuchang, Henan, China",,2025-08-13T20:45:36.797512,
hair dryer,Wholesale VietnameseHairBody Wave HighlightP4/27 Transparent Lace Front Wig,https://elegant-hair.en.made-in-china.com/product/gmdYlUechFRP/China-Wholesale-Vietnamese-Hair-Body-Wave-Highlight-P4-27-Transparent-Lace-Front-Wig.html,6704200000,,56.5,USD,1,,"Wholesale VietnameseHairBody Wave HighlightP4/27 Transparent Lace Front WigUS$ 56.5-213.8/ Piece1 Piece(MOQ)Xuchang Elegant Hair Products Co., Ltd.Xuchang Elegant Hair Products Co., Ltd.Diamond MemberAudited SupplierSecured TradingHenan, ChinaManufacturer/FactoryEnjoy trading protection from Made-in-China.comView larger video & image","Xuchang Elegant Hair Products Co., Ltd.",https://elegant-hair.en.made-in-china.com,,,Changge Elegant Hair Products Co.,"Henan, China","Xuchang, Henan, China",,2025-08-13T20:45:42.274650,
hair dryer,Wholesale VietnameseHairBody Wave Highlight BrownP4/27 Transparent Lace Front Wig,https://elegant-hair.en.made-in-china.com/product/BnNRhpqECwrK/China-Wholesale-Vietnamese-Hair-Body-Wave-Highlight-Brown-P4-27-Transparent-Lace-Front-Wig.html,6704200000,,56.0,USD,1,,"Wholesale VietnameseHairBody Wave Highlight BrownP4/27 Transparent Lace Front WigUS$ 56-206/ Piece1 Piece(MOQ)Xuchang Elegant Hair Products Co., Ltd.Xuchang Elegant Hair Products Co., Ltd.Diamond MemberAudited SupplierSecured TradingHenan, ChinaManufacturer/FactoryEnjoy trading protection from Made-in-China.comView larger video & image","Xuchang Elegant Hair Products Co., Ltd.",https://elegant-hair.en.made-in-china.com,,,Changge Elegant Hair Products Co.,"Henan, China","Xuchang, Henan, China",,2025-08-13T20:45:45.965078,
