keyword,title,listing_url,item_number,sku,price,currency,min_order_quantity,max_order_quantity,units_available,brand,category,description,seller_name,seller_profile_url,seller_rating,seller_total_reviews,seller_email,seller_business_name,seller_country,seller_state_province,seller_zip_code,seller_phone,seller_address,scraped_at,last_updated
hair dryer,ABS Materials Wall-Mounted HotelHairDryer,https://wontry.en.made-in-china.com/product/djWQeBGUZTkh/China-ABS-Materials-Wall-Mounted-Hotel-Hair-Dryer.html,djWQeBGUZTkh,djWQeBGUZTkh,11.0,USD,,,,,,,"Wenzhou Won-Try Electric Appliance Co., Ltd.",https://wontry.en.made-in-china.com,,,,,,,,,,2025-08-12T12:23:55.791969,
hair dryer,Ionic Technology Ultra-Fast Drying Magnetic AttachmentsHairDryer,https://cy-electronic.en.made-in-china.com/product/NEqrHibTYwUQ/China-Ionic-Technology-Ultra-Fast-Drying-Magnetic-Attachments-Hair-Dryer.html,NEqrHibTYwUQ,NEqrHibTYwUQ,36.0,USD,,,,,,,"Chaozhou Chengying Technology Co., Ltd",https://cy-electronic.en.made-in-china.com,,,,,,,,,,2025-08-12T12:23:55.801482,
hair dryer,China Manufacturers Professional Salon 2000W Negative Ionic BLDCHairDryerBrushless High Speed FoldableHairBlowDryer,https://huipuhairdryer.en.made-in-china.com/product/VtPrCQzoYlkh/China-China-Manufacturers-Professional-Salon-2000W-Negative-Ionic-BLDC-Hair-Dryer-Brushless-High-Speed-Foldable-Hair-Blow-Dryer.html,VtPrCQzoYlkh,VtPrCQzoYlkh,36.0,USD,,,,,,,"Wenzhou Huipu Electrical Appliance Co., Ltd.",https://huipuhairdryer.en.made-in-china.com,,,,,,,,,,2025-08-12T12:23:55.809660,
hair dryer,Bidisco Custom Private Label Ionic Negative Ion AnionHairDryersHigh Quality Professional BlowHairDryer,https://bidisco.en.made-in-china.com/product/DatrAHOoITWQ/China-Bidisco-Custom-Private-Label-Ionic-Negative-Ion-Anion-Hair-Dryers-High-Quality-Professional-Blow-Hair-Dryer.html,DatrAHOoITWQ,DatrAHOoITWQ,11.96,USD,,,,,,,"Dongguan Bidisco Electric CO., LTD",https://bidisco.en.made-in-china.com,,,,,,,,,,2025-08-12T12:23:55.819825,
hair dryer,Plasma AiHairDryerhigh PerformanceHairStraightener Constant Temperature Blowing Does Not Perm The Scalp HouseholdHairDryerProfessional Handheld Blow Dry,https://baiyisen.en.made-in-china.com/product/sRBYwtnKZmkN/China-Plasma-Ai-Hair-Dryerhigh-Performance-Hair-Straightener-Constant-Temperature-Blowing-Does-Not-Perm-The-Scalp-Household-Hair-Dryer-Professional-Handheld-Blow-Dry.html,sRBYwtnKZmkN,sRBYwtnKZmkN,30.0,USD,,,,,,,"Shenzhen Baiyisen Health Technology Co., Ltd.",https://baiyisen.en.made-in-china.com,,,,,,,,,,2025-08-12T12:23:55.828726,
hair dryer,High Quality Hot Selling Quick Drying 113000rpm Negative Ion ProfessionalHairDryer,https://dglizbella.en.made-in-china.com/product/aATrhPHDTLkU/China-High-Quality-Hot-Selling-Quick-Drying-113000rpm-Negative-Ion-Professional-Hair-Dryer.html,aATrhPHDTLkU,aATrhPHDTLkU,38.0,USD,,,,,,,"Dongguan Zhimi Electrical Technology Co., Ltd.",https://dglizbella.en.made-in-china.com,,,,,,,,,,2025-08-12T12:23:55.839248,
hair dryer,Wall-Mounted Handheld 2in1 Brushless High-SpeedHairDryerQuick-Drying SilentHairCare Home Hotel TravelHairDryer,https://fiyele.en.made-in-china.com/product/opqrYHcdhmVI/China-Wall-Mounted-Handheld-2in1-Brushless-High-Speed-Hair-Dryer-Quick-Drying-Silent-Hair-Care-Home-Hotel-Travel-Hair-Dryer.html,opqrYHcdhmVI,opqrYHcdhmVI,13.96,USD,,,,,,,"Yueqing Fiy Electric Co., Ltd.",https://fiyele.en.made-in-china.com,,,,,,,,,,2025-08-12T12:23:55.848779,
hair dryer,"Negative Ionic BlowDryerwith 110, 000 RpmHairDryer",https://mktslkt-a.en.made-in-china.com/product/sGqRTHVunCkK/China-Negative-Ionic-Blow-Dryer-with-110-000-Rpm-Hair-Dryer.html,sGqRTHVunCkK,sGqRTHVunCkK,6.0,USD,,,,,,,"Market Union Co., Ltd.",https://mktslkt-a.en.made-in-china.com,,,,,,,,,,2025-08-12T12:23:55.857807,
hair dryer,High Speed 110000rpm BrushlessHairDryerFast Hairdryer 20 Million Negative IonicHairDryerhair BlowDryerHigh Speed IonicHairDryerfor Professional Salon,https://baiyisen.en.made-in-china.com/product/hnBRxQLHVdUu/China-High-Speed-110000rpm-Brushless-Hair-Dryer-Fast-Hairdryer-20-Million-Negative-Ionic-Hair-Dryerhair-Blow-Dryer-High-Speed-Ionic-Hair-Dryer-for-Professional-Salon.html,hnBRxQLHVdUu,hnBRxQLHVdUu,31.0,USD,,,,,,,"Shenzhen Baiyisen Health Technology Co., Ltd.",https://baiyisen.en.made-in-china.com,,,,,,,,,,2025-08-12T12:23:55.867871,
hair dryer,Koofex Ionic 110000rpm BLDCHairDryerHigh Speed Brushless Motor BlowDryer,https://koofex.en.made-in-china.com/product/fAPUcXzxYoWd/China-Koofex-Ionic-110000rpm-BLDC-Hair-Dryer-High-Speed-Brushless-Motor-Blow-Dryer.html?ads_tp=&ads_id=vyBTXLqckPle,fAPUcXzxYoWd,fAPUcXzxYoWd,9.8,USD,,,,,,,"Guangzhou KooFex Appliances Co., Ltd.",https://koofex.en.made-in-china.com?ads_tp=&ads_id=vyBTXLqckPle,,,,,,,,,,2025-08-12T12:23:55.880601,
hair dryer,Salon High Speed Professional Anion LeaflessHairDryerwith Anti-Frizz Features Warranty,https://shanghaijinglang.en.made-in-china.com/product/LGjYEkMoYIhp/China-Salon-High-Speed-Professional-Anion-Leafless-Hair-Dryer-with-Anti-Frizz-Features-Warranty.html,LGjYEkMoYIhp,LGjYEkMoYIhp,15.0,USD,,,,,,,"Jinglang Electric Appliances (Shanghai) Co., Ltd.",https://shanghaijinglang.en.made-in-china.com,,,,,,,,,,2025-08-12T12:23:55.892751,
hair dryer,High Speed 110000 Rpm Brushless Negative IonHairDryer,https://bidisco.en.made-in-china.com/product/YxVrUdDObecp/China-High-Speed-110000-Rpm-Brushless-Negative-Ion-Hair-Dryer.html,YxVrUdDObecp,YxVrUdDObecp,29.3,USD,,,,,,,"Dongguan Bidisco Electric CO., LTD",https://bidisco.en.made-in-china.com,,,,,,,,,,2025-08-12T12:23:55.904854,
hair dryer,2024 Hot Selling Ionic Professional Salon LED Display ScreenHairBlowerDryerBLDC 2000W High Power 3 in 1 One StepHairDryer,https://huipuhairdryer.en.made-in-china.com/product/qAFrWZdlfLVJ/China-2024-Hot-Selling-Ionic-Professional-Salon-LED-Display-Screen-Hair-Blower-Dryer-BLDC-2000W-High-Power-3-in-1-One-Step-Hair-Dryer.html,qAFrWZdlfLVJ,qAFrWZdlfLVJ,37.0,USD,,,,,,,"Wenzhou Huipu Electrical Appliance Co., Ltd.",https://huipuhairdryer.en.made-in-china.com,,,,,,,,,,2025-08-12T12:23:55.914889,
hair dryer,Source Factoryhigh Speed 110000rpm High Speed Best HouseholdHairPattern Blow Dryer5 In1 Hot Air Brush Comb BlowDryerBrushhair Stylerfactory New Design BLDC,https://baiyisen.en.made-in-china.com/product/LtnRcvrVIJpB/China-Source-Factoryhigh-Speed-110000rpm-High-Speed-Best-Household-Hair-Pattern-Blow-Dryer5-In1-Hot-Air-Brush-Comb-Blow-Dryer-Brushhair-Stylerfactory-New-Design-BLDC.html,LtnRcvrVIJpB,LtnRcvrVIJpB,27.8,USD,,,,,,,"Shenzhen Baiyisen Health Technology Co., Ltd.",https://baiyisen.en.made-in-china.com,,,,,,,,,,2025-08-12T12:23:55.925212,
hair dryer,High Speed Constant Temperature Negative IonHairDryerProfessional Hammer Electric BlowerDryer,https://huipuhairdryer.en.made-in-china.com/product/EADYOxfTBHkQ/China-High-Speed-Constant-Temperature-Negative-Ion-Hair-Dryer-Professional-Hammer-Electric-Blower-Dryer.html,EADYOxfTBHkQ,EADYOxfTBHkQ,21.9,USD,,,,,,,"Wenzhou Huipu Electrical Appliance Co., Ltd.",https://huipuhairdryer.en.made-in-china.com,,,,,,,,,,2025-08-12T12:23:55.935729,
hair dryer,High Quality Professional Drayer DC MotorHairBlowDryer2000W Drayer BlowDryers,https://reputable-trading.en.made-in-china.com/product/MTRrptxEBukW/China-High-Quality-Professional-Drayer-DC-Motor-Hair-Blow-Dryer-2000W-Drayer-Blow-Dryers.html,MTRrptxEBukW,MTRrptxEBukW,7.86,USD,,,,,,,"Yiwu Reputable Trade Co., Ltd.",https://reputable-trading.en.made-in-china.com,,,,,,,,,,2025-08-12T12:23:55.943765,
hair dryer,Fast DryingHairCare Dsn HD15HairDryerHome Appliance Negative IonsDryer,https://himtop.en.made-in-china.com/product/pdjAniDyaHfx/China-Fast-Drying-Hair-Care-Dsn-HD15-Hair-Dryer-Home-Appliance-Negative-Ions-Dryer.html,pdjAniDyaHfx,pdjAniDyaHfx,55.0,USD,,,,,,,"Shenzhen Himtop Technology Co., Ltd.",https://himtop.en.made-in-china.com,,,,,,,,,,2025-08-12T12:23:55.954372,
hair dryer,"Curling Iron for Effortless Long-Lasting Curls 5-in-1 Curling IronHairDryerSet 110, 000 Rpm Silent Brushless Motor",https://baiyisen.en.made-in-china.com/product/NGAUsdnxIErz/China-Curling-Iron-for-Effortless-Long-Lasting-Curls-5-in-1-Curling-Iron-Hair-Dryer-Set-110-000-Rpm-Silent-Brushless-Motor.html,NGAUsdnxIErz,NGAUsdnxIErz,30.0,USD,,,,,,,"Shenzhen Baiyisen Health Technology Co., Ltd.",https://baiyisen.en.made-in-china.com,,,,,,,,,,2025-08-12T12:23:55.964886,
hair dryer,OEM Customized 1200W Professional Electric Ionic BlowHairDryer,https://bidisco.en.made-in-china.com/product/gwHfLGSyEshu/China-OEM-Customized-1200W-Professional-Electric-Ionic-Blow-Hair-Dryer.html,gwHfLGSyEshu,gwHfLGSyEshu,12.36,USD,,,,,,,"Dongguan Bidisco Electric CO., LTD",https://bidisco.en.made-in-china.com,,,,,,,,,,2025-08-12T12:23:55.975246,
hair dryer,Wholesale Adjustable Hot Cold Air Profession Hairdryer 2000W High Power Salon Negative Ionic Far Infrared TherapyHairDryer,https://huipuhairdryer.en.made-in-china.com/product/uakrzMOKAHWb/China-Wholesale-Adjustable-Hot-Cold-Air-Profession-Hairdryer-2000W-High-Power-Salon-Negative-Ionic-Far-Infrared-Therapy-Hair-Dryer.html,uakrzMOKAHWb,uakrzMOKAHWb,19.0,USD,,,,,,,"Wenzhou Huipu Electrical Appliance Co., Ltd.",https://huipuhairdryer.en.made-in-china.com,,,,,,,,,,2025-08-12T12:23:55.985772,
hair dryer,Lightweight Build 1600W Motor Cool Shot Function Negative Ion TechnologyHairDryer,https://cy-electronic.en.made-in-china.com/product/BmdRbXzcLFph/China-Lightweight-Build-1600W-Motor-Cool-Shot-Function-Negative-Ion-Technology-Hair-Dryer.html,BmdRbXzcLFph,BmdRbXzcLFph,36.0,USD,,,,,,,"Chaozhou Chengying Technology Co., Ltd",https://cy-electronic.en.made-in-china.com,,,,,,,,,,2025-08-12T12:23:55.995943,
hair dryer,High Quality Household High Speed Constant Temperature AnionHairDryer,https://shanghaijinglang.en.made-in-china.com/product/otyUFxVuhDWp/China-High-Quality-Household-High-Speed-Constant-Temperature-Anion-Hair-Dryer.html,otyUFxVuhDWp,otyUFxVuhDWp,20.0,USD,,,,,,,"Jinglang Electric Appliances (Shanghai) Co., Ltd.",https://shanghaijinglang.en.made-in-china.com,,,,,,,,,,2025-08-12T12:23:56.004454,
hair dryer,Custom OEM/ODM Cross-BorderHairDryerwith Brushless Motor - High-SpeedHairProtection Professional BlowDryer,https://muselect.en.made-in-china.com/product/LpARYUBosTWK/China-Custom-OEM-ODM-Cross-Border-Hair-Dryer-with-Brushless-Motor-High-Speed-Hair-Protection-Professional-Blow-Dryer.html,LpARYUBosTWK,LpARYUBosTWK,28.75,USD,,,,,,,Market Union Co. Ltd.,https://muselect.en.made-in-china.com,,,,,,,,,,2025-08-12T12:23:56.014976,
hair dryer,New-Style Fashionable 2023 Updated Diffuser 1800W Women Curly IonicHairDryer,https://goodseller-household.en.made-in-china.com/product/KEDpyGSLVxRA/China-New-Style-Fashionable-2023-Updated-Diffuser-1800W-Women-Curly-Ionic-Hair-Dryer.html,KEDpyGSLVxRA,KEDpyGSLVxRA,10.0,USD,,,,,,,"Good Seller Co., Ltd",https://goodseller-household.en.made-in-china.com,,,,,,,,,,2025-08-12T12:23:56.024489,
hair dryer,2025 Factory New Model Straightener Curler Hot Air Brush BlowDryerand 1300W High SpeedHairDryerBrush,https://baiyisen.en.made-in-china.com/product/QTEruWCyTnYR/China-2025-Factory-New-Model-Straightener-Curler-Hot-Air-Brush-Blow-Dryer-and-1300W-High-Speed-Hair-Dryer-Brush.html,QTEruWCyTnYR,QTEruWCyTnYR,30.0,USD,,,,,,,"Shenzhen Baiyisen Health Technology Co., Ltd.",https://baiyisen.en.made-in-china.com,,,,,,,,,,2025-08-12T12:23:56.033750,
hair dryer,High-Speed SalonHairDryerwith Lonic Feature and Concentrator Nozzle,https://rongheglobal.en.made-in-china.com/product/BaQpYorxRGUZ/China-High-Speed-Salon-Hair-Dryer-with-Lonic-Feature-and-Concentrator-Nozzle.html,BaQpYorxRGUZ,BaQpYorxRGUZ,12.0,USD,,,,,,,"Zhejiang Ronghe Industrial Co., Ltd.",https://rongheglobal.en.made-in-china.com,,,,,,,,,,2025-08-12T12:23:56.043972,
hair dryer,Home Blue Negative IonHairSalon High PowerHairDryer,https://mktslkt-a.en.made-in-china.com/product/WtqpkscOwNVS/China-Home-Blue-Negative-Ion-Hair-Salon-High-Power-Hair-Dryer.html,WtqpkscOwNVS,WtqpkscOwNVS,4.0,USD,,,,,,,"Market Union Co., Ltd.",https://mktslkt-a.en.made-in-china.com,,,,,,,,,,2025-08-12T12:23:56.053257,
hair dryer,Electrical Appliance HouseholdHairDryerWall-MountedHairDryer,https://wzhuipu.en.made-in-china.com/product/nsgxALUPvzVF/China-Electrical-Appliance-Household-Hair-Dryer-Wall-Mounted-Hair-Dryer.html,nsgxALUPvzVF,nsgxALUPvzVF,10.0,USD,,,,,,,"Wenzhou Huipu Electrical Appliance Co., Ltd.",https://wzhuipu.en.made-in-china.com,,,,,,,,,,2025-08-12T12:23:56.062515,
hair dryer,China Factory Direct High Quality 2000W Powerful Quick Dry High SpeedHairDryerIonic Professional Hammer Electric BlowerDryer,https://huipuhairdryer.en.made-in-china.com/product/NGwrhTZdEzWJ/China-China-Factory-Direct-High-Quality-2000W-Powerful-Quick-Dry-High-Speed-Hair-Dryer-Ionic-Professional-Hammer-Electric-Blower-Dryer.html,NGwrhTZdEzWJ,NGwrhTZdEzWJ,8.6,USD,,,,,,,"Wenzhou Huipu Electrical Appliance Co., Ltd.",https://huipuhairdryer.en.made-in-china.com,,,,,,,,,,2025-08-12T12:23:56.073147,
hair dryer,Customizable Ionic Light 3-Shift ProfessionalHairDryerHot,https://3c5d389ced10cf96.en.made-in-china.com/product/ITlYKtLAFfhn/China-Customizable-Ionic-Light-3-Shift-Professional-Hair-Dryer-Hot.html,ITlYKtLAFfhn,ITlYKtLAFfhn,5.89,USD,,,,,,,"Guangzhou Xinyang Electric Appliance Co., Ltd.",https://3c5d389ced10cf96.en.made-in-china.com,,,,,,,,,,2025-08-12T12:23:56.084664,
