keyword,title,listing_url,item_number,sku,price,currency,min_order_quantity,max_order_quantity,description,seller_name,seller_profile_url,seller_rating,seller_total_reviews,seller_business_name,seller_country,seller_address,seller_email,scraped_at,last_updated
hair dryer,22 Inch U TipHairExtensions Ombre U TipHairExtension HumanHairU TipHairExtension Brown U Tip HumanHairExtensions for Women,https://rebeccahairfactory.en.made-in-china.com/product/exLYgfyCsPpR/China-22-Inch-U-Tip-Hair-Extensions-Ombre-U-Tip-Hair-Extension-Human-Hair-U-Tip-Hair-Extension-Brown-U-Tip-Human-Hair-Extensions-for-Women.html,6704200000,,86.5,USD,1,,"22 Inch U TipHairExtensions Ombre U TipHairExtension HumanHairU TipHairExtension Brown U Tip HumanHairExtensions for WomenUS$ 86.5-102.1/ Piece1 Piece(MOQ)Henan Rebecca Hair Products Co.,LtdHenan Rebecca Hair Products Co.,LtdDiamond MemberAudited SupplierSecured TradingHenan, ChinaManufacturer/Factory & Trading CompanyISO45001:2018Enjoy trading protection from Made-in-China.comView larger video & image5(4.9)""On-time Delivery""On-time Delivery","Henan Rebecca Hair Products Co.,Ltd",https://rebeccahairfactory.en.made-in-china.com,4.9,4.0,Henan Rebecca Hair Products Co.,"Henan, China","No. 666, Rebecca Road, Xuchang",,2025-08-13T20:40:58.187319,
hair dryer,U TipHairExtensions Real HumanHairDark Brown UtipHairExtensions HumanHairfor Women 20 Inch Brown Ktip HumanHairExtensions Pre Bonded Soft Straight 50g,https://rebeccahairfactory.en.made-in-china.com/product/SQupgWsAILUx/China-U-Tip-Hair-Extensions-Real-Human-Hair-Dark-Brown-Utip-Hair-Extensions-Human-Hair-for-Women-20-Inch-Brown-Ktip-Human-Hair-Extensions-Pre-Bonded-Soft-Straight-50g.html,6704200000,,78.8,USD,1,,"U TipHairExtensions Real HumanHairDark Brown UtipHairExtensions HumanHairfor Women 20 Inch Brown Ktip HumanHairExtensions Pre Bonded Soft Straight 50gUS$ 78.8-86.7/ Piece1 Piece(MOQ)Henan Rebecca Hair Products Co.,LtdHenan Rebecca Hair Products Co.,LtdDiamond MemberAudited SupplierSecured TradingHenan, ChinaManufacturer/Factory & Trading CompanyISO45001:2018Enjoy trading protection from Made-in-China.comView larger video & image5(4.9)""On-time Delivery""On-time Delivery","Henan Rebecca Hair Products Co.,Ltd",https://rebeccahairfactory.en.made-in-china.com,4.9,4.0,Henan Rebecca Hair Products Co.,"Henan, China","No. 666, Rebecca Road, Xuchang",,2025-08-13T20:41:01.986347,
hair dryer,18 Inch U TipHairExtensions Medium Brown to Blonde U Tips HumanHairExtensions Highlight U TipHairExtensions HumanHairfor WomenHairExtensions,https://rebeccahairfactory.en.made-in-china.com/product/YENpBCFUZrRv/China-18-Inch-U-Tip-Hair-Extensions-Medium-Brown-to-Blonde-U-Tips-Human-Hair-Extensions-Highlight-U-Tip-Hair-Extensions-Human-Hair-for-Women-Hair-Extensions.html,6704200000,,49.9,USD,1,,"18 Inch U TipHairExtensions Medium Brown to Blonde U Tips HumanHairExtensions Highlight U TipHairExtensions HumanHairfor WomenHairExtensionsUS$ 49.9-54.9/ Piece1 Piece(MOQ)Henan Rebecca Hair Products Co.,LtdHenan Rebecca Hair Products Co.,LtdDiamond MemberAudited SupplierSecured TradingHenan, ChinaManufacturer/Factory & Trading CompanyISO45001:2018Enjoy trading protection from Made-in-China.comView larger video & image5(4.9)""On-time Delivery""On-time Delivery","Henan Rebecca Hair Products Co.,Ltd",https://rebeccahairfactory.en.made-in-china.com,4.9,4.0,Henan Rebecca Hair Products Co.,"Henan, China","No. 666, Rebecca Road, Xuchang",,2025-08-13T20:41:07.963868,
hair dryer,Multiple Colors Silky Straight HumanHairTape inHairExtensions 18-22 InchHairExtensions Tape in Remy RealHair50 Gram Tape in Extensions,https://rebeccahairfactory.en.made-in-china.com/product/ldFfTEpGTPAx/China-Multiple-Colors-Silky-Straight-Human-Hair-Tape-in-Hair-Extensions-18-22-Inch-Hair-Extensions-Tape-in-Remy-Real-Hair-50-Gram-Tape-in-Extensions.html,6704190000,18-22,37.0,USD,1,,"Multiple Colors Silky Straight HumanHairTape inHairExtensions 18-22 InchHairExtensions Tape in Remy RealHair50 Gram Tape in ExtensionsUS$ 37-54.5/ Piece1 Piece(MOQ)Henan Rebecca Hair Products Co.,LtdHenan Rebecca Hair Products Co.,LtdDiamond MemberAudited SupplierSecured TradingHenan, ChinaManufacturer/Factory & Trading CompanyISO45001:2018Enjoy trading protection from Made-in-China.comView larger video & image5(4.9)""Fast Delivery""Fast Delivery","Henan Rebecca Hair Products Co.,Ltd",https://rebeccahairfactory.en.made-in-china.com,4.9,4.0,Henan Rebecca Hair Products Co.,"Henan, China","No. 666, Rebecca Road, Xuchang",,2025-08-13T20:41:12.318114,
hair dryer,Electric/Electrical Yj72 AC High Quality Shaded Pole Motor for Exhaust Fan Motor,https://greatup.en.made-in-china.com/product/NBqJMSlYLsWR/China-Electric-Electrical-Yj72-AC-High-Quality-Shaded-Pole-Motor-for-Exhaust-Fan-Motor.html,8501109990,YJ72,3.2,USD,1000,,"Electric/Electrical Yj72 AC High Quality Shaded Pole Motor for Exhaust Fan MotorUS$ 3.2/ Piece1000 Pieces(MOQ)RITSCHER INTERNATIONAL LIMITEDRITSCHER INTERNATIONAL LIMITEDDiamond MemberAudited SupplierGuangdong, ChinaView larger video & image",RITSCHER INTERNATIONAL LIMITED,https://greatup.en.made-in-china.com,,,Ritscher group,"Guangdong, China","Dongfeng Town, Zhongshan City, Zhongshan",,2025-08-13T20:41:18.608569,
hair dryer,Russian Cuticle RemyHairPU Seamless Clip in VirginHairExtensions,https://shangkaihair.en.made-in-china.com/product/XjWJMPnrZokv/China-Russian-Cuticle-Remy-Hair-PU-Seamless-Clip-in-Virgin-Hair-Extensions.html,6704200000,,28.0,USD,1,,"Russian Cuticle RemyHairPU Seamless Clip in VirginHairExtensionsUS$ 28-88/ Piece1 Piece(MOQ)Juancheng Shangkai Hair Products FactoryJuancheng Shangkai Hair Products FactoryDiamond MemberAudited SupplierSecured TradingShandong, ChinaManufacturer/Factory & Trading CompanyEnjoy trading protection from Made-in-China.comView larger video & image5(5.0)""Amazing Service""Amazing Service",Juancheng Shangkai Hair Products,https://shangkaihair.en.made-in-china.com,5.0,5.0,Factory & Trading Company,"Shandong, China","2nd Human Hair Industry,Juancheng, Heze",,2025-08-13T20:41:23.318349,
hair dryer,Virgin RemyHairInvisible Seamless Clip inHairExtension HumanHairfor Women,https://shangkaihair.en.made-in-china.com/product/BNcJbtmVAohj/China-Virgin-Remy-Hair-Invisible-Seamless-Clip-in-Hair-Extension-Human-Hair-for-Women.html,6704200000,,28.0,USD,1,,"Virgin RemyHairInvisible Seamless Clip inHairExtension HumanHairfor WomenUS$ 28-88/ Piece1 Piece(MOQ)Juancheng Shangkai Hair Products FactoryJuancheng Shangkai Hair Products FactoryDiamond MemberAudited SupplierSecured TradingShandong, ChinaManufacturer/Factory & Trading CompanyEnjoy trading protection from Made-in-China.comView larger video & image5(5.0)""Excellent Job""Excellent Job",Juancheng Shangkai Hair Products,https://shangkaihair.en.made-in-china.com,5.0,5.0,Factory & Trading Company,"Shandong, China","2nd Human Hair Industry,Juancheng, Heze",,2025-08-13T20:41:27.068021,
hair dryer,AC 3000rpm Gear Electric Motor for Hood Oven/Pump/Dry-Type Transformer/Forced Airflow Systems/Lubricant Pump,https://greatup.en.made-in-china.com/product/vXznRdoxYLVE/China-AC-3000rpm-Gear-Electric-Motor-for-Hood-Oven-Pump-Dry-Type-Transformer-Forced-Airflow-Systems-Lubricant-Pump.html,8501109990,YJ72,1.8,USD,1000,,"AC 3000rpm Gear Electric Motor for Hood Oven/Pump/Dry-Type Transformer/Forced Airflow Systems/Lubricant PumpUS$ 1.8-2.5/ Piece1000 Pieces(MOQ)RITSCHER INTERNATIONAL LIMITEDRITSCHER INTERNATIONAL LIMITEDDiamond MemberAudited SupplierGuangdong, ChinaView larger video & image",RITSCHER INTERNATIONAL LIMITED,https://greatup.en.made-in-china.com,,,Ritscher group,"Guangdong, China","Dongfeng Town, Zhongshan City, Zhongshan",,2025-08-13T20:41:32.644535,
hair dryer,Virgin BrazilianHairSeamless Human RemyHairClip in Extensions,https://shangkaihair.en.made-in-china.com/product/qycJSOmCGbVF/China-Virgin-Brazilian-Hair-Seamless-Human-Remy-Hair-Clip-in-Extensions.html,6704200000,SK-Seamless,58.0,USD,1,,"Virgin BrazilianHairSeamless Human RemyHairClip in ExtensionsUS$ 58-128/ Piece1 Piece(MOQ)Juancheng Shangkai Hair Products FactoryJuancheng Shangkai Hair Products FactoryDiamond MemberAudited SupplierSecured TradingShandong, ChinaManufacturer/Factory & Trading CompanyEnjoy trading protection from Made-in-China.comView larger video & image5(5.0)""Awesome Customer Service""Awesome Customer Service",Juancheng Shangkai Hair Products,https://shangkaihair.en.made-in-china.com,5.0,5.0,Factory & Trading Company,"Shandong, China","2nd Human Hair Industry,Juancheng, Heze",,2025-08-13T20:41:38.811213,
hair dryer,Ce Certification 24V 10000rpm 100W 200W PMDC Motor with Silicon Wire,https://greatup.en.made-in-china.com/product/xvanFoLOfZWH/China-Ce-Certification-24V-10000rpm-100W-200W-PMDC-Motor-with-Silicon-Wire.html,8501109990,P34,3.05,USD,1000,,"Ce Certification 24V 10000rpm 100W 200W PMDC Motor with Silicon WireUS$ 3.05-3.78/ Piece1000 Pieces(MOQ)RITSCHER INTERNATIONAL LIMITEDRITSCHER INTERNATIONAL LIMITEDDiamond MemberAudited SupplierGuangdong, ChinaView larger video & image",RITSCHER INTERNATIONAL LIMITED,https://greatup.en.made-in-china.com,,,Ritscher group,"Guangdong, China","Dongfeng Town, Zhongshan City, Zhongshan",,2025-08-13T20:41:43.141795,
hair dryer,Wholesale 100% Real Natural Virgin Best Seamless 100% Brazilian Remy Clip inHairExtension,https://shangkaihair.en.made-in-china.com/product/FycnSLxTCbWH/China-Wholesale-100-Real-Natural-Virgin-Best-Seamless-100-Brazilian-Remy-Clip-in-Hair-Extension.html,6704200000,,28.0,USD,1,,"Wholesale 100% Real Natural Virgin Best Seamless 100% Brazilian Remy Clip inHairExtensionUS$ 28-88/ Piece1 Piece(MOQ)Juancheng Shangkai Hair Products FactoryJuancheng Shangkai Hair Products FactoryDiamond MemberAudited SupplierSecured TradingShandong, ChinaManufacturer/Factory & Trading CompanyEnjoy trading protection from Made-in-China.comView larger video & image5(5.0)""Great Customer Service""Great Customer Service",Juancheng Shangkai Hair Products,https://shangkaihair.en.made-in-china.com,5.0,5.0,Factory & Trading Company,"Shandong, China","2nd Human Hair Industry,Juancheng, Heze",,2025-08-13T20:41:46.769578,
hair dryer,Long Life AC Electric Single-Phase Motor for Vacuum Fan Motor,https://greatup.en.made-in-china.com/product/hBaQLVConFcA/China-Long-Life-AC-Electric-Single-Phase-Motor-for-Vacuum-Fan-Motor.html,8501109990,YJ72,2.5,USD,800,,"Long Life AC Electric Single-Phase Motor for Vacuum Fan MotorUS$ 2.5-3.8/ Piece800 Pieces(MOQ)RITSCHER INTERNATIONAL LIMITEDRITSCHER INTERNATIONAL LIMITEDDiamond MemberAudited SupplierGuangdong, ChinaView larger video & image",RITSCHER INTERNATIONAL LIMITED,https://greatup.en.made-in-china.com,,,Ritscher group,"Guangdong, China","Dongfeng Town, Zhongshan City, Zhongshan",,2025-08-13T20:41:51.185817,
hair dryer,"18"" Tape in HumanHairExtension Mutilple Colours Skin Weft 100% Human RemyHairAdhesive Natural Tape inHairExtensions for Women",https://rebeccahairfactory.en.made-in-china.com/product/SFYaZVfcZlTW/China-18-Tape-in-Human-Hair-Extension-Mutilple-Colours-Skin-Weft-100-Human-Remy-Hair-Adhesive-Natural-Tape-in-Hair-Extensions-for-Women.html,6704190000,Straight,33.6,USD,1,,"18"" Tape in HumanHairExtension Mutilple Colours Skin Weft 100% Human RemyHairAdhesive Natural Tape inHairExtensions for WomenUS$ 33.6-37/ Piece1 Piece(MOQ)Henan Rebecca Hair Products Co.,LtdHenan Rebecca Hair Products Co.,LtdDiamond MemberAudited SupplierSecured TradingHenan, ChinaManufacturer/Factory & Trading CompanyISO45001:2018Enjoy trading protection from Made-in-China.comView larger video & image5(4.9)""Fast Dispatch""Fast Dispatch","Henan Rebecca Hair Products Co.,Ltd",https://rebeccahairfactory.en.made-in-china.com,4.9,4.0,Henan Rebecca Hair Products Co.,"Henan, China","No. 666, Rebecca Road, Xuchang",,2025-08-13T20:41:54.379694,
hair dryer,New Coming Finest RemyHairInvisible Seamless Clip inHairExtension HumanHair,https://shangkaihair.en.made-in-china.com/product/uCVQBjxTXqcH/China-New-Coming-Finest-Remy-Hair-Invisible-Seamless-Clip-in-Hair-Extension-Human-Hair.html,6704200000,,28.0,USD,1,,"New Coming Finest RemyHairInvisible Seamless Clip inHairExtension HumanHairUS$ 28-88/ Piece1 Piece(MOQ)Juancheng Shangkai Hair Products FactoryJuancheng Shangkai Hair Products FactoryDiamond MemberAudited SupplierSecured TradingShandong, ChinaManufacturer/Factory & Trading CompanyEnjoy trading protection from Made-in-China.comView larger video & image5(5.0)""Awesome Customer Service""Awesome Customer Service",Juancheng Shangkai Hair Products,https://shangkaihair.en.made-in-china.com,5.0,5.0,Factory & Trading Company,"Shandong, China","2nd Human Hair Industry,Juancheng, Heze",,2025-08-13T20:42:00.338403,
hair dryer,"20"" Multiple Colours Tape inHairExtensions, Seamless Tape inHairExtensions Real HumanHairExtensions RemyHairTape inHairfor Women",https://rebeccahairfactory.en.made-in-china.com/product/WwOtfncuJLAP/China-20-Multiple-Colours-Tape-in-Hair-Extensions-Seamless-Tape-in-Hair-Extensions-Real-Human-Hair-Extensions-Remy-Hair-Tape-in-Hair-for-Women.html,6704190000,Straight,42.5,USD,1,,"20"" Multiple Colours Tape inHairExtensions, Seamless Tape inHairExtensions Real HumanHairExtensions RemyHairTape inHairfor WomenUS$ 42.5-46.8/ Piece1 Piece(MOQ)Henan Rebecca Hair Products Co.,LtdHenan Rebecca Hair Products Co.,LtdDiamond MemberAudited SupplierSecured TradingHenan, ChinaManufacturer/Factory & Trading CompanyISO45001:2018Enjoy trading protection from Made-in-China.comView larger video & image5(4.9)""Fast Dispatch""Fast Dispatch","Henan Rebecca Hair Products Co.,Ltd",https://rebeccahairfactory.en.made-in-china.com,4.9,4.0,Henan Rebecca Hair Products Co.,"Henan, China","No. 666, Rebecca Road, Xuchang",,2025-08-13T20:42:03.824510,
hair dryer,AC Electrical/Electric Shaded Pole Motor for High Temperature Sterilizing Cabinet/Warm Air Blower,https://greatup.en.made-in-china.com/product/LvbEXZlcyNWq/China-AC-Electrical-Electric-Shaded-Pole-Motor-for-High-Temperature-Sterilizing-Cabinet-Warm-Air-Blower.html,8501109990,yj72,2.8,USD,100,,"AC Electrical/Electric Shaded Pole Motor for High Temperature Sterilizing Cabinet/Warm Air BlowerUS$ 2.8/ Piece100 Pieces(MOQ)RITSCHER INTERNATIONAL LIMITEDRITSCHER INTERNATIONAL LIMITEDDiamond MemberAudited SupplierGuangdong, ChinaView larger video & image",RITSCHER INTERNATIONAL LIMITED,https://greatup.en.made-in-china.com,,,Ritscher group,"Guangdong, China","Dongfeng Town, Zhongshan City, Zhongshan",,2025-08-13T20:42:08.307473,
hair dryer,Wholesale Price Blonde Double Weft Brazilian HumanHairSeamless Clip inHairExtension,https://shangkaihair.en.made-in-china.com/product/KyhEJCGvEMkV/China-Wholesale-Price-Blonde-Double-Weft-Brazilian-Human-Hair-Seamless-Clip-in-Hair-Extension.html,6704200000,,28.0,USD,1,,"Wholesale Price Blonde Double Weft Brazilian HumanHairSeamless Clip inHairExtensionUS$ 28-88/ Piece1 Piece(MOQ)Juancheng Shangkai Hair Products FactoryJuancheng Shangkai Hair Products FactoryDiamond MemberAudited SupplierSecured TradingShandong, ChinaManufacturer/Factory & Trading CompanyEnjoy trading protection from Made-in-China.comView larger video & image5(5.0)""Helpful Service""Helpful Service",Juancheng Shangkai Hair Products,https://shangkaihair.en.made-in-china.com,5.0,5.0,Factory & Trading Company,"Shandong, China","2nd Human Hair Industry,Juancheng, Heze",,2025-08-13T20:42:12.713263,
hair dryer,3 Secure Clips 18 Inch Invisible Wire Real HumanHairExtensions Transparent Wire Adjustable Size Multiple Colours Long Straight Secret Extension for Women,https://rebeccahairfactory.en.made-in-china.com/product/aQIpyexdVRrG/China-3-Secure-Clips-18-Inch-Invisible-Wire-Real-Human-Hair-Extensions-Transparent-Wire-Adjustable-Size-Multiple-Colours-Long-Straight-Secret-Extension-for-Women.html,6704200000,FISH,44.1,USD,1,,"3 Secure Clips 18 Inch Invisible Wire Real HumanHairExtensions Transparent Wire Adjustable Size Multiple Colours Long Straight Secret Extension for WomenUS$ 44.1-58.1/ Piece1 Piece(MOQ)Henan Rebecca Hair Products Co.,LtdHenan Rebecca Hair Products Co.,LtdDiamond MemberAudited SupplierSecured TradingHenan, ChinaManufacturer/Factory & Trading CompanyISO45001:2018Enjoy trading protection from Made-in-China.comView larger video & image5(4.9)""Fast Delivery""Fast Delivery","Henan Rebecca Hair Products Co.,Ltd",https://rebeccahairfactory.en.made-in-china.com,4.9,4.0,Henan Rebecca Hair Products Co.,"Henan, China","No. 666, Rebecca Road, Xuchang",,2025-08-13T20:42:16.159451,
hair dryer,Long Size Wholesale Price Soft and Silky 22-Inch U TipHairExtensions Remy U TipsHairExtensions Real HumanHairExtensions,https://rebeccahairfactory.en.made-in-china.com/product/kxlrgnJEWYpK/China-Long-Size-Wholesale-Price-Soft-and-Silky-22-Inch-U-Tip-Hair-Extensions-Remy-U-Tips-Hair-Extensions-Real-Human-Hair-Extensions.html,6704200000,,78.2,USD,1,,"Long Size Wholesale Price Soft and Silky 22-Inch U TipHairExtensions Remy U TipsHairExtensions Real HumanHairExtensionsUS$ 78.2-102.1/ Piece1 Piece(MOQ)Henan Rebecca Hair Products Co.,LtdHenan Rebecca Hair Products Co.,LtdDiamond MemberAudited SupplierSecured TradingHenan, ChinaManufacturer/Factory & Trading CompanyISO45001:2018Enjoy trading protection from Made-in-China.comView larger video & image5(4.9)""Fast Delivery""Fast Delivery","Henan Rebecca Hair Products Co.,Ltd",https://rebeccahairfactory.en.made-in-china.com,4.9,4.0,Henan Rebecca Hair Products Co.,"Henan, China","No. 666, Rebecca Road, Xuchang",,2025-08-13T20:42:19.340000,
hair dryer,AC Electrical Manufacturers Evaporator Fan Electric Motor for Rotisserie,https://greatup.en.made-in-china.com/product/AsaEzywuAXke/China-AC-Electrical-Manufacturers-Evaporator-Fan-Electric-Motor-for-Rotisserie.html,8501109990,ISO9001,1.2,USD,500,,"AC Electrical Manufacturers Evaporator Fan Electric Motor for RotisserieUS$ 1.2-1.5/ Piece500 Pieces(MOQ)RITSCHER INTERNATIONAL LIMITEDRITSCHER INTERNATIONAL LIMITEDDiamond MemberAudited SupplierGuangdong, ChinaView larger video & image",RITSCHER INTERNATIONAL LIMITED,https://greatup.en.made-in-china.com,,,Ritscher group,"Guangdong, China","Dongfeng Town, Zhongshan City, Zhongshan",,2025-08-13T20:42:23.749061,
hair dryer,High-Quality 100g 20 Inch Wholesale Price InvisiableHairPieces HumanHairStraight Fish-Line Wire MicroHairExtension for Women,https://rebeccahairfactory.en.made-in-china.com/product/AxHpmCEborRG/China-High-Quality-100g-20-Inch-Wholesale-Price-Invisiable-Hair-Pieces-Human-Hair-Straight-Fish-Line-Wire-Micro-Hair-Extension-for-Women.html,6704200000,FISH,65.5,USD,1,,"High-Quality 100g 20 Inch Wholesale Price InvisiableHairPieces HumanHairStraight Fish-Line Wire MicroHairExtension for WomenUS$ 65.5-89.8/ Piece1 Piece(MOQ)Henan Rebecca Hair Products Co.,LtdHenan Rebecca Hair Products Co.,LtdDiamond MemberAudited SupplierSecured TradingHenan, ChinaManufacturer/Factory & Trading CompanyISO45001:2018Enjoy trading protection from Made-in-China.comView larger video & image5(4.9)""On-time Delivery""On-time Delivery","Henan Rebecca Hair Products Co.,Ltd",https://rebeccahairfactory.en.made-in-china.com,4.9,4.0,Henan Rebecca Hair Products Co.,"Henan, China","No. 666, Rebecca Road, Xuchang",,2025-08-13T20:42:26.943398,
hair dryer,"Brazilian HumanHairSeamless Clip inHairExtension for White Woman, AfroHairExtension Clip in Remy",https://shangkaihair.en.made-in-china.com/product/jsVmKDxTbbWU/China-Brazilian-Human-Hair-Seamless-Clip-in-Hair-Extension-for-White-Woman-Afro-Hair-Extension-Clip-in-Remy.html,6704200000,,28.0,USD,1,,"Brazilian HumanHairSeamless Clip inHairExtension for White Woman, AfroHairExtension Clip in RemyUS$ 28-88/ Piece1 Piece(MOQ)Juancheng Shangkai Hair Products FactoryJuancheng Shangkai Hair Products FactoryDiamond MemberAudited SupplierSecured TradingShandong, ChinaManufacturer/Factory & Trading CompanyEnjoy trading protection from Made-in-China.comView larger video & image5(5.0)""Fantastic Service""Fantastic Service",Juancheng Shangkai Hair Products,https://shangkaihair.en.made-in-china.com,5.0,5.0,Factory & Trading Company,"Shandong, China","2nd Human Hair Industry,Juancheng, Heze",,2025-08-13T20:42:30.149327,
hair dryer,50g/18 Inch U TipHairExtensions HumanHairMultiple ColoursHairExtensions Utip HumanHairExtensions U Tip HumanHairExtensions for Women Daily Use,https://rebeccahairfactory.en.made-in-china.com/product/UnurZJdTvRYB/China-50g-18-Inch-U-Tip-Hair-Extensions-Human-Hair-Multiple-Colours-Hair-Extensions-Utip-Human-Hair-Extensions-U-Tip-Human-Hair-Extensions-for-Women-Daily-Use.html,6704200000,,43.6,USD,1,,"50g/18 Inch U TipHairExtensions HumanHairMultiple ColoursHairExtensions Utip HumanHairExtensions U Tip HumanHairExtensions for Women Daily UseUS$ 43.6-54.9/ Piece1 Piece(MOQ)Henan Rebecca Hair Products Co.,LtdHenan Rebecca Hair Products Co.,LtdDiamond MemberAudited SupplierSecured TradingHenan, ChinaManufacturer/Factory & Trading CompanyISO45001:2018Enjoy trading protection from Made-in-China.comView larger video & image5(4.9)""On-time Delivery""On-time Delivery","Henan Rebecca Hair Products Co.,Ltd",https://rebeccahairfactory.en.made-in-china.com,4.9,4.0,Henan Rebecca Hair Products Co.,"Henan, China","No. 666, Rebecca Road, Xuchang",,2025-08-13T20:42:33.524049,
hair dryer,HumanHairWire Extensions with 4 Secure Clips 100g 22 Inch Straight Extensions Natural WireHairExtensions with Transparent Fish Line Invisible Extension,https://rebeccahairfactory.en.made-in-china.com/product/QnjrNzoVvUpT/China-Human-Hair-Wire-Extensions-with-4-Secure-Clips-100g-22-Inch-Straight-Extensions-Natural-Wire-Hair-Extensions-with-Transparent-Fish-Line-Invisible-Extension.html,6704200000,FISH,73.3,USD,1,,"HumanHairWire Extensions with 4 Secure Clips 100g 22 Inch Straight Extensions Natural WireHairExtensions with Transparent Fish Line Invisible ExtensionUS$ 73.3-105.3/ Piece1 Piece(MOQ)Henan Rebecca Hair Products Co.,LtdHenan Rebecca Hair Products Co.,LtdDiamond MemberAudited SupplierSecured TradingHenan, ChinaManufacturer/Factory & Trading CompanyISO45001:2018Enjoy trading protection from Made-in-China.comView larger video & image5(4.9)""On-time Delivery""On-time Delivery","Henan Rebecca Hair Products Co.,Ltd",https://rebeccahairfactory.en.made-in-china.com,4.9,4.0,Henan Rebecca Hair Products Co.,"Henan, China","No. 666, Rebecca Road, Xuchang",,2025-08-13T20:42:38.513824,
hair dryer,AC Fan Electrical/Electric Shaded Pole Motor for Refrigerator/Range Hood/Air Purifier Motor,https://greatup.en.made-in-china.com/product/kyAQbHSuZKVz/China-AC-Fan-Electrical-Electric-Shaded-Pole-Motor-for-Refrigerator-Range-Hood-Air-Purifier-Motor.html,8501109990,ISO9001,2.2,USD,500,,"AC Fan Electrical/Electric Shaded Pole Motor for Refrigerator/Range Hood/Air Purifier MotorUS$ 2.2-3.5/ Piece500 Pieces(MOQ)RITSCHER INTERNATIONAL LIMITEDRITSCHER INTERNATIONAL LIMITEDDiamond MemberAudited SupplierGuangdong, ChinaView larger video & image",RITSCHER INTERNATIONAL LIMITED,https://greatup.en.made-in-china.com,,,Ritscher group,"Guangdong, China","Dongfeng Town, Zhongshan City, Zhongshan",,2025-08-13T20:42:42.588546,
hair dryer,Top Quality Hot Selling Unprocessed 100% Human Virgin Remy Silk Straight Indian Seamless Clip inHairExtensions,https://shangkaihair.en.made-in-china.com/product/INWmvsQOkMkh/China-Top-Quality-Hot-Selling-Unprocessed-100-Human-Virgin-Remy-Silk-Straight-Indian-Seamless-Clip-in-Hair-Extensions.html,6704200000,,28.0,USD,1,,"Top Quality Hot Selling Unprocessed 100% Human Virgin Remy Silk Straight Indian Seamless Clip inHairExtensionsUS$ 28-88/ Piece1 Piece(MOQ)Juancheng Shangkai Hair Products FactoryJuancheng Shangkai Hair Products FactoryDiamond MemberAudited SupplierSecured TradingShandong, ChinaManufacturer/Factory & Trading CompanyEnjoy trading protection from Made-in-China.comView larger video & image5(5.0)""Excellent Service""Excellent Service",Juancheng Shangkai Hair Products,https://shangkaihair.en.made-in-china.com,5.0,5.0,Factory & Trading Company,"Shandong, China","2nd Human Hair Industry,Juancheng, Heze",,2025-08-13T20:42:46.406326,
hair dryer,New Arrival Hot Selling Double Drawn PU Seamless Clips inHairExtension,https://shangkaihair.en.made-in-china.com/product/GNcxCVnEsokm/China-New-Arrival-Hot-Selling-Double-Drawn-PU-Seamless-Clips-in-Hair-Extension.html,6704200000,,28.0,USD,1,,"New Arrival Hot Selling Double Drawn PU Seamless Clips inHairExtensionUS$ 28-88/ Piece1 Piece(MOQ)Juancheng Shangkai Hair Products FactoryJuancheng Shangkai Hair Products FactoryDiamond MemberAudited SupplierSecured TradingShandong, ChinaManufacturer/Factory & Trading CompanyEnjoy trading protection from Made-in-China.comView larger video & image5(5.0)""Amazing Service""Amazing Service",Juancheng Shangkai Hair Products,https://shangkaihair.en.made-in-china.com,5.0,5.0,Factory & Trading Company,"Shandong, China","2nd Human Hair Industry,Juancheng, Heze",,2025-08-13T20:42:49.962655,
hair dryer,Factory High Quality Russian Seamless Clip inHairExtensions,https://shangkaihair.en.made-in-china.com/product/cChnvUEyEqWo/China-Factory-High-Quality-Russian-Seamless-Clip-in-Hair-Extensions.html,6704200000,,28.0,USD,1,,"Factory High Quality Russian Seamless Clip inHairExtensionsUS$ 28-88/ Piece1 Piece(MOQ)Juancheng Shangkai Hair Products FactoryJuancheng Shangkai Hair Products FactoryDiamond MemberAudited SupplierSecured TradingShandong, ChinaManufacturer/Factory & Trading CompanyEnjoy trading protection from Made-in-China.comView larger video & image5(5.0)""Perfect Service""Perfect Service",Juancheng Shangkai Hair Products,https://shangkaihair.en.made-in-china.com,5.0,5.0,Factory & Trading Company,"Shandong, China","2nd Human Hair Industry,Juancheng, Heze",,2025-08-13T20:42:54.085796,
