keyword,title,listing_url,item_number,sku,price,currency,min_order_quantity,max_order_quantity,description,seller_name,seller_profile_url,seller_rating,seller_total_reviews,seller_business_name,seller_country,seller_address,scraped_at,last_updated
hair dryer,22 Inch U TipHairExtensions Ombre U TipHairExtension HumanHairU TipHairExtension Brown U Tip HumanHairExtensions for Women,https://rebeccahairfactory.en.made-in-china.com/product/exLYgfyCsPpR/China-22-Inch-U-Tip-Hair-Extensions-Ombre-U-Tip-Hair-Extension-Human-Hair-U-Tip-Hair-Extension-Brown-U-Tip-Human-Hair-Extensions-for-Women.html,exLYgfyCsPpR,exLYgfyCsPpR,86.5,USD,1,,"22 Inch U TipHairExtensions Ombre U TipHairExtension HumanHairU TipHairExtension Brown U Tip HumanHairExtensions for WomenUS$ 86.5-102.1/ Piece1 Piece(MOQ)Henan Rebecca Hair Products Co.,LtdHenan Rebecca Hair Products Co.,LtdDiamond MemberAudited SupplierSecured TradingHenan, ChinaManufacturer/Factory & Trading CompanyISO45001:2018Enjoy trading protection from Made-in-China.comView larger video & image5(4.9)""Fast Dispatch""Fast Dispatch","Henan Rebecca Hair Products Co.,Ltd",https://rebeccahairfactory.en.made-in-china.com,4.9,4.0,Henan Rebecca Hair Products Co.,"Henan, China","No. 666, Rebecca Road, Xuchang",2025-08-12T13:58:58.056740,
hair dryer,Multiple Colors Silky Straight HumanHairTape inHairExtensions 18-22 InchHairExtensions Tape in Remy RealHair50 Gram Tape in Extensions,https://rebeccahairfactory.en.made-in-china.com/product/ldFfTEpGTPAx/China-Multiple-Colors-Silky-Straight-Human-Hair-Tape-in-Hair-Extensions-18-22-Inch-Hair-Extensions-Tape-in-Remy-Real-Hair-50-Gram-Tape-in-Extensions.html,ldFfTEpGTPAx,ldFfTEpGTPAx,37.0,USD,1,,"Multiple Colors Silky Straight HumanHairTape inHairExtensions 18-22 InchHairExtensions Tape in Remy RealHair50 Gram Tape in ExtensionsUS$ 37-54.5/ Piece1 Piece(MOQ)Henan Rebecca Hair Products Co.,LtdHenan Rebecca Hair Products Co.,LtdDiamond MemberAudited SupplierSecured TradingHenan, ChinaManufacturer/Factory & Trading CompanyISO45001:2018Enjoy trading protection from Made-in-China.comView larger video & image5(4.9)""Fast Delivery""Fast Delivery","Henan Rebecca Hair Products Co.,Ltd",https://rebeccahairfactory.en.made-in-china.com,4.9,4.0,Henan Rebecca Hair Products Co.,"Henan, China","No. 666, Rebecca Road, Xuchang",2025-08-12T13:58:59.187214,
hair dryer,18 Inch U TipHairExtensions Medium Brown to Blonde U Tips HumanHairExtensions Highlight U TipHairExtensions HumanHairfor WomenHairExtensions,https://rebeccahairfactory.en.made-in-china.com/product/YENpBCFUZrRv/China-18-Inch-U-Tip-Hair-Extensions-Medium-Brown-to-Blonde-U-Tips-Human-Hair-Extensions-Highlight-U-Tip-Hair-Extensions-Human-Hair-for-Women-Hair-Extensions.html,YENpBCFUZrRv,YENpBCFUZrRv,49.9,USD,1,,"18 Inch U TipHairExtensions Medium Brown to Blonde U Tips HumanHairExtensions Highlight U TipHairExtensions HumanHairfor WomenHairExtensionsUS$ 49.9-54.9/ Piece1 Piece(MOQ)Henan Rebecca Hair Products Co.,LtdHenan Rebecca Hair Products Co.,LtdDiamond MemberAudited SupplierSecured TradingHenan, ChinaManufacturer/Factory & Trading CompanyISO45001:2018Enjoy trading protection from Made-in-China.comView larger video & image5(4.9)""Fast Delivery""Fast Delivery","Henan Rebecca Hair Products Co.,Ltd",https://rebeccahairfactory.en.made-in-china.com,4.9,4.0,Henan Rebecca Hair Products Co.,"Henan, China","No. 666, Rebecca Road, Xuchang",2025-08-12T13:59:00.389702,
hair dryer,U TipHairExtensions Real HumanHairDark Brown UtipHairExtensions HumanHairfor Women 20 Inch Brown Ktip HumanHairExtensions Pre Bonded Soft Straight 50g,https://rebeccahairfactory.en.made-in-china.com/product/SQupgWsAILUx/China-U-Tip-Hair-Extensions-Real-Human-Hair-Dark-Brown-Utip-Hair-Extensions-Human-Hair-for-Women-20-Inch-Brown-Ktip-Human-Hair-Extensions-Pre-Bonded-Soft-Straight-50g.html,SQupgWsAILUx,SQupgWsAILUx,78.8,USD,1,,"U TipHairExtensions Real HumanHairDark Brown UtipHairExtensions HumanHairfor Women 20 Inch Brown Ktip HumanHairExtensions Pre Bonded Soft Straight 50gUS$ 78.8-86.7/ Piece1 Piece(MOQ)Henan Rebecca Hair Products Co.,LtdHenan Rebecca Hair Products Co.,LtdDiamond MemberAudited SupplierSecured TradingHenan, ChinaManufacturer/Factory & Trading CompanyISO45001:2018Enjoy trading protection from Made-in-China.comView larger video & image5(4.9)""Fast Delivery""Fast Delivery","Henan Rebecca Hair Products Co.,Ltd",https://rebeccahairfactory.en.made-in-china.com,4.9,4.0,Henan Rebecca Hair Products Co.,"Henan, China","No. 666, Rebecca Road, Xuchang",2025-08-12T13:59:01.440869,
hair dryer,Factory Price High Quality RussianHairSeamless Clip inHairExtensions,https://shangkaihair.en.made-in-china.com/product/FsWQbyEoMeck/China-Factory-Price-High-Quality-Russian-Hair-Seamless-Clip-in-Hair-Extensions.html,FsWQbyEoMeck,FsWQbyEoMeck,48.0,USD,1,,"Factory Price High Quality RussianHairSeamless Clip inHairExtensionsUS$ 48-120/ Piece1 Piece(MOQ)Juancheng Shangkai Hair Products FactoryJuancheng Shangkai Hair Products FactoryDiamond MemberAudited SupplierSecured TradingShandong, ChinaManufacturer/Factory & Trading CompanyEnjoy trading protection from Made-in-China.comView larger video & image5(5.0)""Helpful Service""Helpful Service",Juancheng Shangkai Hair Products,https://shangkaihair.en.made-in-china.com,5.0,5.0,Factory & Trading Company,"Shandong, China","2nd Human Hair Industry,Juancheng, Heze",2025-08-12T13:59:03.489331,
hair dryer,Ce Certification 24V 10000rpm 100W 200W PMDC Motor with Silicon Wire,https://greatup.en.made-in-china.com/product/xvanFoLOfZWH/China-Ce-Certification-24V-10000rpm-100W-200W-PMDC-Motor-with-Silicon-Wire.html,xvanFoLOfZWH,xvanFoLOfZWH,3.05,USD,1000,,"Ce Certification 24V 10000rpm 100W 200W PMDC Motor with Silicon WireUS$ 3.05-3.78/ Piece1000 Pieces(MOQ)RITSCHER INTERNATIONAL LIMITEDRITSCHER INTERNATIONAL LIMITEDDiamond MemberAudited SupplierGuangdong, ChinaView larger video & image",RITSCHER INTERNATIONAL LIMITED,https://greatup.en.made-in-china.com,,,Ritscher group,"Guangdong, China","Dongfeng Town, Zhongshan City, Zhongshan",2025-08-12T13:59:05.258368,
hair dryer,Seamless Clip inHairExtension Russian VirginHairClip HumanHairExtensions,https://shangkaihair.en.made-in-china.com/product/gshxqbEYnokZ/China-Seamless-Clip-in-Hair-Extension-Russian-Virgin-Hair-Clip-Human-Hair-Extensions.html,gshxqbEYnokZ,gshxqbEYnokZ,58.0,USD,1,,"Seamless Clip inHairExtension Russian VirginHairClip HumanHairExtensionsUS$ 58-128/ Piece1 Piece(MOQ)Juancheng Shangkai Hair Products FactoryJuancheng Shangkai Hair Products FactoryDiamond MemberAudited SupplierSecured TradingShandong, ChinaManufacturer/Factory & Trading CompanyEnjoy trading protection from Made-in-China.comView larger video & image5(5.0)""Awesome Customer Service""Awesome Customer Service",Juancheng Shangkai Hair Products,https://shangkaihair.en.made-in-china.com,5.0,5.0,Factory & Trading Company,"Shandong, China","2nd Human Hair Industry,Juancheng, Heze",2025-08-12T13:59:06.418897,
hair dryer,HumanHairWire Extensions with 4 Secure Clips 100g 22 Inch Straight Extensions Natural WireHairExtensions with Transparent Fish Line Invisible Extension,https://rebeccahairfactory.en.made-in-china.com/product/QnjrNzoVvUpT/China-Human-Hair-Wire-Extensions-with-4-Secure-Clips-100g-22-Inch-Straight-Extensions-Natural-Wire-Hair-Extensions-with-Transparent-Fish-Line-Invisible-Extension.html,QnjrNzoVvUpT,QnjrNzoVvUpT,73.3,USD,1,,"HumanHairWire Extensions with 4 Secure Clips 100g 22 Inch Straight Extensions Natural WireHairExtensions with Transparent Fish Line Invisible ExtensionUS$ 73.3-105.3/ Piece1 Piece(MOQ)Henan Rebecca Hair Products Co.,LtdHenan Rebecca Hair Products Co.,LtdDiamond MemberAudited SupplierSecured TradingHenan, ChinaManufacturer/Factory & Trading CompanyISO45001:2018Enjoy trading protection from Made-in-China.comView larger video & image5(4.9)""Fast Dispatch""Fast Dispatch","Henan Rebecca Hair Products Co.,Ltd",https://rebeccahairfactory.en.made-in-china.com,4.9,4.0,Henan Rebecca Hair Products Co.,"Henan, China","No. 666, Rebecca Road, Xuchang",2025-08-12T13:59:07.321953,
hair dryer,"22"" Blonde Colours Tape in StraightHairExtensions Remy HumanHairExtensions Natural Seamless Skin Wef Invisible Tape inHairExtensions",https://rebeccahairfactory.en.made-in-china.com/product/GZwaIRcdZgAW/China-22-Blonde-Colours-Tape-in-Straight-Hair-Extensions-Remy-Human-Hair-Extensions-Natural-Seamless-Skin-Wef-Invisible-Tape-in-Hair-Extensions.html,GZwaIRcdZgAW,GZwaIRcdZgAW,49.5,USD,1,,"22"" Blonde Colours Tape in StraightHairExtensions Remy HumanHairExtensions Natural Seamless Skin Wef Invisible Tape inHairExtensionsUS$ 49.5-54.5/ Piece1 Piece(MOQ)Henan Rebecca Hair Products Co.,LtdHenan Rebecca Hair Products Co.,LtdDiamond MemberAudited SupplierSecured TradingHenan, ChinaManufacturer/Factory & Trading CompanyISO45001:2018Enjoy trading protection from Made-in-China.comView larger video & image5(4.9)""Fast Dispatch""Fast Dispatch","Henan Rebecca Hair Products Co.,Ltd",https://rebeccahairfactory.en.made-in-china.com,4.9,4.0,Henan Rebecca Hair Products Co.,"Henan, China","No. 666, Rebecca Road, Xuchang",2025-08-12T13:59:08.171687,
hair dryer,AC Fan Electrical/Electric Shaded Pole Motor for Refrigerator/Range Hood/Air Purifier Motor,https://greatup.en.made-in-china.com/product/kyAQbHSuZKVz/China-AC-Fan-Electrical-Electric-Shaded-Pole-Motor-for-Refrigerator-Range-Hood-Air-Purifier-Motor.html,kyAQbHSuZKVz,kyAQbHSuZKVz,2.2,USD,500,,"AC Fan Electrical/Electric Shaded Pole Motor for Refrigerator/Range Hood/Air Purifier MotorUS$ 2.2-3.5/ Piece500 Pieces(MOQ)RITSCHER INTERNATIONAL LIMITEDRITSCHER INTERNATIONAL LIMITEDDiamond MemberAudited SupplierGuangdong, ChinaView larger video & image",RITSCHER INTERNATIONAL LIMITED,https://greatup.en.made-in-china.com,,,Ritscher group,"Guangdong, China","Dongfeng Town, Zhongshan City, Zhongshan",2025-08-12T13:59:09.107174,
hair dryer,Virgin RemyHairInvisible Seamless Clip inHairExtension HumanHairfor Women,https://shangkaihair.en.made-in-china.com/product/BNcJbtmVAohj/China-Virgin-Remy-Hair-Invisible-Seamless-Clip-in-Hair-Extension-Human-Hair-for-Women.html,BNcJbtmVAohj,BNcJbtmVAohj,28.0,USD,1,,"Virgin RemyHairInvisible Seamless Clip inHairExtension HumanHairfor WomenUS$ 28-88/ Piece1 Piece(MOQ)Juancheng Shangkai Hair Products FactoryJuancheng Shangkai Hair Products FactoryDiamond MemberAudited SupplierSecured TradingShandong, ChinaManufacturer/Factory & Trading CompanyEnjoy trading protection from Made-in-China.comView larger video & image5(5.0)""Fantastic Service""Fantastic Service",Juancheng Shangkai Hair Products,https://shangkaihair.en.made-in-china.com,5.0,5.0,Factory & Trading Company,"Shandong, China","2nd Human Hair Industry,Juancheng, Heze",2025-08-12T13:59:10.116816,
hair dryer,"18"" Tape in HumanHairExtension Mutilple Colours Skin Weft 100% Human RemyHairAdhesive Natural Tape inHairExtensions for Women",https://rebeccahairfactory.en.made-in-china.com/product/SFYaZVfcZlTW/China-18-Tape-in-Human-Hair-Extension-Mutilple-Colours-Skin-Weft-100-Human-Remy-Hair-Adhesive-Natural-Tape-in-Hair-Extensions-for-Women.html,SFYaZVfcZlTW,SFYaZVfcZlTW,33.6,USD,1,,"18"" Tape in HumanHairExtension Mutilple Colours Skin Weft 100% Human RemyHairAdhesive Natural Tape inHairExtensions for WomenUS$ 33.6-37/ Piece1 Piece(MOQ)Henan Rebecca Hair Products Co.,LtdHenan Rebecca Hair Products Co.,LtdDiamond MemberAudited SupplierSecured TradingHenan, ChinaManufacturer/Factory & Trading CompanyISO45001:2018Enjoy trading protection from Made-in-China.comView larger video & image5(4.9)""Fast Dispatch""Fast Dispatch","Henan Rebecca Hair Products Co.,Ltd",https://rebeccahairfactory.en.made-in-china.com,4.9,4.0,Henan Rebecca Hair Products Co.,"Henan, China","No. 666, Rebecca Road, Xuchang",2025-08-12T13:59:11.082823,
hair dryer,High-Quality 100g 20 Inch Wholesale Price InvisiableHairPieces HumanHairStraight Fish-Line Wire MicroHairExtension for Women,https://rebeccahairfactory.en.made-in-china.com/product/AxHpmCEborRG/China-High-Quality-100g-20-Inch-Wholesale-Price-Invisiable-Hair-Pieces-Human-Hair-Straight-Fish-Line-Wire-Micro-Hair-Extension-for-Women.html,AxHpmCEborRG,AxHpmCEborRG,65.5,USD,1,,"High-Quality 100g 20 Inch Wholesale Price InvisiableHairPieces HumanHairStraight Fish-Line Wire MicroHairExtension for WomenUS$ 65.5-89.8/ Piece1 Piece(MOQ)Henan Rebecca Hair Products Co.,LtdHenan Rebecca Hair Products Co.,LtdDiamond MemberAudited SupplierSecured TradingHenan, ChinaManufacturer/Factory & Trading CompanyISO45001:2018Enjoy trading protection from Made-in-China.comView larger video & image5(4.9)""Fast Dispatch""Fast Dispatch","Henan Rebecca Hair Products Co.,Ltd",https://rebeccahairfactory.en.made-in-china.com,4.9,4.0,Henan Rebecca Hair Products Co.,"Henan, China","No. 666, Rebecca Road, Xuchang",2025-08-12T13:59:11.926458,
hair dryer,"20"" Multiple Colours Tape inHairExtensions, Seamless Tape inHairExtensions Real HumanHairExtensions RemyHairTape inHairfor Women",https://rebeccahairfactory.en.made-in-china.com/product/WwOtfncuJLAP/China-20-Multiple-Colours-Tape-in-Hair-Extensions-Seamless-Tape-in-Hair-Extensions-Real-Human-Hair-Extensions-Remy-Hair-Tape-in-Hair-for-Women.html,WwOtfncuJLAP,WwOtfncuJLAP,42.5,USD,1,,"20"" Multiple Colours Tape inHairExtensions, Seamless Tape inHairExtensions Real HumanHairExtensions RemyHairTape inHairfor WomenUS$ 42.5-46.8/ Piece1 Piece(MOQ)Henan Rebecca Hair Products Co.,LtdHenan Rebecca Hair Products Co.,LtdDiamond MemberAudited SupplierSecured TradingHenan, ChinaManufacturer/Factory & Trading CompanyISO45001:2018Enjoy trading protection from Made-in-China.comView larger video & image5(4.9)""Fast Dispatch""Fast Dispatch","Henan Rebecca Hair Products Co.,Ltd",https://rebeccahairfactory.en.made-in-china.com,4.9,4.0,Henan Rebecca Hair Products Co.,"Henan, China","No. 666, Rebecca Road, Xuchang",2025-08-12T13:59:12.862939,
hair dryer,AC 3000rpm Gear Electric Motor for Hood Oven/Pump/Dry-Type Transformer/Forced Airflow Systems/Lubricant Pump,https://greatup.en.made-in-china.com/product/vXznRdoxYLVE/China-AC-3000rpm-Gear-Electric-Motor-for-Hood-Oven-Pump-Dry-Type-Transformer-Forced-Airflow-Systems-Lubricant-Pump.html,vXznRdoxYLVE,vXznRdoxYLVE,1.8,USD,1000,,"AC 3000rpm Gear Electric Motor for Hood Oven/Pump/Dry-Type Transformer/Forced Airflow Systems/Lubricant PumpUS$ 1.8-2.5/ Piece1000 Pieces(MOQ)RITSCHER INTERNATIONAL LIMITEDRITSCHER INTERNATIONAL LIMITEDDiamond MemberAudited SupplierGuangdong, ChinaView larger video & image",RITSCHER INTERNATIONAL LIMITED,https://greatup.en.made-in-china.com,,,Ritscher group,"Guangdong, China","Dongfeng Town, Zhongshan City, Zhongshan",2025-08-12T13:59:13.716487,
hair dryer,Long Size Wholesale Price Soft and Silky 22-Inch U TipHairExtensions Remy U TipsHairExtensions Real HumanHairExtensions,https://rebeccahairfactory.en.made-in-china.com/product/kxlrgnJEWYpK/China-Long-Size-Wholesale-Price-Soft-and-Silky-22-Inch-U-Tip-Hair-Extensions-Remy-U-Tips-Hair-Extensions-Real-Human-Hair-Extensions.html,kxlrgnJEWYpK,kxlrgnJEWYpK,78.2,USD,1,,"Long Size Wholesale Price Soft and Silky 22-Inch U TipHairExtensions Remy U TipsHairExtensions Real HumanHairExtensionsUS$ 78.2-102.1/ Piece1 Piece(MOQ)Henan Rebecca Hair Products Co.,LtdHenan Rebecca Hair Products Co.,LtdDiamond MemberAudited SupplierSecured TradingHenan, ChinaManufacturer/Factory & Trading CompanyISO45001:2018Enjoy trading protection from Made-in-China.comView larger video & image5(4.9)""Fast Dispatch""Fast Dispatch","Henan Rebecca Hair Products Co.,Ltd",https://rebeccahairfactory.en.made-in-china.com,4.9,4.0,Henan Rebecca Hair Products Co.,"Henan, China","No. 666, Rebecca Road, Xuchang",2025-08-12T13:59:14.623628,
hair dryer,High Quality PU Weft Seamless Clip on HumanHairExtension Russian RemyHair,https://shangkaihair.en.made-in-china.com/product/usWxeNJOkokS/China-High-Quality-PU-Weft-Seamless-Clip-on-Human-Hair-Extension-Russian-Remy-Hair.html,usWxeNJOkokS,usWxeNJOkokS,28.0,USD,1,,"High Quality PU Weft Seamless Clip on HumanHairExtension Russian RemyHairUS$ 28-88/ Piece1 Piece(MOQ)Juancheng Shangkai Hair Products FactoryJuancheng Shangkai Hair Products FactoryDiamond MemberAudited SupplierSecured TradingShandong, ChinaManufacturer/Factory & Trading CompanyEnjoy trading protection from Made-in-China.comView larger video & image5(5.0)""Awesome Customer Service""Awesome Customer Service",Juancheng Shangkai Hair Products,https://shangkaihair.en.made-in-china.com,5.0,5.0,Factory & Trading Company,"Shandong, China","2nd Human Hair Industry,Juancheng, Heze",2025-08-12T13:59:15.602803,
hair dryer,Long Life AC Electric Single-Phase Motor for Vacuum Fan Motor,https://greatup.en.made-in-china.com/product/hBaQLVConFcA/China-Long-Life-AC-Electric-Single-Phase-Motor-for-Vacuum-Fan-Motor.html,hBaQLVConFcA,hBaQLVConFcA,2.5,USD,800,,"Long Life AC Electric Single-Phase Motor for Vacuum Fan MotorUS$ 2.5-3.8/ Piece800 Pieces(MOQ)RITSCHER INTERNATIONAL LIMITEDRITSCHER INTERNATIONAL LIMITEDDiamond MemberAudited SupplierGuangdong, ChinaView larger video & image",RITSCHER INTERNATIONAL LIMITED,https://greatup.en.made-in-china.com,,,Ritscher group,"Guangdong, China","Dongfeng Town, Zhongshan City, Zhongshan",2025-08-12T13:59:16.596611,
hair dryer,New Coming Finest RemyHairInvisible Seamless Clip inHairExtension HumanHair,https://shangkaihair.en.made-in-china.com/product/uCVQBjxTXqcH/China-New-Coming-Finest-Remy-Hair-Invisible-Seamless-Clip-in-Hair-Extension-Human-Hair.html,uCVQBjxTXqcH,uCVQBjxTXqcH,28.0,USD,1,,"New Coming Finest RemyHairInvisible Seamless Clip inHairExtension HumanHairUS$ 28-88/ Piece1 Piece(MOQ)Juancheng Shangkai Hair Products FactoryJuancheng Shangkai Hair Products FactoryDiamond MemberAudited SupplierSecured TradingShandong, ChinaManufacturer/Factory & Trading CompanyEnjoy trading protection from Made-in-China.comView larger video & image5(5.0)""Great Customer Service""Great Customer Service",Juancheng Shangkai Hair Products,https://shangkaihair.en.made-in-china.com,5.0,5.0,Factory & Trading Company,"Shandong, China","2nd Human Hair Industry,Juancheng, Heze",2025-08-12T13:59:18.461352,
hair dryer,Electric/Electrical Yj72 AC High Quality Shaded Pole Motor for Exhaust Fan Motor,https://greatup.en.made-in-china.com/product/NBqJMSlYLsWR/China-Electric-Electrical-Yj72-AC-High-Quality-Shaded-Pole-Motor-for-Exhaust-Fan-Motor.html,NBqJMSlYLsWR,NBqJMSlYLsWR,3.2,USD,1000,,"Electric/Electrical Yj72 AC High Quality Shaded Pole Motor for Exhaust Fan MotorUS$ 3.2/ Piece1000 Pieces(MOQ)RITSCHER INTERNATIONAL LIMITEDRITSCHER INTERNATIONAL LIMITEDDiamond MemberAudited SupplierGuangdong, ChinaView larger video & image",RITSCHER INTERNATIONAL LIMITED,https://greatup.en.made-in-china.com,,,Ritscher group,"Guangdong, China","Dongfeng Town, Zhongshan City, Zhongshan",2025-08-12T13:59:19.396536,
hair dryer,Wholesale 100% Real Natural Virgin Best Seamless 100% Brazilian Remy Clip inHairExtension,https://shangkaihair.en.made-in-china.com/product/FycnSLxTCbWH/China-Wholesale-100-Real-Natural-Virgin-Best-Seamless-100-Brazilian-Remy-Clip-in-Hair-Extension.html,FycnSLxTCbWH,FycnSLxTCbWH,28.0,USD,1,,"Wholesale 100% Real Natural Virgin Best Seamless 100% Brazilian Remy Clip inHairExtensionUS$ 28-88/ Piece1 Piece(MOQ)Juancheng Shangkai Hair Products FactoryJuancheng Shangkai Hair Products FactoryDiamond MemberAudited SupplierSecured TradingShandong, ChinaManufacturer/Factory & Trading CompanyEnjoy trading protection from Made-in-China.comView larger video & image5(5.0)""Excellent Job""Excellent Job",Juancheng Shangkai Hair Products,https://shangkaihair.en.made-in-china.com,5.0,5.0,Factory & Trading Company,"Shandong, China","2nd Human Hair Industry,Juancheng, Heze",2025-08-12T13:59:20.454187,
hair dryer,3 Secure Clips 18 Inch Invisible Wire Real HumanHairExtensions Transparent Wire Adjustable Size Multiple Colours Long Straight Secret Extension for Women,https://rebeccahairfactory.en.made-in-china.com/product/aQIpyexdVRrG/China-3-Secure-Clips-18-Inch-Invisible-Wire-Real-Human-Hair-Extensions-Transparent-Wire-Adjustable-Size-Multiple-Colours-Long-Straight-Secret-Extension-for-Women.html,aQIpyexdVRrG,aQIpyexdVRrG,44.1,USD,1,,"3 Secure Clips 18 Inch Invisible Wire Real HumanHairExtensions Transparent Wire Adjustable Size Multiple Colours Long Straight Secret Extension for WomenUS$ 44.1-58.1/ Piece1 Piece(MOQ)Henan Rebecca Hair Products Co.,LtdHenan Rebecca Hair Products Co.,LtdDiamond MemberAudited SupplierSecured TradingHenan, ChinaManufacturer/Factory & Trading CompanyISO45001:2018Enjoy trading protection from Made-in-China.comView larger video & image5(4.9)""Fast Dispatch""Fast Dispatch","Henan Rebecca Hair Products Co.,Ltd",https://rebeccahairfactory.en.made-in-china.com,4.9,4.0,Henan Rebecca Hair Products Co.,"Henan, China","No. 666, Rebecca Road, Xuchang",2025-08-12T13:59:21.367062,
hair dryer,AC Electrical Manufacturers Evaporator Fan Electric Motor for Rotisserie,https://greatup.en.made-in-china.com/product/AsaEzywuAXke/China-AC-Electrical-Manufacturers-Evaporator-Fan-Electric-Motor-for-Rotisserie.html,AsaEzywuAXke,AsaEzywuAXke,1.2,USD,500,,"AC Electrical Manufacturers Evaporator Fan Electric Motor for RotisserieUS$ 1.2-1.5/ Piece500 Pieces(MOQ)RITSCHER INTERNATIONAL LIMITEDRITSCHER INTERNATIONAL LIMITEDDiamond MemberAudited SupplierGuangdong, ChinaView larger video & image",RITSCHER INTERNATIONAL LIMITED,https://greatup.en.made-in-china.com,,,Ritscher group,"Guangdong, China","Dongfeng Town, Zhongshan City, Zhongshan",2025-08-12T13:59:22.379859,
hair dryer,Russian RemyHairExtension Seamless Clips in HumanHairDouble Drawn Omber Color,https://shangkaihair.en.made-in-china.com/product/FNWEquQrXMcg/China-Russian-Remy-Hair-Extension-Seamless-Clips-in-Human-Hair-Double-Drawn-Omber-Color.html,FNWEquQrXMcg,FNWEquQrXMcg,28.0,USD,1,,"Russian RemyHairExtension Seamless Clips in HumanHairDouble Drawn Omber ColorUS$ 28-88/ Piece1 Piece(MOQ)Juancheng Shangkai Hair Products FactoryJuancheng Shangkai Hair Products FactoryDiamond MemberAudited SupplierSecured TradingShandong, ChinaManufacturer/Factory & Trading CompanyEnjoy trading protection from Made-in-China.comView larger video & image5(5.0)""Great Customer Service""Great Customer Service",Juancheng Shangkai Hair Products,https://shangkaihair.en.made-in-china.com,5.0,5.0,Factory & Trading Company,"Shandong, China","2nd Human Hair Industry,Juancheng, Heze",2025-08-12T13:59:23.312599,
hair dryer,AC Electrical/Electric Shaded Pole Motor for High Temperature Sterilizing Cabinet/Warm Air Blower,https://greatup.en.made-in-china.com/product/LvbEXZlcyNWq/China-AC-Electrical-Electric-Shaded-Pole-Motor-for-High-Temperature-Sterilizing-Cabinet-Warm-Air-Blower.html,LvbEXZlcyNWq,LvbEXZlcyNWq,2.8,USD,100,,"AC Electrical/Electric Shaded Pole Motor for High Temperature Sterilizing Cabinet/Warm Air BlowerUS$ 2.8/ Piece100 Pieces(MOQ)RITSCHER INTERNATIONAL LIMITEDRITSCHER INTERNATIONAL LIMITEDDiamond MemberAudited SupplierGuangdong, ChinaView larger video & image",RITSCHER INTERNATIONAL LIMITED,https://greatup.en.made-in-china.com,,,Ritscher group,"Guangdong, China","Dongfeng Town, Zhongshan City, Zhongshan",2025-08-12T13:59:24.250973,
hair dryer,"20"" U TipHairExtensions HumanHairU Tip Multiple Colours Choose NaturalHairExtensions HumanHairTipHairExtensions for Women",https://rebeccahairfactory.en.made-in-china.com/product/VnzRwMZTbrUX/China-20-U-Tip-Hair-Extensions-Human-Hair-U-Tip-Multiple-Colours-Choose-Natural-Hair-Extensions-Human-Hair-Tip-Hair-Extensions-for-Women.html,VnzRwMZTbrUX,VnzRwMZTbrUX,65.1,USD,1,,"20"" U TipHairExtensions HumanHairU Tip Multiple Colours Choose NaturalHairExtensions HumanHairTipHairExtensions for WomenUS$ 65.1-86.7/ Piece1 Piece(MOQ)Henan Rebecca Hair Products Co.,LtdHenan Rebecca Hair Products Co.,LtdDiamond MemberAudited SupplierSecured TradingHenan, ChinaManufacturer/Factory & Trading CompanyISO45001:2018Enjoy trading protection from Made-in-China.comView larger video & image5(4.9)""Fast Dispatch""Fast Dispatch","Henan Rebecca Hair Products Co.,Ltd",https://rebeccahairfactory.en.made-in-china.com,4.9,4.0,Henan Rebecca Hair Products Co.,"Henan, China","No. 666, Rebecca Road, Xuchang",2025-08-12T13:59:25.188857,
hair dryer,Factory Direct Supply Wholesale Price PU Seamless Clip inHairExtensions,https://shangkaihair.en.made-in-china.com/product/JCkEbxmFHehc/China-Factory-Direct-Supply-Wholesale-Price-PU-Seamless-Clip-in-Hair-Extensions.html,JCkEbxmFHehc,JCkEbxmFHehc,38.0,USD,1,,"Factory Direct Supply Wholesale Price PU Seamless Clip inHairExtensionsUS$ 38-88/ Piece1 Piece(MOQ)Juancheng Shangkai Hair Products FactoryJuancheng Shangkai Hair Products FactoryDiamond MemberAudited SupplierSecured TradingShandong, ChinaManufacturer/Factory & Trading CompanyEnjoy trading protection from Made-in-China.comView larger video & image5(5.0)""Great Service""Great Service",Juancheng Shangkai Hair Products,https://shangkaihair.en.made-in-china.com,5.0,5.0,Factory & Trading Company,"Shandong, China","2nd Human Hair Industry,Juancheng, Heze",2025-08-12T13:59:26.099817,
hair dryer,Full Head Indian Remy HumanHairSeamless Clip inHairExtensions,https://shangkaihair.en.made-in-china.com/product/ljWEePQYgoki/China-Full-Head-Indian-Remy-Human-Hair-Seamless-Clip-in-Hair-Extensions.html,ljWEePQYgoki,ljWEePQYgoki,48.0,USD,1,,"Full Head Indian Remy HumanHairSeamless Clip inHairExtensionsUS$ 48-88/ Piece1 Piece(MOQ)Juancheng Shangkai Hair Products FactoryJuancheng Shangkai Hair Products FactoryDiamond MemberAudited SupplierSecured TradingShandong, ChinaManufacturer/Factory & Trading CompanyEnjoy trading protection from Made-in-China.comView larger video & image5(5.0)""Excellent Job""Excellent Job",Juancheng Shangkai Hair Products,https://shangkaihair.en.made-in-china.com,5.0,5.0,Factory & Trading Company,"Shandong, China","2nd Human Hair Industry,Juancheng, Heze",2025-08-12T13:59:27.054973,
