keyword,title,listing_url,item_number,sku,price,currency,min_order_quantity,max_order_quantity,description,seller_name,seller_profile_url,seller_rating,seller_total_reviews,seller_business_name,seller_country,seller_address,seller_email,scraped_at,last_updated
cosmetic mirror,China Supplier ofCosmeticMirror,https://43cf25cedf8bc94d.en.made-in-china.com,,,,USD,,,"China Supplier ofCosmeticMirrorNingbo Isseven Import and Export Co LtdNingbo Isseven Import and Export Co LtdDiamond MemberAudited SupplierZhejiang, China",Ningbo Isseven Import and Export Co Ltd,https://43cf25cedf8bc94d.en.made-in-china.com,,,Focus Technology,"Zhejiang, China","Room 6602, Build 6, No. 158 Changxing Road",,2025-08-12T21:46:19.267366,
cosmetic mirror,Hotel Wholesale Lighted LED BathroomMirrorwith Touch Switch & Defogger,https://sachikoo.en.made-in-china.com/product/AfRUsFSJgKcG/China-Hotel-Wholesale-Lighted-LED-Bathroom-Mirror-with-Touch-Switch-Defogger.html,,XZ-1002,29.55,USD,1.0,,"Hotel Wholesale Lighted LED BathroomMirrorwith Touch Switch & DefoggerUS$ 29.55-33.58/ Piece1 Piece(MOQ)Shenzhen Sachikoo Yongfa Technology Co., Ltd.Shenzhen Sachikoo Yongfa Technology Co., Ltd.Diamond MemberAudited SupplierGuangdong, ChinaManufacturer/Factory & Trading CompanyView larger video & image5(5.0)""On-time Delivery""On-time Delivery","Shenzhen Sachikoo Yongfa Technology Co., Ltd.",https://sachikoo.en.made-in-china.com,5.0,5.0,Shenzhen Sachikoo Yongfa Technology Co.,"Guangdong, China","Shenzhen, Guangdong, China",,2025-08-12T21:46:23.807132,
cosmetic mirror,2-6mm Clear Aluminum FloatMirror/Mirrorfor Decorative BathroomCosmeticFurniture,https://qdatglass.en.made-in-china.com/product/FXoQYSgdZURp/China-2-6mm-Clear-Aluminum-Float-Mirror-Mirror-for-Decorative-Bathroom-Cosmetic-Furniture.html,,Aluminum,2.39,USD,,,"2-6mm Clear Aluminum FloatMirror/Mirrorfor Decorative BathroomCosmeticFurnitureUS$ 2.39-8.29/ Square Meter100 Square Meters(MOQ)A&T GLASS INDUSTRY CO., LIMITEDA&T GLASS INDUSTRY CO., LIMITEDDiamond MemberShandong, ChinaView larger video & image","A&T GLASS INDUSTRY CO., LIMITED",https://qdatglass.en.made-in-china.com,,,"Square Meters
	                           	

Contact Now









Company","Shandong, China","216 Changjiang Middle Road, Qingdao Development Zone, Qingdao",,2025-08-12T21:46:36.446590,
cosmetic mirror,Custom Irregular Arch Oval RectangleCosmeticVanity Wall Mounted Decoration FramedMirror,https://shuangyuanglass.en.made-in-china.com/product/dnXrEfgxFRUz/China-Custom-Irregular-Arch-Oval-Rectangle-Cosmetic-Vanity-Wall-Mounted-Decoration-Framed-Mirror.html,7009920000,SY-FM-DF,8.8,USD,100.0,,"Custom Irregular Arch Oval RectangleCosmeticVanity Wall Mounted Decoration FramedMirrorUS$ 8.8-12/ Piece100 Pieces(MOQ)Shouguang Shuangyuan Glass Products Co., LtdShouguang Shuangyuan Glass Products Co., LtdDiamond MemberAudited SupplierSecured TradingShandong, ChinaManufacturer/Factory & Trading CompanyEnjoy trading protection from Made-in-China.comView larger video & image5(5.0)""On-time Delivery""On-time Delivery","Shouguang Shuangyuan Glass Products Co., Ltd",https://shuangyuanglass.en.made-in-china.com,5.0,5.0,Shouguang Shuangyuan Glass Products Co.,"Shandong, China","Old Beiluo Town Government Station, Gucheng Subdistrict, Shouguang",,2025-08-12T21:46:40.927550,
cosmetic mirror,Magnifying Round Mini Makeup Compact HandMirrorsMetal Small Make up FoldingCosmeticPocketMirror,https://eshabeauty.en.made-in-china.com/product/eSlEpXmLqJfb/China-Magnifying-Round-Mini-Makeup-Compact-Hand-Mirrors-Metal-Small-Make-up-Folding-Cosmetic-Pocket-Mirror.html,,,0.5,USD,100.0,,"Magnifying Round Mini Makeup Compact HandMirrorsMetal Small Make up FoldingCosmeticPocketMirrorUS$ 0.5-1/ Piece100 Pieces(MOQ)ESHA CO., LIMITED.ESHA CO., LIMITED.Diamond MemberAudited SupplierSecured TradingGuangdong, ChinaTrading CompanyEnjoy trading protection from Made-in-China.comView larger video & image5(5.0)""Great Customer Service""Great Customer Service","ESHA CO., LIMITED.",https://eshabeauty.en.made-in-china.com,5.0,5.0,Trading Company,"Guangdong, China","Room 217, Unit17, Building 7",,2025-08-12T21:46:46.398690,
cosmetic mirror,Rabbit Desktop Makeup GlassMirrorCustom LED LightCosmeticSmart Touch Compact TableMirror,https://eshabeauty.en.made-in-china.com/product/tSDnuZxbVmfi/China-Rabbit-Desktop-Makeup-Glass-Mirror-Custom-LED-Light-Cosmetic-Smart-Touch-Compact-Table-Mirror.html,,Makeup,3.51,USD,80.0,,"Rabbit Desktop Makeup GlassMirrorCustom LED LightCosmeticSmart Touch Compact TableMirrorUS$ 3.51-6.57/ Piece80 Pieces(MOQ)ESHA CO., LIMITED.ESHA CO., LIMITED.Diamond MemberAudited SupplierSecured TradingGuangdong, ChinaTrading CompanyEnjoy trading protection from Made-in-China.comView larger video & image5(5.0)""Excellent Job""Excellent Job","ESHA CO., LIMITED.",https://eshabeauty.en.made-in-china.com,5.0,5.0,Trading Company,"Guangdong, China","Room 217, Unit17, Building 7",,2025-08-12T21:46:52.688327,
cosmetic mirror,"LEDMirror, LED LightCosmeticMirror, Bathroom MakeupMirror,CosmeticMirror, Wall MakeupMirror",https://dytowelbar.en.made-in-china.com/product/QftYKHVuvFkn/China-LED-Mirror-LED-Light-Cosmetic-Mirror-Bathroom-Makeup-Mirror-Cosmetic-Mirror-Wall-Makeup-Mirror.html,8302500000,9005,33.2,USD,50.0,,"LEDMirror, LED LightCosmeticMirror, Bathroom MakeupMirror,CosmeticMirror, Wall MakeupMirrorUS$ 33.2-35.8/ Piece50 Pieces(MOQ)Kaiping Da Ying Hardware Co.LtdKaiping Da Ying Hardware Co.LtdGold MemberAudited SupplierGuangdong, ChinaView larger video & image",Kaiping Da Ying Hardware Co.Ltd,https://dytowelbar.en.made-in-china.com,,,,"Guangdong, China","Room A03, No. 8, Xiaohegang",,2025-08-12T21:46:57.902368,
cosmetic mirror,Bathroom Smart LED Lighted Round DesignCosmeticWall Decorative MakeupMirrorwith Demister,https://chinablossom.en.made-in-china.com/product/UXzxyobYbspr/China-Bathroom-Smart-LED-Lighted-Round-Design-Cosmetic-Wall-Decorative-Makeup-Mirror-with-Demister.html,7009910090,BLS-LD8077,11.7,USD,10.0,,"Bathroom Smart LED Lighted Round DesignCosmeticWall Decorative MakeupMirrorwith DemisterUS$ 11.7-19.2/ Piece10 Pieces(MOQ)Hangzhou Blossom Import&Export Co., Ltd.Hangzhou Blossom Import&Export Co., Ltd.Diamond MemberAudited SupplierSecured TradingZhejiang, ChinaEnjoy trading protection from Made-in-China.comView larger video & image5(5.0)""Fast Delivery""Fast Delivery","Hangzhou Blossom Import&Export Co., Ltd.",https://chinablossom.en.made-in-china.com,5.0,5.0,Focus Technology,"Zhejiang, China","23 Floor, Building 1 Xinyi Plaza, No. 628 Jincheng Road",,2025-08-12T21:47:02.587415,
cosmetic mirror,Durable Bath GlassCosmeticMirrorwith Quality Materials for Daily Use,https://prosperouslighting.en.made-in-china.com/product/KaqYRNoPYTlU/China-Durable-Bath-Glass-Cosmetic-Mirror-with-Quality-Materials-for-Daily-Use.html,,HCL-883A,50.0,USD,300.0,,"Durable Bath GlassCosmeticMirrorwith Quality Materials for Daily UseUS$ 50-150/ Piece300 Pieces(MOQ)Prosperous (Ningbo) Lighting Appliance Co., LtdProsperous (Ningbo) Lighting Appliance Co., LtdDiamond MemberAudited SupplierZhejiang, ChinaManufacturer/Factory & Trading CompanyISO45001:2018, ISO14001View larger video & image","Prosperous (Ningbo) Lighting Appliance Co., Ltd",https://prosperouslighting.en.made-in-china.com,,,Lighting Appliance Co.,"Zhejiang, China","No.299 Wancheng road,Haishu district,315153 Ningbo China",,2025-08-12T21:47:09.875436,
cosmetic mirror,Home Decoration Furniture Espejos Black Framed Aluminum Silver Round Smart Bathroom VanityCosmeticMake-up LED LightedMirror/Cabinet/Faucet for Toilet Shower,https://vihangmirror.en.made-in-china.com/product/yZNfPOCKectw/China-Home-Decoration-Furniture-Espejos-Black-Framed-Aluminum-Silver-Round-Smart-Bathroom-Vanity-Cosmetic-Make-up-LED-Lighted-Mirror-Cabinet-Faucet-for-Toilet-Shower.html,7009910000,VR7833F,10.0,USD,10.0,,"Home Decoration Furniture Espejos Black Framed Aluminum Silver Round Smart Bathroom VanityCosmeticMake-up LED LightedMirror/Cabinet/Faucet for Toilet ShowerUS$ 10-25/ Set10 Sets(MOQ)Hangzhou Veyron Bathroom Mirror Co., Ltd.Hangzhou Veyron Bathroom Mirror Co., Ltd.Diamond MemberAudited SupplierSecured TradingZhejiang, ChinaManufacturer/Factory & Trading CompanyEnjoy trading protection from Made-in-China.comView larger video & image","Hangzhou Veyron Bathroom Mirror Co., Ltd.",https://vihangmirror.en.made-in-china.com,,,In the context of intense global,"Zhejiang, China","Group 9, Changlian Village, Guali Town",,2025-08-12T21:47:18.873052,
cosmetic mirror,Modern Decorative LED Defogger Lighted BathroomCosmeticMirrorfor Hotel,https://jianer-001.en.made-in-china.com/product/xMBnSsNulwUe/China-Modern-Decorative-LED-Defogger-Lighted-Bathroom-Cosmetic-Mirror-for-Hotel.html,,MR-01,155.0,USD,1.0,,"Modern Decorative LED Defogger Lighted BathroomCosmeticMirrorfor HotelUS$ 155-255/ Piece1 Piece(MOQ)SBICAI Lighting Co., Ltd.SBICAI Lighting Co., Ltd.Diamond MemberAudited SupplierGuangdong, ChinaView larger video & image5(4.0)""Reliable Supplier""Reliable Supplier","SBICAI Lighting Co., Ltd.",https://jianer-001.en.made-in-china.com,4.0,4.0,Yongxing Industrial,"Guangdong, China","No. 80 Shunxing North Rd,Yongxing Industrial Area, Henglan",,2025-08-12T21:47:25.463211,
cosmetic mirror,New BathroomCosmeticCompact Magnified Wall Mounted Double-Sided Round LED MakeupMirror,https://lockvel.en.made-in-china.com/product/gZiTFeNvlDfl/China-New-Bathroom-Cosmetic-Compact-Magnified-Wall-Mounted-Double-Sided-Round-LED-Makeup-Mirror.html,7009920000,BH-MR-04,18.88,USD,10.0,,"New BathroomCosmeticCompact Magnified Wall Mounted Double-Sided Round LED MakeupMirrorUS$ 18.88-22.88/ Piece10 Pieces(MOQ)Guangzhou Lockvel Security Technologies Co., Ltd.Guangzhou Lockvel Security Technologies Co., Ltd.Gold MemberAudited SupplierGuangdong, ChinaView larger video & image","Guangzhou Lockvel Security Technologies Co., Ltd.",https://lockvel.en.made-in-china.com,,,Shenlan Industrial,"Guangdong, China","Building 6b, Shenlan Industrial Park, Shibeigongye Road",,2025-08-12T21:47:43.591763,
cosmetic mirror,Smart LED Wall Home Decor Make up GlassCosmeticWholesale Full-LengthMirror,https://bathmirror.en.made-in-china.com/product/iZJfgytObLUq/China-Smart-LED-Wall-Home-Decor-Make-up-Glass-Cosmetic-Wholesale-Full-Length-Mirror.html,7009910090,3067,23.0,USD,50.0,,"Smart LED Wall Home Decor Make up GlassCosmeticWholesale Full-LengthMirrorUS$ 23-25/ Piece50 Pieces(MOQ)Hangzhou Chenghong Kitchen and Toilet Technology Co., Ltd.Hangzhou Chenghong Kitchen and Toilet Technology Co., Ltd.Gold MemberAudited SupplierSecured TradingZhejiang, ChinaEnjoy trading protection from Made-in-China.comView larger video & image5(5.0)""Fast Dispatch""Fast Dispatch","Hangzhou Chenghong Kitchen and Toilet Technology Co., Ltd.",https://bathmirror.en.made-in-china.com,5.0,5.0,,"Zhejiang, China","Xiaoshan District, Hangzhou, Zhejiang",,2025-08-12T21:47:50.001421,
cosmetic mirror,CustomMirrorCosmeticPocketMirrorMake up Tool Sublimation Metal CompactMirror,https://zsxdpins.en.made-in-china.com/product/yGVrbjZWSUks/China-Custom-Mirror-Cosmetic-Pocket-Mirror-Make-up-Tool-Sublimation-Metal-Compact-Mirror.html,,x2024042501,0.88,USD,50.0,,"CustomMirrorCosmeticPocketMirrorMake up Tool Sublimation Metal CompactMirrorUS$ 0.88-1.1/ Piece50 Pieces(MOQ)Zhongshan Xiangda Metal Arts & Crafts Co., Ltd.Zhongshan Xiangda Metal Arts & Crafts Co., Ltd.Diamond MemberAudited SupplierSecured TradingGuangdong, ChinaManufacturer/Factory & Trading CompanyEnjoy trading protection from Made-in-China.comView larger video & image5(5.0)""Fast Dispatch""Fast Dispatch","Zhongshan Xiangda Metal Arts & Crafts Co., Ltd.",https://zsxdpins.en.made-in-china.com,5.0,5.0,Factory & Trading Company,"Guangdong, China","No. 1, Shengfeng Heyuan Road, Xiaolan Town",,2025-08-12T21:47:55.376376,
cosmetic mirror,2024 Modern Metal Frame Copper-Free Silver Wall-Mounted Home Furniture Modern Full-Length Decorated Vanity Dressing ClothingCosmeticMirror,https://lwhome.en.made-in-china.com/product/knOpxYUuRMrT/China-2024-Modern-Metal-Frame-Copper-Free-Silver-Wall-Mounted-Home-Furniture-Modern-Full-Length-Decorated-Vanity-Dressing-Clothing-Cosmetic-Mirror.html,8306300000,LW3005-3041,21.69,USD,50.0,,"2024 Modern Metal Frame Copper-Free Silver Wall-Mounted Home Furniture Modern Full-Length Decorated Vanity Dressing ClothingCosmeticMirrorUS$ 21.69-25.65/ Piece50 Pieces(MOQ)Qingdao Liwo Home Co., Ltd.Qingdao Liwo Home Co., Ltd.Diamond MemberAudited SupplierSecured TradingShandong, ChinaEnjoy trading protection from Made-in-China.comView larger video & image","Qingdao Liwo Home Co., Ltd.",https://lwhome.en.made-in-china.com,,,Qingdao Liwo Home Co.,"Shandong, China","Qingdao, Shandong, China",,2025-08-12T21:48:00.171521,
cosmetic mirror,Home Decor Decoration Makeup Dressing Salon VanityCosmeticFurniture Wall Hotel Room Lighted Bathroom LEDMirrorwith Defogger and Bluetooth,https://jhglass.en.made-in-china.com/product/sGYUEneABflp/China-Home-Decor-Decoration-Makeup-Dressing-Salon-Vanity-Cosmetic-Furniture-Wall-Hotel-Room-Lighted-Bathroom-LED-Mirror-with-Defogger-and-Bluetooth.html,7009910090,led,25.0,USD,20.0,,"Home Decor Decoration Makeup Dressing Salon VanityCosmeticFurniture Wall Hotel Room Lighted Bathroom LEDMirrorwith Defogger and BluetoothUS$ 25-35/ Piece20 Pieces(MOQ)Hangzhou Jinghu Glass Co., Ltd.Hangzhou Jinghu Glass Co., Ltd.Diamond MemberAudited SupplierSecured TradingZhejiang, ChinaEnjoy trading protection from Made-in-China.comView larger video & image5(3.7)""On-time Delivery""On-time Delivery","Hangzhou Jinghu Glass Co., Ltd.",https://jhglass.en.made-in-china.com,,,"Post Sourcing Request













Hangzhou Jinghu Glass Co.","Zhejiang, China","No 563, North Shixin Road, Xiaoshan District",,2025-08-12T21:48:09.232847,
cosmetic mirror,High Quality FashionCosmeticDecorative LED BathroomMirror,https://strivebathrooms.en.made-in-china.com/product/bXzmypedyjWM/China-High-Quality-Fashion-Cosmetic-Decorative-LED-Bathroom-Mirror.html,9403609990,LZ-a24,25.0,USD,50.0,,"High Quality FashionCosmeticDecorative LED BathroomMirrorUS$ 25/ Set50 Sets(MOQ)Hangzhou Strive Sanitary Ware Co., Ltd.Hangzhou Strive Sanitary Ware Co., Ltd.Diamond MemberAudited SupplierZhejiang, ChinaView larger video & image","Hangzhou Strive Sanitary Ware Co., Ltd.",https://strivebathrooms.en.made-in-china.com,,,Hangzhou Strive Sanitary Ware Co.,"Zhejiang, China","Dangshan Town, Xiaoshan District, Hangzhou",,2025-08-12T21:48:13.864976,
cosmetic mirror,Personalized Gift Printed & Epoxy Logo Round MetalCosmeticMirror,https://goldenonechina.en.made-in-china.com/product/jSanmGvAVJrC/China-Personalized-Gift-Printed-Epoxy-Logo-Round-Metal-Cosmetic-Mirror.html,,CM02,0.9,USD,500.0,,"Personalized Gift Printed & Epoxy Logo Round MetalCosmeticMirrorUS$ 0.9/ Piece500 Pieces(MOQ)Golden One (Jiangmen) Gifts Co., LimitedGolden One (Jiangmen) Gifts Co., LimitedDiamond MemberAudited SupplierGuangdong, ChinaManufacturer/Factory & Trading CompanyView larger video & image5(5.0)""Fast Delivery""Fast Delivery","Golden One (Jiangmen) Gifts Co., Limited",https://goldenonechina.en.made-in-china.com,5.0,5.0,GOLDEN ONE China LIMITED,"Guangdong, China","Unit C, 8th Floor, Tian Yuan Building",,2025-08-12T21:48:18.801622,
cosmetic mirror,Wholesale LED Bathroom SmartMirrorRound Luminous BathroomCosmeticWall MountedMirror,https://senhangceramic.en.made-in-china.com/product/EfZpNmJdnFWX/China-Wholesale-LED-Bathroom-Smart-Mirror-Round-Luminous-Bathroom-Cosmetic-Wall-Mounted-Mirror.html,7009920000,SSM001,7.0,USD,20.0,,"Wholesale LED Bathroom SmartMirrorRound Luminous BathroomCosmeticWall MountedMirrorUS$ 7-15/ Piece20 Pieces(MOQ)Chaozhou Senhang Sanitary Ware Co., Ltd.Chaozhou Senhang Sanitary Ware Co., Ltd.Diamond MemberAudited SupplierSecured TradingGuangdong, ChinaEnjoy trading protection from Made-in-China.comView larger video & image","Chaozhou Senhang Sanitary Ware Co., Ltd.",https://senhangceramic.en.made-in-china.com,,,Chaozhou Senhang Sanitary Ware Co.,"Guangdong, China","Chaozhou, Guangdong, China",,2025-08-12T21:48:26.197143,
cosmetic mirror,Bathroom Bath LEDCosmeticSmart Anti Fog Antique Makeup Wall Mounted Vanity Side Shaving Dressing Unframed Frameless Defogger Bluetooth Aluminium SilverMirror,https://tecksonglass.en.made-in-china.com/product/qFwAZaKOMhtf/China-Bathroom-Bath-LED-Cosmetic-Smart-Anti-Fog-Antique-Makeup-Wall-Mounted-Vanity-Side-Shaving-Dressing-Unframed-Frameless-Defogger-Bluetooth-Aluminium-Silver-Mirror.html,,M004,0.9,USD,,,"Bathroom Bath LEDCosmeticSmart Anti Fog Antique Makeup Wall Mounted Vanity Side Shaving Dressing Unframed Frameless Defogger Bluetooth Aluminium SilverMirrorUS$ 0.9-99/ Box1 Box(MOQ)Teckson Glass Co., LimitedTeckson Glass Co., LimitedDiamond MemberAudited SupplierShandong, ChinaView larger video & image5(5.0)""Fast Delivery""Fast Delivery","Teckson Glass Co., Limited",https://tecksonglass.en.made-in-china.com,5.0,5.0,"Post Sourcing Request
















                                    Teckson Glass Co.","Shandong, China","No. 31 Longcheng Rd, Qingdao, Shandong",,2025-08-12T21:48:32.160043,
cosmetic mirror,Custom Compact MakeupMirrorCosmeticRectangle Pocket Make upMirrorfor Travel,https://hzsunshing.en.made-in-china.com/product/vTZYOQlCrKkU/China-Custom-Compact-Makeup-Mirror-Cosmetic-Rectangle-Pocket-Make-up-Mirror-for-Travel.html,3923100000,SS-6-M01,0.4,USD,1000.0,,"Custom Compact MakeupMirrorCosmeticRectangle Pocket Make upMirrorfor TravelUS$ 0.4-0.5/ Piece1000 Pieces(MOQ)Sunshing Plastic Co., LimitedSunshing Plastic Co., LimitedGold MemberAudited SupplierSecured TradingGuangdong, ChinaEnjoy trading protection from Made-in-China.comView larger video & image5(5.0)""Fast Dispatch""Fast Dispatch","Sunshing Plastic Co., Limited",https://hzsunshing.en.made-in-china.com,5.0,5.0,"Post Sourcing Request
















                                    Sunshing Plastic Co.","Guangdong, China","N0.1,GANPI INDUSTRIAL ZONE,ZHENLONG TOWN",,2025-08-12T21:48:38.580171,
cosmetic mirror,4*AA Battery Portable Table Private Label LEDCosmeticMirror,https://ningbovision.en.made-in-china.com/product/KwiaeYACLVcS/China-4-AA-Battery-Portable-Table-Private-Label-LED-Cosmetic-Mirror.html,9405409000,WS-mirror-02-B,2.5,USD,200.0,,"4*AA Battery Portable Table Private Label LEDCosmeticMirrorUS$ 2.5-3.3/ Piece200 Pieces(MOQ)Ningbo Vision Lighting Technology Co., Ltd.Ningbo Vision Lighting Technology Co., Ltd.Diamond MemberAudited SupplierZhejiang, ChinaManufacturer/Factory & Trading CompanyView larger video & image","Ningbo Vision Lighting Technology Co., Ltd.",https://ningbovision.en.made-in-china.com,,,"Strip light
											



																								All Group","Zhejiang, China","No 28, Hongxi Industrial Zone 2, Chunhu street",,2025-08-12T21:48:43.497862,
cosmetic mirror,Modern DesignCosmeticMake up Wall LEDMirrorMirrorwith Touch Sensor Defogger Bluetooth Amplifier Digital Clock,https://jhglass.en.made-in-china.com/product/XOQGRsHbYYAr/China-Modern-Design-Cosmetic-Make-up-Wall-LED-Mirror-Mirror-with-Touch-Sensor-Defogger-Bluetooth-Amplifier-Digital-Clock.html,7007190090,LED,12.0,USD,50.0,,"Modern DesignCosmeticMake up Wall LEDMirrorMirrorwith Touch Sensor Defogger Bluetooth Amplifier Digital ClockUS$ 12/ Piece50 Pieces(MOQ)Hangzhou Jinghu Glass Co., Ltd.Hangzhou Jinghu Glass Co., Ltd.Diamond MemberAudited SupplierSecured TradingZhejiang, ChinaEnjoy trading protection from Made-in-China.comView larger video & image5(3.7)""Fast Dispatch""Fast Dispatch","Hangzhou Jinghu Glass Co., Ltd.",https://jhglass.en.made-in-china.com,,,"Post Sourcing Request













Hangzhou Jinghu Glass Co.","Zhejiang, China","No 563, North Shixin Road, Xiaoshan District",,2025-08-12T21:48:51.366382,
cosmetic mirror,Fashion LED Bathroom Wall DecorativeCosmeticMirrorwith Light,https://strivebathrooms.en.made-in-china.com/product/KveJMzOUfScG/China-Fashion-LED-Bathroom-Wall-Decorative-Cosmetic-Mirror-with-Light.html,7009910090,LED-1020,14.0,USD,20.0,,"Fashion LED Bathroom Wall DecorativeCosmeticMirrorwith LightUS$ 14-17/ Set20 Sets(MOQ)Hangzhou Strive Sanitary Ware Co., Ltd.Hangzhou Strive Sanitary Ware Co., Ltd.Diamond MemberAudited SupplierZhejiang, ChinaView larger video & image","Hangzhou Strive Sanitary Ware Co., Ltd.",https://strivebathrooms.en.made-in-china.com,,,Hangzhou Strive Sanitary Ware Co.,"Zhejiang, China","Dangshan Town, Xiaoshan District, Hangzhou",,2025-08-12T21:48:55.213808,
cosmetic mirror,Fancy Design Apple Shape PU LeatherCosmeticMirror,https://goldenonechina.en.made-in-china.com/product/gXNQDGRonbks/China-Fancy-Design-Apple-Shape-PU-Leather-Cosmetic-Mirror.html,,CM43,1.2,USD,500.0,,"Fancy Design Apple Shape PU LeatherCosmeticMirrorUS$ 1.2/ Piece500 Pieces(MOQ)Golden One (Jiangmen) Gifts Co., LimitedGolden One (Jiangmen) Gifts Co., LimitedDiamond MemberAudited SupplierGuangdong, ChinaManufacturer/Factory & Trading CompanyView larger video & image5(5.0)""Fast Delivery""Fast Delivery","Golden One (Jiangmen) Gifts Co., Limited",https://goldenonechina.en.made-in-china.com,5.0,5.0,GOLDEN ONE China LIMITED,"Guangdong, China","Unit C, 8th Floor, Tian Yuan Building",,2025-08-12T21:49:11.573434,
cosmetic mirror,Hot Selling Creative High Quality Metal PocketMirrorCosmeticPortable Folding Stainless Steel CompactMirror,https://zsxdpins.en.made-in-china.com/product/FTopanEAIYcB/China-Hot-Selling-Creative-High-Quality-Metal-Pocket-Mirror-Cosmetic-Portable-Folding-Stainless-Steel-Compact-Mirror.html,,X2024042503,0.7,USD,50.0,,"Hot Selling Creative High Quality Metal PocketMirrorCosmeticPortable Folding Stainless Steel CompactMirrorUS$ 0.7/ Piece50 Pieces(MOQ)Zhongshan Xiangda Metal Arts & Crafts Co., Ltd.Zhongshan Xiangda Metal Arts & Crafts Co., Ltd.Diamond MemberAudited SupplierGuangdong, ChinaManufacturer/Factory & Trading CompanyView larger video & image5(5.0)""Fast Dispatch""Fast Dispatch","Zhongshan Xiangda Metal Arts & Crafts Co., Ltd.",https://zsxdpins.en.made-in-china.com,5.0,5.0,Factory & Trading Company,"Guangdong, China","No. 1, Shengfeng Heyuan Road, Xiaolan Town",,2025-08-12T21:49:17.010528,
cosmetic mirror,Home Products Vanity SalonCosmeticDressing Wall Decoration Furniture Aluminium Stainless Steel Washroom Floor FrameMirror,https://jhglass.en.made-in-china.com/product/lTpYhGAHWfDQ/China-Home-Products-Vanity-Salon-Cosmetic-Dressing-Wall-Decoration-Furniture-Aluminium-Stainless-Steel-Washroom-Floor-Frame-Mirror.html,7009910090,,9.8,USD,50.0,,"Home Products Vanity SalonCosmeticDressing Wall Decoration Furniture Aluminium Stainless Steel Washroom Floor FrameMirrorUS$ 9.8-18/ Piece50 Pieces(MOQ)Hangzhou Jinghu Glass Co., Ltd.Hangzhou Jinghu Glass Co., Ltd.Diamond MemberAudited SupplierSecured TradingZhejiang, ChinaEnjoy trading protection from Made-in-China.comView larger video & image5(3.7)""Fast Dispatch""Fast Dispatch","Hangzhou Jinghu Glass Co., Ltd.",https://jhglass.en.made-in-china.com,,,"Post Sourcing Request













Hangzhou Jinghu Glass Co.","Zhejiang, China","No 563, North Shixin Road, Xiaoshan District",,2025-08-12T21:49:41.476590,
cosmetic mirror,Bathroom Decoration Furniture CheapCosmeticLightedMirrorwith Glass Shelf,https://strivebathrooms.en.made-in-china.com/product/pvHxFWyuEjha/China-Bathroom-Decoration-Furniture-Cheap-Cosmetic-Lighted-Mirror-with-Glass-Shelf.html,7009910090,LZ-392,12.0,USD,50.0,,"Bathroom Decoration Furniture CheapCosmeticLightedMirrorwith Glass ShelfUS$ 12/ Set50 Sets(MOQ)Hangzhou Strive Sanitary Ware Co., Ltd.Hangzhou Strive Sanitary Ware Co., Ltd.Diamond MemberAudited SupplierZhejiang, ChinaView larger video & image","Hangzhou Strive Sanitary Ware Co., Ltd.",https://strivebathrooms.en.made-in-china.com,,,Hangzhou Strive Sanitary Ware Co.,"Zhejiang, China","Dangshan Town, Xiaoshan District, Hangzhou",,2025-08-12T21:49:45.317572,
cosmetic mirror,Shiny Crystal Stone Decoration Printed MetalCosmeticMirror,https://goldenonechina.en.made-in-china.com/product/RKsmdeYCkbhH/China-Shiny-Crystal-Stone-Decoration-Printed-Metal-Cosmetic-Mirror.html,,CM62,0.9,USD,500.0,,"Shiny Crystal Stone Decoration Printed MetalCosmeticMirrorUS$ 0.9/ Piece500 Pieces(MOQ)Golden One (Jiangmen) Gifts Co., LimitedGolden One (Jiangmen) Gifts Co., LimitedDiamond MemberAudited SupplierGuangdong, ChinaManufacturer/Factory & Trading CompanyView larger video & image5(5.0)""On-time Delivery""On-time Delivery","Golden One (Jiangmen) Gifts Co., Limited",https://goldenonechina.en.made-in-china.com,5.0,5.0,GOLDEN ONE China LIMITED,"Guangdong, China","Unit C, 8th Floor, Tian Yuan Building",,2025-08-12T21:49:49.300379,
cosmetic mirror,Custom Logo MetalCosmeticMirrorFlower Compact MakeupMirror,https://zsxdpins.en.made-in-china.com/product/iYApBPZugGWo/China-Custom-Logo-Metal-Cosmetic-Mirror-Flower-Compact-Makeup-Mirror.html,,X2025070902,0.88,USD,50.0,,"Custom Logo MetalCosmeticMirrorFlower Compact MakeupMirrorUS$ 0.88-1.1/ Piece50 Pieces(MOQ)Zhongshan Xiangda Metal Arts & Crafts Co., Ltd.Zhongshan Xiangda Metal Arts & Crafts Co., Ltd.Diamond MemberAudited SupplierSecured TradingGuangdong, ChinaManufacturer/Factory & Trading CompanyEnjoy trading protection from Made-in-China.comView larger video & image5(5.0)""Fast Dispatch""Fast Dispatch","Zhongshan Xiangda Metal Arts & Crafts Co., Ltd.",https://zsxdpins.en.made-in-china.com,5.0,5.0,Factory & Trading Company,"Guangdong, China","No. 1, Shengfeng Heyuan Road, Xiaolan Town",,2025-08-12T21:49:53.599215,
